statement ok
DROP TABLE IF EXISTS integers

statement ok
CREATE TABLE integers(i INTEGER)

statement ok
INSERT INTO integers VALUES (1)

query I
SELECT * FROM integers WHERE i > 0
----
1

# update the same tuple a bunch of times in the same transaction and then rollback

statement ok
BEGIN TRANSACTION

statement ok
UPDATE integers SET i=1+1 WHERE i=1;

query I
SELECT COUNT(*) FROM (SELECT * FROM integers WHERE i > 0 EXCEPT SELECT 1 + 1) t1;
----
0

statement ok
UPDATE integers SET i=2+1 WHERE i=2;

query I
SELECT COUNT(*) FROM (SELECT * FROM integers WHERE i > 0 EXCEPT SELECT 2 + 1) t1;
----
0

statement ok
UPDATE integers SET i=3+1 WHERE i=3;

query I
SELECT COUNT(*) FROM (SELECT * FROM integers WHERE i > 0 EXCEPT SELECT 3 + 1) t1;
----
0

statement ok
UPDATE integers SET i=4+1 WHERE i=4;

query I
SELECT COUNT(*) FROM (SELECT * FROM integers WHERE i > 0 EXCEPT SELECT 4 + 1) t1;
----
0

statement ok
UPDATE integers SET i=5+1 WHERE i=5;

query I
SELECT COUNT(*) FROM (SELECT * FROM integers WHERE i > 0 EXCEPT SELECT 5 + 1) t1;
----
0

statement ok
UPDATE integers SET i=6+1 WHERE i=6;

query I
SELECT COUNT(*) FROM (SELECT * FROM integers WHERE i > 0 EXCEPT SELECT 6 + 1) t1;
----
0

statement ok
UPDATE integers SET i=7+1 WHERE i=7;

query I
SELECT COUNT(*) FROM (SELECT * FROM integers WHERE i > 0 EXCEPT SELECT 7 + 1) t1;
----
0

statement ok
UPDATE integers SET i=8+1 WHERE i=8;

query I
SELECT COUNT(*) FROM (SELECT * FROM integers WHERE i > 0 EXCEPT SELECT 8 + 1) t1;
----
0

statement ok
UPDATE integers SET i=9+1 WHERE i=9;

query I
SELECT COUNT(*) FROM (SELECT * FROM integers WHERE i > 0 EXCEPT SELECT 9 + 1) t1;
----
0

statement ok
UPDATE integers SET i=10+1 WHERE i=10;

query I
SELECT COUNT(*) FROM (SELECT * FROM integers WHERE i > 0 EXCEPT SELECT 10 + 1) t1;
----
0

statement ok
ROLLBACK

query I
SELECT * FROM integers WHERE i > 0
----
1

# now update the same tuple a bunch of times in the same transaction and then commit

statement ok
BEGIN TRANSACTION

statement ok
UPDATE integers SET i=1+1 WHERE i=1;

query I
SELECT COUNT(*) FROM (SELECT * FROM integers WHERE i > 0 EXCEPT SELECT 1 + 1) t1;
----
0

statement ok
UPDATE integers SET i=2+1 WHERE i=2;

query I
SELECT COUNT(*) FROM (SELECT * FROM integers WHERE i > 0 EXCEPT SELECT 2 + 1) t1;
----
0

statement ok
UPDATE integers SET i=3+1 WHERE i=3;

query I
SELECT COUNT(*) FROM (SELECT * FROM integers WHERE i > 0 EXCEPT SELECT 3 + 1) t1;
----
0

statement ok
UPDATE integers SET i=4+1 WHERE i=4;

query I
SELECT COUNT(*) FROM (SELECT * FROM integers WHERE i > 0 EXCEPT SELECT 4 + 1) t1;
----
0

statement ok
UPDATE integers SET i=5+1 WHERE i=5;

query I
SELECT COUNT(*) FROM (SELECT * FROM integers WHERE i > 0 EXCEPT SELECT 5 + 1) t1;
----
0

statement ok
UPDATE integers SET i=6+1 WHERE i=6;

query I
SELECT COUNT(*) FROM (SELECT * FROM integers WHERE i > 0 EXCEPT SELECT 6 + 1) t1;
----
0

statement ok
UPDATE integers SET i=7+1 WHERE i=7;

query I
SELECT COUNT(*) FROM (SELECT * FROM integers WHERE i > 0 EXCEPT SELECT 7 + 1) t1;
----
0

statement ok
UPDATE integers SET i=8+1 WHERE i=8;

query I
SELECT COUNT(*) FROM (SELECT * FROM integers WHERE i > 0 EXCEPT SELECT 8 + 1) t1;
----
0

statement ok
UPDATE integers SET i=9+1 WHERE i=9;

query I
SELECT COUNT(*) FROM (SELECT * FROM integers WHERE i > 0 EXCEPT SELECT 9 + 1) t1;
----
0

statement ok
UPDATE integers SET i=10+1 WHERE i=10;

query I
SELECT COUNT(*) FROM (SELECT * FROM integers WHERE i > 0 EXCEPT SELECT 10 + 1) t1;
----
0

statement ok
COMMIT

query I
SELECT * FROM integers WHERE i > 0
----
11
