## Copyright 2023 Databend Cloud
##
## Licensed under the Elastic License, Version 2.0 (the "License");
## you may not use this file except in compliance with the License.
## You may obtain a copy of the License at
##
##     https://www.elastic.co/licensing/elastic-license
##
## Unless required by applicable law or agreed to in writing, software
## distributed under the License is distributed on an "AS IS" BASIS,
## WITHOUT WARRANTIES OR CONDITIONS OF ANY KIND, either express or implied.
## See the License for the specific language governing permissions and
## limitations under the License.

statement ok
DROP DATABASE IF EXISTS test_stream

statement ok
CREATE DATABASE test_stream

statement ok
USE test_stream

statement ok
drop table if exists t

statement ok
create table t(a int)

statement ok
insert into t values(1)

statement ok
alter table t set options(change_tracking=true)

statement ok
create stream if not exists s on table t

statement error 2732
create stream s on table t

statement ok
insert into t values(2)

statement error 1025
create stream s1 on table t1

statement ok
create stream s1 on table t

statement ok
insert into t values(3)

statement ok
optimize table t compact

query I
select * from t
----
1
2
3

query I
select * from s
----
2
3

query ITB
select a, change$action, change$is_update from s1
----
3 INSERT 0

statement ok
create stream s2 on table t at (stream => s) comment='this is a stream'

query I
select * from s2
----
2
3

statement ok
create table t1(a int)

statement ok
insert into t1 select * from s

query I
select * from s
----

statement ok
insert into t values(4)

statement ok
replace into t1 on(a) select * from s

query I
select * from t1 order by a
----
2
3
4

statement ok
set enable_experimental_merge_into = 1

statement ok
merge into t1 using (select * from s1) as t2 on t1.a = t2.a when matched then delete

query I
select * from t1
----
2

query I
select * from s1
----

query I
select * from s2 order by a
----
2
3
4

statement ok
create table t2(a int)

statement ok
create stream s3 on table t2

statement ok
set hide_options_in_show_create_table=0

query TT
show create table t2
----
t2 CREATE TABLE `t2` (   `a` INT NULL ) ENGINE=FUSE CHANGE_TRACKING='true' COMPRESSION='zstd' STORAGE_FORMAT='parquet'

statement ok
insert into t2 values(3),(4)

query I
select * from s3
----
3
4

statement ok
insert into t1 select s2.a from s2 join s3 on s2.a = s3.a

query I
select * from t1 order by a
----
2
3
4

query I
select * from s2
----

query I
select * from s3
----

statement ok
drop stream s3

statement ok
drop table t2 all

query TTTTT
select catalog, database, name, mode, table_name, comment from system.streams where database='test_stream' order by name
----
default test_stream s append_only test_stream.t (empty)
default test_stream s1 append_only test_stream.t (empty)
default test_stream s2 append_only test_stream.t this is a stream

statement ok
drop stream s

statement ok
drop stream s1

statement error 2730
drop stream s1

statement error 1302
drop stream t1

statement ok
drop table t1 all

statement ok
alter table t set options(change_tracking = false)

query TTT
select name, invalid_reason from system.streams where database='test_stream' order by name
----
s2 Change tracking is not enabled for table 'test_stream.t'

statement ok
drop table t all

query TTT
select name, invalid_reason from system.streams where database='test_stream' order by name
----
s2 Unknown table 't'

statement ok
create table t(a int) change_tracking = true

statement error 2733
select * from s2

statement error 1302
drop table s2

statement ok
drop stream s2

###############
# issue 14062 #
###############

statement ok
create table t_14062 (c int);

statement ok
create stream s_14062 on table t_14062 ;

statement ok
insert into t_14062 values(1);

query T
select * from s_14062 where change$action = 'INSERT';
----
1

query T
select * from s_14062 where change$is_update = false;
----
1

query T
select * from s_14062 where change$row_id = '1';
----

statement ok
drop stream s_14062

statement ok
drop table t_14062 all

######################
# end of issue 14062 #
######################

###############
# issue 14099 #
###############

statement ok
create table t_14099 (a int, b int);

statement ok
create stream s_14099 on table t_14099 ;

statement ok
insert into t_14099 values(1, 1), (2, 2);

query T
select * from s_14099 where a>1 limit 1;
----
2 2

statement ok
drop table t_14099 all

statement ok
drop stream s_14099

######################
# end of issue 14099 #
######################

statement ok
DROP DATABASE IF EXISTS test_stream
