## Copyright 2023 Databend Cloud
##
## Licensed under the Elastic License, Version 2.0 (the "License");
## you may not use this file except in compliance with the License.
## You may obtain a copy of the License at
##
##     https://www.elastic.co/licensing/elastic-license
##
## Unless required by applicable law or agreed to in writing, software
## distributed under the License is distributed on an "AS IS" BASIS,
## WITHOUT WARRANTIES OR CONDITIONS OF ANY KIND, either express or implied.
## See the License for the specific language governing permissions and
## limitations under the License.

statement ok
DROP DATABASE IF EXISTS test_virtual_column

statement ok
CREATE DATABASE test_virtual_column

statement ok
USE test_virtual_column

statement ok
set enable_experimental_virtual_column = 1;

statement ok
drop table if exists t1

statement ok
create table t1(id int, val json) storage_format = 'native'

statement ok
insert into t1 values(1, '{"a":11,"b":1,"c":"test"}'), (2, '{"a":22,"b":2,"c":"data"}'), (3, '3')

query TTTITT
show virtual columns from t1
----

statement ok
insert into t1 values(4, '{"a":44,"b":4,"c":"value"}'), (5, '{"a":55,"b":5,"c":"bend"}'), (6, '6')

query ITIT
select id, val['a'], val['b'], val['c'] from t1 order by id
----
1 11 1 "test"
2 22 2 "data"
3 NULL NULL NULL
4 44 4 "value"
5 55 5 "bend"
6 NULL NULL NULL

query ITITT
select id, val['a'], val['b'], val['c'], val from t1 order by id
----
1 11 1 "test" {"a":11,"b":1,"c":"test"}
2 22 2 "data" {"a":22,"b":2,"c":"data"}
3 NULL NULL NULL 3
4 44 4 "value" {"a":44,"b":4,"c":"value"}
5 55 5 "bend" {"a":55,"b":5,"c":"bend"}
6 NULL NULL NULL 6

query ITITT
select id, val['a'], val['b'], val['c'], val['d'] from t1 order by id
----
1 11 1 "test" NULL
2 22 2 "data" NULL
3 NULL NULL NULL NULL
4 44 4 "value" NULL
5 55 5 "bend" NULL
6 NULL NULL NULL NULL

query ITIT
select id, val['a'], val['b'], val['c'] from t1 where val=3 or val=6 order by id
----
3 NULL NULL NULL
6 NULL NULL NULL

query ITTT
select id, val['a'], val['b'], val from t1 where val=3 or val=6 order by id
----
3 NULL NULL 3
6 NULL NULL 6

query ITIT
select id, val['a'], val['b'], val['c'] from t1 where val['a']=11 or val['a']=44 order by id
----
1 11 1 "test"
4 44 4 "value"

query ITITT
select id, val['a'], val['b'], val['c'], val from t1 where val['a']=11 or val['a']=44 order by id
----
1 11 1 "test" {"a":11,"b":1,"c":"test"}
4 44 4 "value" {"a":44,"b":4,"c":"value"}

query IT
select max(id), val:a from t1 group by val:a order by val:a
----
1 11
2 22
4 44
5 55
6 NULL

query ITIT
select t11.id, t11.a, t12.id, t12.a from(select id, val:a as a from t1)t11 join (select id, val:a as a from t1)t12 on t11.a = t12.a order by t11.a
----
1 11 1 11
2 22 2 22
4 44 4 44
5 55 5 55

query ITITI
SELECT r.id, r.val['a'], r.val['b'], r.nval:a, r.nval:b FROM ( SELECT r.id, r.val, r.val as nval FROM t1 AS r) AS r order by id
----
1 11 1 11 1
2 22 2 22 2
3 NULL NULL NULL NULL
4 44 4 44 4
5 55 5 55 5
6 NULL NULL NULL NULL

statement error 1115
REFRESH VIRTUAL COLUMN FOR t1;

statement ok
drop table if exists t2

statement ok
create table t2(id int, val json) storage_format = 'parquet'

statement ok
insert into t2 values(1, '{"a":11,"b":1,"c":"test"}'), (2, '{"a":22,"b":2,"c":"data"}'), (3, '3')

query TTTITT
show virtual columns from t2
----
test_virtual_column t2 val 3000000000 ['a'] UInt64
test_virtual_column t2 val 3000000001 ['b'] UInt64
test_virtual_column t2 val 3000000002 ['c'] String

query II
select row_count, virtual_column_size from fuse_block('test_virtual_column', 't2')
----
3 1032

query III
select block_count, row_count, virtual_column_size from fuse_segment('test_virtual_column', 't2');
----
1 3 1032

query III
select block_count, row_count, virtual_column_size from fuse_snapshot('test_virtual_column', 't2');
----
1 3 1032

query IITTIII
select virtual_block_size, row_count, column_name, column_type, column_id, block_offset, bytes_compressed from fuse_virtual_column('test_virtual_column', 't2')
----
1032 3 val['a'] UInt64 NULL 0 4 40
1032 3 val['b'] UInt64 NULL 1 44 40
1032 3 val['c'] String NULL 2 84 40

query IIIIII
select block_count, row_count, bytes_uncompressed, bytes_compressed, index_size, virtual_block_count from fuse_segment('test_virtual_column', 't2')
----
1 3 134 734 1470 1

statement ok
insert into t2 values(4, '{"a":44,"b":4,"c":"value"}'), (5, '{"a":55,"b":5,"c":"bend"}'), (6, '6')

query ITIT
select id, val['a'], val['b'], val['c'] from t2 order by id
----
1 11 1 "test"
2 22 2 "data"
3 NULL NULL NULL
4 44 4 "value"
5 55 5 "bend"
6 NULL NULL NULL

query ITITT
select id, val['a'], val['b'], val['c'], val from t2 order by id
----
1 11 1 "test" {"a":11,"b":1,"c":"test"}
2 22 2 "data" {"a":22,"b":2,"c":"data"}
3 NULL NULL NULL 3
4 44 4 "value" {"a":44,"b":4,"c":"value"}
5 55 5 "bend" {"a":55,"b":5,"c":"bend"}
6 NULL NULL NULL 6

query ITITT
select id, val['a'], val['b'], val['c'], val['d'] from t2 order by id
----
1 11 1 "test" NULL
2 22 2 "data" NULL
3 NULL NULL NULL NULL
4 44 4 "value" NULL
5 55 5 "bend" NULL
6 NULL NULL NULL NULL

query ITIT
select id, val['a'], val['b'], val['c'] from t2 where val=3 or val=6 order by id
----
3 NULL NULL NULL
6 NULL NULL NULL

query ITTT
select id, val['a'], val['b'], val from t2 where val=3 or val=6 order by id
----
3 NULL NULL 3
6 NULL NULL 6

query ITIT
select id, val['a'], val['b'], val['c'] from t2 where val['a']=11 or val['a']=44 order by id
----
1 11 1 "test"
4 44 4 "value"

query ITITT
select id, val['a'], val['b'], val['c'], val from t2 where val['a']=11 or val['a']=44 order by id
----
1 11 1 "test" {"a":11,"b":1,"c":"test"}
4 44 4 "value" {"a":44,"b":4,"c":"value"}

query IT
select max(id), val:a from t2 group by val:a order by val:a
----
1 11
2 22
4 44
5 55
6 NULL

query ITIT
select t21.id, t21.a, t22.id, t22.a from(select id, val:a as a from t2)t21 join (select id, val:a as a from t2)t22 on t21.a = t22.a order by t21.a
----
1 11 1 11
2 22 2 22
4 44 4 44
5 55 5 55

query ITITI
SELECT r.id, r.val['a'], r.val['b'], r.nval:a, r.nval:b FROM ( SELECT r.id, r.val, r.val as nval FROM t2 AS r) AS r order by id
----
1 11 1 11 1
2 22 2 22 2
3 NULL NULL NULL NULL
4 44 4 44 4
5 55 5 55 5
6 NULL NULL NULL NULL

statement ok
REFRESH VIRTUAL COLUMN FOR t2;

statement ok
create or replace table tweets (id int, data json);

statement ok
INSERT INTO tweets (id, data) VALUES
(1, '{"id":1, "create": "3/06", "text": "a", "user": {"id": 1}}'),
(2, '{"id":2, "create": "3/07", "text": "b", "user": {"id": 3}}'),
(3, '{"id":3, "create": "6/07", "text": "c", "user": {"id": 5}}'),
(4, '{"id":4, "create": "1/08", "text": "a", "user": {"id": 1}, "replies": 9}'),
(5, '{"id":5, "create": "1/10", "text": "b", "user": {"id": 7}, "replies": 3, "geo": {"lat": 1.9}}'),
(6, '{"id":6, "create": "1/11", "text": "c", "user": {"id": 1}, "replies": 2, "geo": null}'),
(7, '{"id":7, "create": "1/12", "text": "d", "user": {"id": 3}, "replies": 0, "geo": {"lat": 2.7}}'),
(8, '{"id":8, "create": "1/13", "text": "x", "user": {"id": 3}, "replies": 1, "geo": {"lat": 3.5}}');

query TTTITT
show virtual columns where table='tweets';
----
test_virtual_column tweets data 3000000000 ['create'] String
test_virtual_column tweets data 3000000001 ['geo']['lat'] Jsonb
test_virtual_column tweets data 3000000002 ['id'] UInt64
test_virtual_column tweets data 3000000003 ['replies'] UInt64
test_virtual_column tweets data 3000000004 ['text'] String
test_virtual_column tweets data 3000000005 ['user']['id'] UInt64

query IITTIITF
select id, data['id'], data['create'], data['text'], data['user']['id'], data['replies'], data['geo'], data['geo']['lat'] from tweets order by id;
----
1 1 "3/06" "a" 1 NULL NULL NULL
2 2 "3/07" "b" 3 NULL NULL NULL
3 3 "6/07" "c" 5 NULL NULL NULL
4 4 "1/08" "a" 1 9 NULL NULL
5 5 "1/10" "b" 7 3 {"lat":1.9} 1.9
6 6 "1/11" "c" 1 2 null NULL
7 7 "1/12" "d" 3 0 {"lat":2.7} 2.7
8 8 "1/13" "x" 3 1 {"lat":3.5} 3.5

statement ok
INSERT INTO tweets (id, data) VALUES
(9, '{"id":9, "create": "2/14", "text": "y", "user": {"id": 5}, "replies": 5, "geo": {"lat": 4.2}, "likes": 25, "tags": ["good", "popular"]}'),
(10, '{"id":10, "create": "2/15", "text": "z", "user": {"id": 7}, "replies": 7, "geo": {"lat": 5.0}, "likes": 10, "tags": ["new", "interesting"]}');

query TTTITT
show virtual columns where table='tweets';
----
test_virtual_column tweets data 3000000000 ['create'] String
test_virtual_column tweets data 3000000001 ['geo']['lat'] Jsonb
test_virtual_column tweets data 3000000002 ['id'] UInt64
test_virtual_column tweets data 3000000003 ['replies'] UInt64
test_virtual_column tweets data 3000000004 ['text'] String
test_virtual_column tweets data 3000000005 ['user']['id'] UInt64
test_virtual_column tweets data 3000000006 ['likes'] UInt64
test_virtual_column tweets data 3000000007 ['tags'] Jsonb

query IITTIITFIT
select id, data['id'], data['create'], data['text'], data['user']['id'], data['replies'], data['geo'], data['geo']['lat'], data['likes'], data['tags'] from tweets order by id;
----
1 1 "3/06" "a" 1 NULL NULL NULL NULL NULL
2 2 "3/07" "b" 3 NULL NULL NULL NULL NULL
3 3 "6/07" "c" 5 NULL NULL NULL NULL NULL
4 4 "1/08" "a" 1 9 NULL NULL NULL NULL
5 5 "1/10" "b" 7 3 {"lat":1.9} 1.9 NULL NULL
6 6 "1/11" "c" 1 2 null NULL NULL NULL
7 7 "1/12" "d" 3 0 {"lat":2.7} 2.7 NULL NULL
8 8 "1/13" "x" 3 1 {"lat":3.5} 3.5 NULL NULL
9 9 "2/14" "y" 5 5 {"lat":4.2} 4.2 25 ["good","popular"]
10 10 "2/15" "z" 7 7 {"lat":5.0} 5.0 10 ["new","interesting"]

query TIIIT
select * from fuse_statistic('test_virtual_column', 'tweets');
----
id 10 0 4 (empty)
data['create'] 10 0 16 (empty)
data['id'] 10 0 8 (empty)
data['replies'] 7 3 8 (empty)
data['text'] 7 0 16 (empty)
data['user']['id'] 6 0 8 (empty)
data['likes'] 2 0 1 (empty)

query TTTIIIITTIT
SHOW STATISTICS FROM TABLE test_virtual_column.tweets;
----
test_virtual_column tweets data 10 10 NULL NULL NULL NULL NULL (empty)
test_virtual_column tweets data['create'] 10 10 10 0 1/08 6/07 16 (empty)
test_virtual_column tweets data['id'] 10 10 10 0 1 10 8 (empty)
test_virtual_column tweets data['likes'] 10 10 2 0 10 25 1 (empty)
test_virtual_column tweets data['replies'] 10 10 7 3 0 9 8 (empty)
test_virtual_column tweets data['text'] 10 10 7 0 a z 16 (empty)
test_virtual_column tweets data['user']['id'] 10 10 6 0 1 7 8 (empty)
test_virtual_column tweets id 10 10 10 0 1 10 4 (empty)

statement ok
UPDATE tweets SET data = '{"id":4, "create": "1/08", "text": "aa", "user": {"id": 1}, "replies": 10}' WHERE id = 4;

query TIIIT
select * from fuse_statistic('test_virtual_column', 'tweets');
----
id 10 0 4 (empty)
data['create'] 10 0 16 (empty)
data['id'] 10 0 8 (empty)
data['replies'] 7 3 8 (empty)
data['text'] 8 0 16 (empty)
data['user']['id'] 6 0 8 (empty)
data['likes'] 2 0 1 (empty)

query TTTIIIITTIT
SHOW STATISTICS FROM TABLE test_virtual_column.tweets;
----
test_virtual_column tweets data 10 10 NULL NULL NULL NULL NULL (empty)
test_virtual_column tweets data['create'] 10 10 10 0 1/08 6/07 16 (empty)
test_virtual_column tweets data['id'] 10 10 10 0 1 10 8 (empty)
test_virtual_column tweets data['likes'] 10 10 2 0 10 25 1 (empty)
test_virtual_column tweets data['replies'] 10 10 7 3 0 10 8 (empty)
test_virtual_column tweets data['text'] 10 10 8 0 a z 16 (empty)
test_virtual_column tweets data['user']['id'] 10 10 6 0 1 7 8 (empty)
test_virtual_column tweets id 10 10 10 0 1 10 4 (empty)

query IITTIITFIT
select id, data['id'], data['create'], data['text'], data['user']['id'], data['replies'], data['geo'], data['geo']['lat'], data['likes'], data['tags'] from tweets order by id;
----
1 1 "3/06" "a" 1 NULL NULL NULL NULL NULL
2 2 "3/07" "b" 3 NULL NULL NULL NULL NULL
3 3 "6/07" "c" 5 NULL NULL NULL NULL NULL
4 4 "1/08" "aa" 1 10 NULL NULL NULL NULL
5 5 "1/10" "b" 7 3 {"lat":1.9} 1.9 NULL NULL
6 6 "1/11" "c" 1 2 null NULL NULL NULL
7 7 "1/12" "d" 3 0 {"lat":2.7} 2.7 NULL NULL
8 8 "1/13" "x" 3 1 {"lat":3.5} 3.5 NULL NULL
9 9 "2/14" "y" 5 5 {"lat":4.2} 4.2 25 ["good","popular"]
10 10 "2/15" "z" 7 7 {"lat":5.0} 5.0 10 ["new","interesting"]

statement ok
UPDATE tweets SET data = '{"id":1, "create": "3/06", "text": "a", "user": {"id": 1}, "likes": 100}' WHERE id = 1;

query IITTIITFIT
select id, data['id'], data['create'], data['text'], data['user']['id'], data['replies'], data['geo'], data['geo']['lat'], data['likes'], data['tags'] from tweets order by id;
----
1 1 "3/06" "a" 1 NULL NULL NULL 100 NULL
2 2 "3/07" "b" 3 NULL NULL NULL NULL NULL
3 3 "6/07" "c" 5 NULL NULL NULL NULL NULL
4 4 "1/08" "aa" 1 10 NULL NULL NULL NULL
5 5 "1/10" "b" 7 3 {"lat":1.9} 1.9 NULL NULL
6 6 "1/11" "c" 1 2 null NULL NULL NULL
7 7 "1/12" "d" 3 0 {"lat":2.7} 2.7 NULL NULL
8 8 "1/13" "x" 3 1 {"lat":3.5} 3.5 NULL NULL
9 9 "2/14" "y" 5 5 {"lat":4.2} 4.2 25 ["good","popular"]
10 10 "2/15" "z" 7 7 {"lat":5.0} 5.0 10 ["new","interesting"]

statement ok
DELETE FROM tweets WHERE id = 8;

query IITTIITFIT
select id, data['id'], data['create'], data['text'], data['user']['id'], data['replies'], data['geo'], data['geo']['lat'], data['likes'], data['tags'] from tweets order by id;
----
1 1 "3/06" "a" 1 NULL NULL NULL 100 NULL
2 2 "3/07" "b" 3 NULL NULL NULL NULL NULL
3 3 "6/07" "c" 5 NULL NULL NULL NULL NULL
4 4 "1/08" "aa" 1 10 NULL NULL NULL NULL
5 5 "1/10" "b" 7 3 {"lat":1.9} 1.9 NULL NULL
6 6 "1/11" "c" 1 2 null NULL NULL NULL
7 7 "1/12" "d" 3 0 {"lat":2.7} 2.7 NULL NULL
9 9 "2/14" "y" 5 5 {"lat":4.2} 4.2 25 ["good","popular"]
10 10 "2/15" "z" 7 7 {"lat":5.0} 5.0 10 ["new","interesting"]

statement ok
INSERT INTO tweets (id, data) VALUES
(11, '{"id":11, "create": "3/16", "text": "w", "user": {"id": 9}, "replies": 2, "geo": {"lat": 1.5}}'),
(12, '{"id":12, "create": "3/17", "text": "v", "user": {"id": 11}, "replies": 4, "geo": {"lat": 2.0}}');

query IITTIITFIT
select id, data['id'], data['create'], data['text'], data['user']['id'], data['replies'], data['geo'], data['geo']['lat'], data['likes'], data['tags'] from tweets order by id;
----
1 1 "3/06" "a" 1 NULL NULL NULL 100 NULL
2 2 "3/07" "b" 3 NULL NULL NULL NULL NULL
3 3 "6/07" "c" 5 NULL NULL NULL NULL NULL
4 4 "1/08" "aa" 1 10 NULL NULL NULL NULL
5 5 "1/10" "b" 7 3 {"lat":1.9} 1.9 NULL NULL
6 6 "1/11" "c" 1 2 null NULL NULL NULL
7 7 "1/12" "d" 3 0 {"lat":2.7} 2.7 NULL NULL
9 9 "2/14" "y" 5 5 {"lat":4.2} 4.2 25 ["good","popular"]
10 10 "2/15" "z" 7 7 {"lat":5.0} 5.0 10 ["new","interesting"]
11 11 "3/16" "w" 9 2 {"lat":1.5} 1.5 NULL NULL
12 12 "3/17" "v" 11 4 {"lat":2.0} 2.0 NULL NULL

statement ok
MERGE INTO tweets AS target
USING (SELECT 13 AS id, parse_json('{"id":13, "create": "4/18", "text": "u", "user": {"id": 13}, "replies": 6, "geo": {"lat": 3.0}}') AS data) AS source
ON target.id = source.id
WHEN MATCHED THEN
  UPDATE SET target.data = source.data
WHEN NOT MATCHED THEN
  INSERT (id, data) VALUES (source.id, source.data);

query IITTIITFIT
select id, data['id'], data['create'], data['text'], data['user']['id'], data['replies'], data['geo'], data['geo']['lat'], data['likes'], data['tags'] from tweets order by id;
----
1 1 "3/06" "a" 1 NULL NULL NULL 100 NULL
2 2 "3/07" "b" 3 NULL NULL NULL NULL NULL
3 3 "6/07" "c" 5 NULL NULL NULL NULL NULL
4 4 "1/08" "aa" 1 10 NULL NULL NULL NULL
5 5 "1/10" "b" 7 3 {"lat":1.9} 1.9 NULL NULL
6 6 "1/11" "c" 1 2 null NULL NULL NULL
7 7 "1/12" "d" 3 0 {"lat":2.7} 2.7 NULL NULL
9 9 "2/14" "y" 5 5 {"lat":4.2} 4.2 25 ["good","popular"]
10 10 "2/15" "z" 7 7 {"lat":5.0} 5.0 10 ["new","interesting"]
11 11 "3/16" "w" 9 2 {"lat":1.5} 1.5 NULL NULL
12 12 "3/17" "v" 11 4 {"lat":2.0} 2.0 NULL NULL
13 13 "4/18" "u" 13 6 {"lat":3.0} 3.0 NULL NULL

statement ok
MERGE INTO tweets AS target
USING (SELECT 12 AS id, parse_json('{"id":12, "create": "3/19", "text": "vv", "user": {"id": 16}, "replies": 10, "geo": {"lat": 4.0}}') AS data) AS source
ON target.id = source.id
WHEN MATCHED THEN
  UPDATE SET target.data = source.data
WHEN NOT MATCHED THEN
  INSERT (id, data) VALUES (source.id, source.data);

query IITTIITFIT
select id, data['id'], data['create'], data['text'], data['user']['id'], data['replies'], data['geo'], data['geo']['lat'], data['likes'], data['tags'] from tweets order by id;
----
1 1 "3/06" "a" 1 NULL NULL NULL 100 NULL
2 2 "3/07" "b" 3 NULL NULL NULL NULL NULL
3 3 "6/07" "c" 5 NULL NULL NULL NULL NULL
4 4 "1/08" "aa" 1 10 NULL NULL NULL NULL
5 5 "1/10" "b" 7 3 {"lat":1.9} 1.9 NULL NULL
6 6 "1/11" "c" 1 2 null NULL NULL NULL
7 7 "1/12" "d" 3 0 {"lat":2.7} 2.7 NULL NULL
9 9 "2/14" "y" 5 5 {"lat":4.2} 4.2 25 ["good","popular"]
10 10 "2/15" "z" 7 7 {"lat":5.0} 5.0 10 ["new","interesting"]
11 11 "3/16" "w" 9 2 {"lat":1.5} 1.5 NULL NULL
12 12 "3/19" "vv" 16 10 {"lat":4.0} 4.0 NULL NULL
13 13 "4/18" "u" 13 6 {"lat":3.0} 3.0 NULL NULL

query I
SELECT count(*) FROM fuse_virtual_column('test_virtual_column', 'tweets');
----
27

statement ok
set enable_experimental_virtual_column = 0;

statement ok
INSERT INTO tweets FROM (SELECT * FROM tweets);

query I
SELECT count(*) FROM fuse_virtual_column('test_virtual_column', 'tweets');
----
27

statement error
REFRESH VIRTUAL COLUMN FOR tweets;

statement ok
set enable_experimental_virtual_column = 1;

statement ok
REFRESH VIRTUAL COLUMN FOR tweets;

# Compact tweets table, so that number of automatic detected virtual columns could be stablized
statement ok
optimize table test_virtual_column.tweets compact

query I
SELECT count(*) FROM fuse_virtual_column('test_virtual_column', 'tweets');
----
8

query IITTIITFIT
select id, data['id'], data['create'], data['text'], data['user']['id'], data['replies'], data['geo'], data['geo']['lat'], data['likes'], data['tags'] from tweets order by id;
----
1 1 "3/06" "a" 1 NULL NULL NULL 100 NULL
1 1 "3/06" "a" 1 NULL NULL NULL 100 NULL
2 2 "3/07" "b" 3 NULL NULL NULL NULL NULL
2 2 "3/07" "b" 3 NULL NULL NULL NULL NULL
3 3 "6/07" "c" 5 NULL NULL NULL NULL NULL
3 3 "6/07" "c" 5 NULL NULL NULL NULL NULL
4 4 "1/08" "aa" 1 10 NULL NULL NULL NULL
4 4 "1/08" "aa" 1 10 NULL NULL NULL NULL
5 5 "1/10" "b" 7 3 {"lat":1.9} 1.9 NULL NULL
5 5 "1/10" "b" 7 3 {"lat":1.9} 1.9 NULL NULL
6 6 "1/11" "c" 1 2 null NULL NULL NULL
6 6 "1/11" "c" 1 2 null NULL NULL NULL
7 7 "1/12" "d" 3 0 {"lat":2.7} 2.7 NULL NULL
7 7 "1/12" "d" 3 0 {"lat":2.7} 2.7 NULL NULL
9 9 "2/14" "y" 5 5 {"lat":4.2} 4.2 25 ["good","popular"]
9 9 "2/14" "y" 5 5 {"lat":4.2} 4.2 25 ["good","popular"]
10 10 "2/15" "z" 7 7 {"lat":5.0} 5.0 10 ["new","interesting"]
10 10 "2/15" "z" 7 7 {"lat":5.0} 5.0 10 ["new","interesting"]
11 11 "3/16" "w" 9 2 {"lat":1.5} 1.5 NULL NULL
11 11 "3/16" "w" 9 2 {"lat":1.5} 1.5 NULL NULL
12 12 "3/19" "vv" 16 10 {"lat":4.0} 4.0 NULL NULL
12 12 "3/19" "vv" 16 10 {"lat":4.0} 4.0 NULL NULL
13 13 "4/18" "u" 13 6 {"lat":3.0} 3.0 NULL NULL
13 13 "4/18" "u" 13 6 {"lat":3.0} 3.0 NULL NULL

statement ok
CREATE OR REPLACE TABLE STUDENT_GRADES (
  SCHOOL_ID VARCHAR,
  STUDENT_ID VARCHAR,
  GRADE_CODE VARCHAR,
  GRADE_DESCRIPTION VARCHAR,
  HONOR_ROLL VARCHAR(1)
);

statement ok
CREATE OR REPLACE TABLE SCHOOL (
  SCHOOL_ID VARCHAR,
  SCHOOL_CODE VARCHAR
);

statement ok
CREATE OR REPLACE TABLE Student_Current (
  id VARCHAR,
  school_code VARCHAR,
  update_date TIMESTAMP
);

statement ok
CREATE OR REPLACE TABLE Academic_Record (
  student_id VARCHAR,
  school_code VARCHAR,
  record_data VARIANT
);

statement ok
INSERT INTO SCHOOL VALUES
  ('S001', 'HIGH_SCHOOL'),
  ('S002', 'MIDDLE_SCHOOL'),
  ('S003', 'DISTRICT');

statement ok
INSERT INTO Student_Current VALUES
  ('ST001', 'HIGH_SCHOOL', '2023-05-12T10:00:00.000000'),
  ('ST002', 'MIDDLE_SCHOOL', '2023-05-12T11:00:00.000000'),
  ('ST003', 'DISTRICT', '2023-05-12T12:00:00.000000');

statement ok
INSERT INTO Academic_Record VALUES
  ('ST001', 'HIGH_SCHOOL', '{
    "academic": {
      "performance": {
        "grade_code": "A",
        "grade_desc": "Excellent",
        "extra_credits": 2
      }
    },
    "eligible_schools": ["HIGH_SCHOOL", "DISTRICT"]
  }'),
  ('ST002', 'MIDDLE_SCHOOL', '{
    "academic": {
      "performance": {
        "grade_code": "B",
        "grade_desc": "Good",
        "extra_credits": 1
      }
    },
    "eligible_schools": ["MIDDLE_SCHOOL"]
  }'),
  ('ST003', 'DISTRICT', '{
    "academic": {
      "performance": {
        "grade_code": "C",
        "grade_desc": "Average",
        "extra_credits": 0
      }
    },
    "eligible_schools": ["HIGH_SCHOOL", "ELEMENTARY"]
  }');

query ??
MERGE INTO STUDENT_GRADES tgt USING
(
  SELECT *
  FROM
  (
    SELECT
        s.school_id,
        sc.id AS student_id,
        ar.record_data:academic.performance.grade_code AS grade_code,
        ar.record_data:academic.performance.grade_desc AS grade_description,
        CASE WHEN ar.record_data:academic.performance.extra_credits::INT > 0 THEN 'Y'
            ELSE 'N' END AS honor_roll,
        ROW_NUMBER() OVER (PARTITION BY s.school_id, sc.id ORDER BY NULL) row_number
    FROM Student_Current sc
    JOIN Academic_Record ar ON sc.id = ar.student_id
    JOIN SCHOOL s ON s.SCHOOL_CODE = sc.school_code OR
                    (ar.school_code = 'DISTRICT' AND s.school_code IN (ar.record_data:eligible_schools))
    WHERE sc.update_date >= '2023-05-01T00:00:00.000000'
  )
  WHERE row_number = 1
) src ON src.school_id = tgt.school_id
    AND src.student_id = tgt.student_id
WHEN MATCHED THEN
UPDATE SET
  tgt.GRADE_CODE = src.GRADE_CODE,
  tgt.GRADE_DESCRIPTION = src.GRADE_DESCRIPTION,
  tgt.HONOR_ROLL = src.HONOR_ROLL
WHEN NOT MATCHED THEN
INSERT (
  SCHOOL_ID,
  STUDENT_ID,
  GRADE_CODE,
  GRADE_DESCRIPTION,
  HONOR_ROLL
) VALUES (
  src.SCHOOL_ID,
  src.STUDENT_ID,
  src.GRADE_CODE,
  src.GRADE_DESCRIPTION,
  src.HONOR_ROLL
);
----
3 0

query TTTTT
SELECT * FROM STUDENT_GRADES ORDER BY school_id;
----
S001 ST001 A Excellent Y
S002 ST002 B Good Y
S003 ST003 C Average N

statement ok
CREATE OR REPLACE TABLE test_stream (
    id INT,
    data1 VARIANT,
    data2 VARIANT
);

statement ok
INSERT INTO test_stream (id, data1, data2) VALUES 
(1, '{"name": "John", "age": 25, "address": {"city": "New York", "district": "Manhattan"}}', '{"scores": [85, 90, 78], "hobbies": ["reading", "swimming"]}'),
(2, '{"name": "Alice", "age": 30, "address": {"city": "San Francisco", "district": "Mission"}}', '{"scores": [92, 88, 95], "hobbies": ["basketball", "music"]}'),
(3, '{"name": "Bob", "age": 28, "address": {"city": "Chicago", "district": "Loop"}}', '{"scores": [76, 82, 90], "hobbies": ["travel", "photography"]}'),
(4, '{"name": "Emma", "age": 22, "address": {"city": "New York", "district": "Brooklyn"}}', '{"scores": [88, 91, 85], "hobbies": ["coding", "movies"]}'),
(5, '{"name": "Michael", "age": 35, "address": {"city": "Seattle", "district": "Downtown"}}', '{"scores": [95, 93, 97], "hobbies": ["golf", "cooking"]}'),
(6, '{"name": "Sarah", "age": 27, "address": {"city": "Boston", "district": "Back Bay"}}', '{"scores": [82, 85, 80], "hobbies": ["fishing", "painting"]}'),
(7, '{"name": "David", "age": 31, "address": {"city": "New York", "district": "Queens"}}', '{"scores": [79, 88, 92], "hobbies": ["soccer", "chess"]}'),
(8, '{"name": "Jennifer", "age": 29, "address": {"city": "San Francisco", "district": "Marina"}}', '{"scores": [86, 89, 84], "hobbies": ["yoga", "dancing"]}'),
(9, '{"name": "Richard", "age": 33, "address": {"city": "Austin", "district": "Downtown"}}', '{"scores": [91, 87, 93], "hobbies": ["hiking", "cycling"]}'),
(10, '{"name": "Lisa", "age": 26, "address": {"city": "Chicago", "district": "River North"}}', '{"scores": [83, 81, 89], "hobbies": ["gaming", "reading"]}');

query ??????
show virtual columns from test_stream;
----
test_virtual_column test_stream data1 3000000000 ['address']['city'] String
test_virtual_column test_stream data1 3000000001 ['address']['district'] String
test_virtual_column test_stream data1 3000000002 ['age'] UInt64
test_virtual_column test_stream data1 3000000003 ['name'] String
test_virtual_column test_stream data2 3000000004 ['hobbies'] Jsonb
test_virtual_column test_stream data2 3000000005 ['scores'] Jsonb

query ITTTTT
SELECT 
    id,
    data1:name AS name,
    data1:age AS age,
    data1:address:city AS city,
    data2:hobbies[0] AS first_hobby,
    data2:hobbies[1] AS second_hobby
FROM test_stream;
----
1 "John" 25 "New York" "reading" "swimming"
2 "Alice" 30 "San Francisco" "basketball" "music"
3 "Bob" 28 "Chicago" "travel" "photography"
4 "Emma" 22 "New York" "coding" "movies"
5 "Michael" 35 "Seattle" "golf" "cooking"
6 "Sarah" 27 "Boston" "fishing" "painting"
7 "David" 31 "New York" "soccer" "chess"
8 "Jennifer" 29 "San Francisco" "yoga" "dancing"
9 "Richard" 33 "Austin" "hiking" "cycling"
10 "Lisa" 26 "Chicago" "gaming" "reading"

statement ok
CREATE OR REPLACE TABLE test2 (
    id INT,
    data1 VARIANT,
    data2 VARIANT
);

statement ok
INSERT INTO test2 (id, data1, data2) VALUES 
(1, '{"name": "John", "address": {"city": "New York", "district": "Manhattan"}}', '{"product_id": 101}'),
(2, '{"name": "Alice", "address": {"city": "San Francisco", "district": "Mission"}}', '{"product_id": 102, "price": 10.2}'),
(3, '{"name": "Bob", "age": 28, "address": {"city": "Chicago", "district": "Loop"}}', '{"product_id": 103, "price": 10.3}'),
(4, '{"name": "Emma", "age": 22, "address": {"district": "Brooklyn"}}', '{"product_id": 104, "price": 10.4}'),
(5, '{"name": "Michael", "age": 35, "address": {"city": "Seattle", "district": "Downtown"}}', '{"price": "10.5"}'),
(6, '{"age": 27, "address": {"city": "Boston", "district": "Back Bay"}}', '{"product_id": 106}'),
(7, '{"name": "David", "age": 31, "address": {"district": "Queens"}}', '{"product_id": 107, "price": "10.7"}'),
(8, '{"name": "Jennifer", "age": 29, "address": {"city": "San Francisco", "district": "Marina"}}', '{"product_id": 108, "price": "10.8"}'),
(9, '{"name": "Richard", "age": 33, "address": {"city": "Austin"}}', '{"product_id": "109", "price": "10.9"}'),
(10, '{"name": "Lisa", "age": 26, "address": {"city": "Chicago"}}', '{"price": "10.10"}');

query ??????
show virtual columns from test2;
----
test_virtual_column test2 data1 3000000000 ['address']['city'] String
test_virtual_column test2 data1 3000000001 ['address']['district'] String
test_virtual_column test2 data1 3000000002 ['age'] UInt64
test_virtual_column test2 data1 3000000003 ['name'] String
test_virtual_column test2 data2 3000000004 ['price'] Jsonb
test_virtual_column test2 data2 3000000005 ['product_id'] Jsonb

query ???????
SELECT 
    id,
    data1:name AS name,
    data1:age AS age,
    data1:address:city AS city,
    data1:address:district AS district,
    data2:product_id AS product_id,
    data2:price AS price
FROM test2;
----
1 "John" NULL "New York" "Manhattan" 101 NULL
2 "Alice" NULL "San Francisco" "Mission" 102 10.2
3 "Bob" 28 "Chicago" "Loop" 103 10.3
4 "Emma" 22 NULL "Brooklyn" 104 10.4
5 "Michael" 35 "Seattle" "Downtown" NULL "10.5"
6 NULL 27 "Boston" "Back Bay" 106 NULL
7 "David" 31 NULL "Queens" 107 "10.7"
8 "Jennifer" 29 "San Francisco" "Marina" 108 "10.8"
9 "Richard" 33 "Austin" NULL "109" "10.9"
10 "Lisa" 26 "Chicago" NULL NULL "10.10"

statement ok
set enable_experimental_virtual_column = 0;

statement ok
DROP DATABASE test_virtual_column
