statement ok
CREATE OR REPLACE TABLE old_products (
    product_id INT,
    category_code VARCHAR(50),
    price DECIMAL(10, 2),
    stock INT
);

statement ok
INSERT INTO old_products (product_id, category_code, price, stock) VALUES
(1, 'ELEC', 299.99, 50),
(2, 'ELEC', 399.99, 30),
(3, 'FURN', 199.99, 20),
(4, 'FURN', 89.99, 100);

statement ok
CREATE OR REPLACE TABLE new_products (
    product_id INT,
    category_code VARCHAR(50),
    new_price DECIMAL(10, 2),
    new_stock INT
);

statement ok
INSERT INTO new_products (product_id, category_code, new_price, new_stock) VALUES
(1, 'ELEC', 279.99, 55),
(2, 'ELEC', 399.99, 25),
(3, 'FURN', 189.99, 22),
(4, 'FURN', 99.99, 50),
(4, 'FURN', 39.99, 60);

statement ok
set error_on_nondeterministic_update = 1;

statement error (?s)4001.*multi rows from source match one and the same row in the target_table multi times
UPDATE old_products o
SET o.price = n.new_price,
    o.stock = n.new_stock
FROM new_products n
WHERE o.product_id = n.product_id
AND o.category_code = n.category_code;

statement ok
set error_on_nondeterministic_update = 0;

statement ok
UPDATE old_products o
SET o.price = n.new_price,
    o.stock = n.new_stock
FROM new_products n
WHERE o.product_id = n.product_id
AND o.category_code = n.category_code;

query ITRI
select * from old_products order by product_id;
----
1 ELEC 279.99 55
2 ELEC 399.99 25
3 FURN 189.99 22
4 FURN 99.99 50

statement ok
drop table old_products

statement ok
drop table new_products

include ../issues/issue_15278.test

include ./03_0035_update.test

statement ok
create or replace table test_merge( col1 varchar, col2 varchar, col3 varchar);

statement ok
insert into test_merge values(2,'abc',2),(3,'abc',3),(4,'abc',4);

statement ok
with tbb(col1, col2, col3) as (values ('1', 'add', '11'), ('4', 'add', '44'))
update test_merge tba set tba.col1 =tbb.col1, tba.col2 = 'update', tba.col3 = tbb.col3 from tbb where tba.col1 = tbb.col1;

query TTT
select * from test_merge order by col1;
----
2 abc 2
3 abc 3
4 update 44

statement ok
unset error_on_nondeterministic_update;
