statement ok
DROP DATABASE IF EXISTS db1

statement ok
CREATE DATABASE db1

statement ok
USE db1

statement ok
drop table if exists t_stored

statement ok
create table t_stored(a string null default 'a', b string null as (concat(a, '-', c)) stored, c string null default 'c')

statement ok
insert into t_stored values ('a1', 'c1'), ('a2', 'c2')

statement ok
insert into t_stored (a) values ('a3'), ('a4')

statement ok
insert into t_stored (c) values ('c5'), ('c6')

statement error 1006
insert into t_stored (b) values ('b1'), ('b2')

statement error 1303
insert into t_stored values ('a1', 'b1', 'c1'), ('a2', 'b2', 'c2')

query SSS
select * from t_stored order by a, c
----
a a-c5 c5
a a-c6 c6
a1 a1-c1 c1
a2 a2-c2 c2
a3 a3-c c
a4 a4-c c

statement ok
update t_stored set a = 'aa', c = 'cc' where a = 'a4'

statement error 1006
update t_stored set b = 'bb', c = 'cc'

query SSS
select * from t_stored order by a, c
----
a a-c5 c5
a a-c6 c6
a1 a1-c1 c1
a2 a2-c2 c2
a3 a3-c c
aa aa-cc cc

statement ok
drop table if exists t_stored2

statement ok
create table t_stored2(a json null, b uint32 null as (a['id']::uint32) stored, c string null as (a['name']::string) stored)

statement ok
insert into t_stored2 values ('{"id":1,"name":"tom"}'), ('{"id":2,"name":"jim"}'),('{"id":3}')

query TIS
select * from t_stored2
----
{"id":1,"name":"tom"} 1 tom
{"id":2,"name":"jim"} 2 jim
{"id":3} 3 NULL

statement ok
update t_stored2 set a = '{"id":3, "name":"jack"}' where b = 3

statement error 1006
update t_stored2 set c = 'test'

query TIS
select * from t_stored2
----
{"id":1,"name":"tom"} 1 tom
{"id":2,"name":"jim"} 2 jim
{"id":3,"name":"jack"} 3 jack

statement ok
drop table if exists t_virtual

statement ok
create table t_virtual(a string null default 'a', b string null as (concat(a, '-', c)) stored, c string null default 'c')

statement ok
insert into t_virtual values ('a1', 'c1'), ('a2', 'c2')

statement ok
insert into t_virtual (a) values ('a3'), ('a4')

statement ok
insert into t_virtual (c) values ('c5'), ('c6')

statement error 1006
insert into t_virtual (b) values ('b1'), ('b2')

statement error 1303
insert into t_virtual values ('a1', 'b1', 'c1'), ('a2', 'b2', 'c2')

query SSS
select * from t_virtual order by a, c
----
a a-c5 c5
a a-c6 c6
a1 a1-c1 c1
a2 a2-c2 c2
a3 a3-c c
a4 a4-c c

statement ok
update t_virtual set a = 'aa', c = 'cc' where a = 'a4'

statement error 1006
update t_virtual set b = 'bb', c = 'cc'

query SSS
select * from t_virtual order by a, c
----
a a-c5 c5
a a-c6 c6
a1 a1-c1 c1
a2 a2-c2 c2
a3 a3-c c
aa aa-cc cc

statement ok
drop table if exists t_virtual2

statement ok
create table t_virtual2(a json null, b uint32 null as (a['id']::uint32) virtual, c string null as (a['name']::string) virtual)

statement ok
insert into t_virtual2 values ('{"id":1,"name":"tom"}'), ('{"id":2,"name":"jim"}'),('{"id":3}')

query TIS
select * from t_virtual2
----
{"id":1,"name":"tom"} 1 tom
{"id":2,"name":"jim"} 2 jim
{"id":3} 3 NULL

statement ok
update t_virtual2 set a = '{"id":3, "name":"jack"}' where b = 3

statement error 1006
update t_virtual2 set c = 'test'

query TIS
select * from t_virtual2
----
{"id":1,"name":"tom"} 1 tom
{"id":2,"name":"jim"} 2 jim
{"id":3,"name":"jack"} 3 jack

statement ok
DROP DATABASE db1

