statement ok
DROP DATABASE IF EXISTS db1

statement ok
CREATE DATABASE db1

statement ok
USE db1

statement ok
CREATE TABLE IF NOT EXISTS t(c1 Int, c2 Int )

statement ok
INSERT INTO t VALUES(1,2)

statement ok
INSERT INTO t VALUES(3,4)

statement ok
delete from t where c1 > 3

query B
select count(*) = 2 from t
----
1



statement ok
delete from t where c1 = 1

query B
select count(*) = 0 from t where c1 = 1
----
1



query B
select count(*) = 1 from t where c1 <> 1
----
1



statement ok
delete from t

query B
select count(*) = 0 from t
----
1



statement ok
drop table t all

statement ok
create table t (c Int null)

statement ok
insert into t values (1),(2),(NULL)

statement ok
delete from t where 1 = 0

query B
select count(*) = 3 from t
----
1



statement ok
delete from t where c = 1

query B
select count(*) = 2 from t
----
1



query B
select count(*) = 1 from t where c IS NULL
----
1



statement ok
delete from t where c IS NULL

query B
select count(*) = 0 from t where c IS NULL
----
1



query B
select count(*) = 1 from t where c IS NOT NULL
----
1



statement ok
delete from t where 1 = 1

query B
select count(*) = 0 from t
----
1



statement ok
insert into t values (1),(2),(NULL)

statement error 1002
delete from t where now()

query B
select count(*) = 0 from t
----
0



statement ok
drop table t all

statement ok
create table t(c Int) CLUSTER BY(c+1)

statement ok
insert into t values (1),(3)

statement ok
insert into t values (2),(4)

statement ok
delete from t where c > 2;

query B
select count(*) = 2 from t
----
1

statement ok
drop table t all

statement ok
create table t(a Int, b Int)

statement ok
insert into t select number, 50 - number from numbers(100)

query B
select count(*) = 100 from t
----
1

statement ok
delete from t where b > 0

query B
select count(*) = 50 from t
----
1

statement error 1002
delete from t where t.a in (select * from numbers(10))

statement ok
drop table t all


####################################
# delete pruning, whole blocks     #
####################################

statement ok
create table t (c int);

# case: 3 blocks of single value

statement ok
insert into t values(1);

statement ok
insert into t values(2);

statement ok
insert into t values(3);

# clear metrics
statement ok
truncate table system.metrics;

statement ok
delete from t where c = 2;

# expects 2 blocks pruned: the blocks of value 1 and 3
query I
select value from system.metrics where metric = 'fuse_deletion_block_range_pruned_nums';
----
2.0

query I
select * from t order by c;
----
1
3

# expects 1 whole block deletion: the block of value 2
query I
select value from system.metrics where metric = 'fuse_deletion_block_range_pruned_whole_block_nums';
----
1.0

# case: 3 blocks

statement ok
truncate table t;

statement ok
insert into t values(1), (3);

statement ok
insert into t values(3), (5);

statement ok
insert into t values(6), (7);

# clear metrics
statement ok
truncate table system.metrics;

statement ok
delete from t where c > 0 and c < 4;

# expects 1 blocks pruned: the block of value {6..7}
query I
select value from system.metrics where metric = 'fuse_deletion_block_range_pruned_nums';
----
1.0

# expects 1 whole block deletion: the block of value {1..3}
query I
select value from system.metrics where metric = 'fuse_deletion_block_range_pruned_whole_block_nums';
----
1.0

query I
select * from t order by c;
----
5
6
7




statement ok
drop table t all

statement ok
DROP DATABASE db1

