statement ok
DROP DATABASE IF EXISTS db1

statement ok
CREATE DATABASE db1

statement ok
USE db1

statement ok
CREATE TABLE IF NOT EXISTS t1(id Int null, var Variant null) Engine = Fuse

statement ok
INSERT INTO t1 (id, var) VALUES(1, null), (2, true),(3, false),(4, 1),(5, -1),(6, 1000),(7, -1000),(8, 9223372036854775807),(9, -9223372036854775808),(10, 18446744073709551615),(11, 0.12345679),(12, 0.12345678912121212),(13, '"abcd"'),(14, '[1,2,3]'),(15, '{"k":"v"}'),(16, '"a\"b\\"c"'),(17, '"http:\/\/databend.com"')

statement error (?s)1006.*expected value, pos 1 while evaluating function `parse_json\('abc'\)`.*
INSERT INTO t1 (id, var) VALUES(1, 'abc')

statement error (?s)1006.*EOF while parsing a value, pos 5 while evaluating function `parse_json\('\{"a":'\)`.*
INSERT INTO t1 (id, var) VALUES(1, '{"a":')

statement ok
INSERT INTO t1 (id, var) VALUES(18, [1,2,3])


query IT
select * from t1 order by id asc
----
1 NULL
2 true
3 false
4 1
5 -1
6 1000
7 -1000
8 9223372036854775807
9 -9223372036854775808
10 18446744073709551615
11 0.12345679
12 0.12345678912121212
13 "abcd"
14 [1,2,3]
15 {"k":"v"}
16 "a\"b\"c"
17 "http://databend.com"
18 [1,2,3]

statement ok
CREATE TABLE IF NOT EXISTS t2(id Int null, arr Json null) Engine = Fuse

statement ok
INSERT INTO t2 SELECT 1, parse_json('[1,2,3,["a","b","c"],{"k":"v"}]')

query IT
select * from t2
----
1 [1,2,3,["a","b","c"],{"k":"v"}]

query T
select arr[0] from t2
----
1

query T
select arr[5] from t2
----
NULL

query T
select arr[3][0] from t2
----
"a"

query T
select arr[4]['k'] from t2
----
"v"

query T
select arr[4][0] from t2
----
NULL

statement ok
CREATE TABLE IF NOT EXISTS t3(id Int null, obj Json null) Engine = Fuse

statement ok
INSERT INTO t3 SELECT 1, parse_json('{"a": 1,"b":{"k": 2},"c": [10,11,12]}')

query IT
select * from t3
----
1 {"a":1,"b":{"k":2},"c":[10,11,12]}

query T
select obj:a from t3
----
1

query T
select obj['a'] from t3
----
1

query T
select obj[0] from t3
----
NULL

query T
select obj:x from t3
----
NULL

query T
select obj:b from t3
----
{"k":2}

query T
select obj:b:k from t3
----
2

query T
select obj:b.k from t3
----
2

query T
select obj:c from t3
----
[10,11,12]

query T
select obj:c[0] from t3
----
10

query T
select obj['c'][0] from t3
----
10

query T
select obj['c'][3] from t3
----
NULL

statement ok
CREATE TABLE IF NOT EXISTS t4(id Int null, m Json null) Engine = Fuse

statement ok
INSERT INTO t4 SELECT 1, parse_json('{"a": 2,"b":{"k": 2},"c": [10,11,12]}')

statement ok
INSERT INTO t4 SELECT 2, parse_json('{"a": true,"b": {"k": false},"c": [1,2,3]}')

statement ok
INSERT INTO t4 SELECT 3, parse_json('{"a": "v","b": {"k": "vv"},"c": []}')

query IT
select * from t4 order by id asc
----
1 {"a":2,"b":{"k":2},"c":[10,11,12]}
2 {"a":true,"b":{"k":false},"c":[1,2,3]}
3 {"a":"v","b":{"k":"vv"},"c":[]}

query IT
select * from t4 where id >= 1 and m:a = 2
----
1 {"a":2,"b":{"k":2},"c":[10,11,12]}

query IT
select * from t4 where id >= 1 and m:a = true
----
2 {"a":true,"b":{"k":false},"c":[1,2,3]}

query IT
select * from t4 where id >= 1 and m:a = 'v'
----
3 {"a":"v","b":{"k":"vv"},"c":[]}

query IT
select * from t4 where id >= 1 and 2 = m:b:k
----
1 {"a":2,"b":{"k":2},"c":[10,11,12]}

query IT
select * from t4 where id >= 1 and false = m:b:k
----
2 {"a":true,"b":{"k":false},"c":[1,2,3]}

query IT
select * from t4 where id >= 1 and 'vv' = m:b:k
----
3 {"a":"v","b":{"k":"vv"},"c":[]}

# auto cast string to json value
statement ok
INSERT INTO t4 SELECT 4, parse_json('{"a":"x2"}')

statement ok
UPDATE t4 SET m = '{"a":"x1"}' WHERE id = 3

statement ok
REPLACE INTO t4 ON CONFLICT(id) values(5,'{"a":"x3"}'), (6,'{"a":"x4"}')

query ITT
select id, m, m['a'] from t4 order by id asc
----
1 {"a":2,"b":{"k":2},"c":[10,11,12]} 2
2 {"a":true,"b":{"k":false},"c":[1,2,3]} true
3 {"a":"x1"} "x1"
4 {"a":"x2"} "x2"
5 {"a":"x3"} "x3"
6 {"a":"x4"} "x4"

statement ok
DROP DATABASE db1
