statement ok
drop table if exists t_partial_update

statement ok
set enable_partial_update = 0

statement ok
create table t_partial_update(id int, value int)
    bloom_index_columns = 'id,value'
    enable_partial_update = true

statement ok
insert into t_partial_update values (1, 10), (2, 20)

# The table option alone is not enough to enable partial updates.
statement ok
update t_partial_update set value = value + 1 where id = 1

query B
select column_groups = parse_json('[]') from fuse_block('default', 't_partial_update')
----
1

statement ok
set enable_partial_update = 1

statement ok
update t_partial_update set value = value + 1 where id = 2

query II
select * from t_partial_update order by id
----
1 11
2 21

query B
select column_groups != parse_json('[]')
from fuse_block('default', 't_partial_update')
----
1

query I
select count(distinct column_name)
from fuse_page('default', 't_partial_update')
where column_name in ('id', 'value')
----
2

query I
select count(distinct column_name)
from fuse_encoding('default', 't_partial_update')
where column_name in ('id', 'value')
----
2

query I
select count(distinct block_location)
from fuse_column('default', 't_partial_update')
where column_name in ('id', 'value')
----
2

# Disabling the setting forces the next rewrite back to the single-file layout.
statement ok
set enable_partial_update = 0

statement ok
update t_partial_update set value = value + 1 where id = 1

query B
select column_groups = parse_json('[]')
from fuse_block('default', 't_partial_update')
----
1

statement ok
drop table t_partial_update

# A partial group keeps the logical block codec even if the table option changes.
statement ok
create table t_partial_update_compression(id int, a int, b int)
    compression = 'zstd'
    enable_partial_update = true

statement ok
insert into t_partial_update_compression values (1, 10, 20), (2, 30, 40)

statement ok
alter table t_partial_update_compression set options(compression = 'snappy')

statement ok
set enable_partial_update = 1

statement ok
update t_partial_update_compression set a = a + 1 where id = 1

statement ok
update t_partial_update_compression set b = b + 1 where id = 2

query III
select * from t_partial_update_compression order by id
----
1 11 20
2 30 41

statement ok
drop table t_partial_update_compression
