statement ok
DROP DATABASE IF EXISTS db_09_0020

statement ok
CREATE DATABASE db_09_0020

statement ok
USE db_09_0020

statement ok
create or replace table t_17129(`offset` varchar);

statement ok
insert into t_17129 values('ttt');

statement ok
analyze table t_17129;

query TI
select column_name, distinct_count from fuse_statistic('db_09_0020','t_17129');
----
offset 1

statement ok
drop table t_17129;

statement ok
create table t(a uint64)

statement ok
insert into t values (5)

statement ok
insert into t values (6)

statement ok
insert into t values (7)

query I
select * from t order by a
----
5
6
7

query TI
select * from fuse_statistic('db_09_0020', 't')
----


statement ok
analyze table `t`

query TI
select * from fuse_statistic('db_09_0020', 't')
----
a 3 (empty)

statement ok
insert into t values (5)

statement ok
insert into t values (6)

statement ok
insert into t values (7)


query I
select * from t order by a
----
5
5
6
6
7
7

query II
select segment_count,block_count from fuse_snapshot('db_09_0020', 't') limit 1
----
6 6

query TI
select * from fuse_statistic('db_09_0020', 't')
----
a 3 (empty)

statement ok
analyze table `t`

query TI
select * from fuse_statistic('db_09_0020', 't')
----
a 3 (empty)

statement ok
optimize table t compact

query II
select segment_count,block_count from fuse_snapshot('db_09_0020', 't') limit 1
----
1 1

query TI
select * from fuse_statistic('db_09_0020', 't')
----
a 3 (empty)

statement ok
analyze table `t`

query TI
select * from fuse_statistic('db_09_0020', 't')
----
a 3 (empty)

statement ok
delete from t where a=5

query TI
select * from fuse_statistic('db_09_0020', 't')
----
a 3 (empty)

statement ok
analyze table `t`

query TI
select * from fuse_statistic('db_09_0020', 't')
----
a 3 (empty)

statement ok
create or replace table t1 as select number as a from numbers(10);

statement ok
set enable_analyze_histogram=1;

statement ok
analyze table t1;

query IIT
select * from fuse_statistic('db_09_0020', 't1');
----
a 10 [bucket id: 0, min: "0", max: "0", ndv: 1.0, count: 1.0], [bucket id: 1, min: "1", max: "1", ndv: 1.0, count: 1.0], [bucket id: 2, min: "2", max: "2", ndv: 1.0, count: 1.0], [bucket id: 3, min: "3", max: "3", ndv: 1.0, count: 1.0], [bucket id: 4, min: "4", max: "4", ndv: 1.0, count: 1.0], [bucket id: 5, min: "5", max: "5", ndv: 1.0, count: 1.0], [bucket id: 6, min: "6", max: "6", ndv: 1.0, count: 1.0], [bucket id: 7, min: "7", max: "7", ndv: 1.0, count: 1.0], [bucket id: 8, min: "8", max: "8", ndv: 1.0, count: 1.0], [bucket id: 9, min: "9", max: "9", ndv: 1.0, count: 1.0]

statement ok
set enable_analyze_histogram=0;

statement ok
analyze table t1;

statement ok
DROP TABLE t

statement ok
DROP DATABASE db_09_0020
