statement ok
DROP DATABASE IF EXISTS db_09_0020

statement ok
CREATE DATABASE db_09_0020

statement ok
USE db_09_0020

statement ok
create or replace table t_17129(`offset` varchar);

statement ok
insert into t_17129 values('ttt');

statement ok
analyze table t_17129;

query TI
select column_name, distinct_count from fuse_statistic('db_09_0020','t_17129');
----
offset 1

statement ok
drop table t_17129;

statement ok
create table t(a uint64)

statement ok
insert into t values (5)

statement ok
insert into t values (6)

statement ok
insert into t values (7)

query I
select * from t order by a
----
5
6
7

query T
select * from fuse_statistic('db_09_0020', 't')
----
a 3 0 9 (empty)

statement ok
insert into t values (5)

statement ok
insert into t values (6)

statement ok
insert into t values (7)


query I
select * from t order by a
----
5
5
6
6
7
7

query II
select segment_count,block_count from fuse_snapshot('db_09_0020', 't') limit 1
----
6 6

query T
select * from fuse_statistic('db_09_0020', 't')
----
a 3 0 9 (empty)

statement ok
optimize table t compact

query II
select segment_count,block_count from fuse_snapshot('db_09_0020', 't') limit 1
----
1 1

query T
select * from fuse_statistic('db_09_0020', 't')
----
a 3 0 8 (empty)

statement ok
delete from t where a=5

query T
select * from fuse_statistic('db_09_0020', 't')
----
a 3 0 8 (empty)

statement ok
analyze table `t`

query T
select * from fuse_statistic('db_09_0020', 't')
----
a 2 0 8 (empty)

statement ok
create or replace table t1 as select number as a from numbers(10);

statement ok
set enable_analyze_histogram=1;

statement ok
set enable_table_snapshot_stats  = 1;

statement ok
analyze table t1;

query T
select * from fuse_statistic('db_09_0020', 't1');
----
a 10 0 8 [bucket id: 0, min: "0", max: "0", ndv: 1.0, count: 1.0], [bucket id: 1, min: "1", max: "1", ndv: 1.0, count: 1.0], [bucket id: 2, min: "2", max: "2", ndv: 1.0, count: 1.0], [bucket id: 3, min: "3", max: "3", ndv: 1.0, count: 1.0], [bucket id: 4, min: "4", max: "4", ndv: 1.0, count: 1.0], [bucket id: 5, min: "5", max: "5", ndv: 1.0, count: 1.0], [bucket id: 6, min: "6", max: "6", ndv: 1.0, count: 1.0], [bucket id: 7, min: "7", max: "7", ndv: 1.0, count: 1.0], [bucket id: 8, min: "8", max: "8", ndv: 1.0, count: 1.0], [bucket id: 9, min: "9", max: "9", ndv: 1.0, count: 1.0]

statement ok
set enable_analyze_histogram=0;

statement ok
analyze table t1;

statement ok
DROP TABLE t

# Test case for string histogram functionality
statement ok
create or replace table t_string(id int, str_val varchar);

statement ok
insert into t_string values
    (1, '1.0'),
    (2, '2.0'),
    (3, '3.0'),
    (4, '4.0'),
    (5, '5.0'),
    (6, '6.0'),
    (7, '7.0'),
    (8, '8.0'),
    (9, '9.0'),
    (10, '10.0');

statement ok
set enable_analyze_histogram=1;

statement ok
analyze table t_string;

# Verify that histogram was created for string column
query T
select * from fuse_statistic('db_09_0020', 't_string') order by column_name asc;
----
id 10 0 4 [bucket id: 0, min: "1", max: "1", ndv: 1.0, count: 1.0], [bucket id: 1, min: "2", max: "2", ndv: 1.0, count: 1.0], [bucket id: 2, min: "3", max: "3", ndv: 1.0, count: 1.0], [bucket id: 3, min: "4", max: "4", ndv: 1.0, count: 1.0], [bucket id: 4, min: "5", max: "5", ndv: 1.0, count: 1.0], [bucket id: 5, min: "6", max: "6", ndv: 1.0, count: 1.0], [bucket id: 6, min: "7", max: "7", ndv: 1.0, count: 1.0], [bucket id: 7, min: "8", max: "8", ndv: 1.0, count: 1.0], [bucket id: 8, min: "9", max: "9", ndv: 1.0, count: 1.0], [bucket id: 9, min: "10", max: "10", ndv: 1.0, count: 1.0]
str_val 10 0 15 [bucket id: 0, min: "1.0", max: "1.0", ndv: 1.0, count: 1.0], [bucket id: 1, min: "10.0", max: "10.0", ndv: 1.0, count: 1.0], [bucket id: 2, min: "2.0", max: "2.0", ndv: 1.0, count: 1.0], [bucket id: 3, min: "3.0", max: "3.0", ndv: 1.0, count: 1.0], [bucket id: 4, min: "4.0", max: "4.0", ndv: 1.0, count: 1.0], [bucket id: 5, min: "5.0", max: "5.0", ndv: 1.0, count: 1.0], [bucket id: 6, min: "6.0", max: "6.0", ndv: 1.0, count: 1.0], [bucket id: 7, min: "7.0", max: "7.0", ndv: 1.0, count: 1.0], [bucket id: 8, min: "8.0", max: "8.0", ndv: 1.0, count: 1.0], [bucket id: 9, min: "9.0", max: "9.0", ndv: 1.0, count: 1.0]

# Test string comparison with histogram
query I
select count(*) from t_string where str_val > '5.0';
----
4

# Test string range query with histogram
query I
select count(*) from t_string where str_val between '3.0' and '7.0';
----
5

statement ok
DROP TABLE t_string

statement ok
create or replace table t2(a int, b int) approx_distinct_columns = 'a';

query I
insert into t2 values(1,1),(2,2);
----
2

query I
insert into t2 values(2,2),(4,4);
----
2

query I
delete from t2 where a=1;
----
1

query T
show statistics from table db_09_0020.t2;
----
db_09_0020 t2 a 4 3 3 0 4 (empty)
db_09_0020 t2 b 4 3 3 0 4 (empty)

statement ok
analyze table t2;

query T
show statistics from table db_09_0020.t2;
----
db_09_0020 t2 a 3 3 2 0 4 [bucket id: 0, min: "2", max: "2", ndv: 1.0, count: 1.0], [bucket id: 1, min: "2", max: "2", ndv: 1.0, count: 1.0], [bucket id: 2, min: "4", max: "4", ndv: 1.0, count: 1.0]
db_09_0020 t2 b 3 3 3 0 4 [bucket id: 0, min: "2", max: "2", ndv: 1.0, count: 1.0], [bucket id: 1, min: "2", max: "2", ndv: 1.0, count: 1.0], [bucket id: 2, min: "4", max: "4", ndv: 1.0, count: 1.0]

query I
select count() from fuse_snapshot('db_09_0020','t2');
----
4

statement ok
DROP TABLE t2;

statement ok
CREATE TABLE t3(a int, b string) approx_distinct_columns = '';

statement ok
insert into t3 values(1, 'a'), (2, 'b');

statement ok
alter table t3 set options(approx_distinct_columns = 'a, b');

statement ok
insert into t3 values(4, 'c'), (3, 'b');

query B
select segment_stats_size is null from fuse_segment('db_09_0020','t3') order by file_location;
----
1
0

statement ok
analyze table t3;

query B
select segment_stats_size is null from fuse_segment('db_09_0020','t3') order by file_location;
----
0
0

query TI
select column_name, distinct_count from fuse_statistic('db_09_0020', 't3') order by column_name;
----
a 4
b 3

statement ok
analyze table t3;

query I
select count() from fuse_snapshot('db_09_0020', 't3');
----
4

statement ok
DROP TABLE t3;

statement ok
DROP DATABASE db_09_0020
