statement ok
DROP DATABASE IF EXISTS db1

statement ok
CREATE DATABASE db1

statement ok
USE db1

statement ok
create table t(a int) cluster by(a) change_tracking = false

statement ok
insert into t values(1),(2)

statement error 1065
select a, _origin_version is null, _origin_block_id is null, _origin_block_row_num, _row_version from t order by a

statement ok
alter table t set options(change_tracking = true)

statement ok
insert into t values(3),(4)

query IBBII
select a, _origin_version is null, _origin_block_id is null, _origin_block_row_num, _row_version from t order by a
----
1 1 1 NULL 0
2 1 1 NULL 0
3 1 1 NULL 0
4 1 1 NULL 0

statement ok
delete from t where a = 3

query IBBII
select a, _origin_version is null, _origin_block_id is null, _origin_block_row_num, _row_version from t order by a
----
1 1 1 NULL 0
2 1 1 NULL 0
4 0 0 1 0

statement ok
update t set a = 3 where a = 4

statement ok
optimize table t compact

query IBBII
select a, _origin_version is null, _origin_block_id is null, _origin_block_row_num, _row_version from t order by a
----
1 0 0 0 0
2 0 0 1 0
3 0 0 1 1

statement ok
insert into t values(5)

statement ok
insert into t values(6)

statement ok
alter table t recluster

query IBBII
select a, _origin_version is null, _origin_block_id is null, _origin_block_row_num, _row_version from t order by a
----
1 0 0 0 0
2 0 0 1 0
3 0 0 1 1
5 0 0 0 0
6 0 0 0 0

statement error 1065
select change$is_update from t

statement ok
replace into t on(a) values(6),(7)

query IBBII
select a, _origin_version is null, _origin_block_id is null, _origin_block_row_num, _row_version from t order by a
----
1 0 0 0 0
2 0 0 1 0
3 0 0 1 1
5 0 0 0 0
6 1 1 NULL 0
7 1 1 NULL 0

statement ok
create table t2(a int)

statement ok
insert into t2 values(0),(2),(1)

statement ok
set enable_experimental_merge_into = 1

query TTT
merge into t using t2 on t.a = t2.a when matched and t2.a = 1 then update set t.a = 8 when matched and t2.a = 2 then delete when not matched then insert *
----
1 1 1

query IBBII
select a, _origin_version is null, _origin_block_id is null, _origin_block_row_num, _row_version from t order by a
----
0 0 0 0 0
3 0 0 1 1
5 0 0 0 0
6 0 0 0 0
7 0 0 1 0
8 0 0 0 1

statement ok
create table t1(a int) change_tracking = true

statement ok
insert into t1 values(0),(2)

statement ok
insert into t1 values(3)

statement ok
optimize table t1 compact

query T
merge into t using t1 on t.a = t1.a when matched and t1.a = 0 then update set t.a = 1 when matched and t1.a = 3 then update set t.a = 2
----
2

query IBBII
select a, _origin_version is null, _origin_block_id is null, _origin_block_row_num, _row_version from t order by a
----
1 0 0 0 1
2 0 0 1 2
5 0 0 0 0
6 0 0 0 0
7 0 0 1 0
8 0 0 0 1

###############
# issue 14955 #
###############

statement ok
create table t3(a int, b int) cluster by(a+1) change_tracking=true

statement ok
insert into t3 values(1, 1), (3, 3), (2, 3)

statement ok
update t3 set b = 2 where a = 2

statement ok
delete from t3 where a = 3

statement ok
insert into t3 values(4, 4)

statement ok
alter table t3 recluster

statement ok
insert into t3 values(0, 0)

statement ok
optimize table t3 compact

statement ok
create table t4(a int, b int, c int)

statement ok
insert into t4 values(0, 1, 0), (3, 4, 3), (4, 5, 4)

statement ok
replace into t3 on(a) delete when c = 0 select * from t4

query III
merge into t3 using t4 on t3.a = t4.a when matched and t4.a = 4 then delete when matched then update set t3.b = t4.c when not matched then insert values(t4.a, t4.c)
----
1 1 1

statement ok
set enable_compact_after_write = 0;

query IIBBII
select a, b, _row_version from t3 order by a
----
0 0 0
1 1 0
2 2 1
3 3 1

statement ok
drop table t4 all

statement ok
drop table t3 all

######################
# end of issue 14955 #
######################

###############
# issue 15412 #
###############

statement ok
CREATE TABLE test_select (id Int64, name STRING) change_tracking = true

statement ok
insert into test_select values(1, 'Wu')

query I
merge into db1.test_select t1 using (select * from db1.test_select) t2 on t1.id = t2.id when matched then update set t1.id=t2.id, t1.name='{}'
----
1

query ITI
select id, name, _row_version from test_select
----
1 {} 1

statement ok
drop table test_select all

######################
# end of issue 15412 #
######################

statement ok
set enable_experimental_merge_into = 0

statement ok
drop table t all

statement ok
drop table t2 all

statement ok
drop database db1
