statement ok
drop database if exists db;

statement ok
create database db;

statement ok
use db;

statement ok
set enable_experimental_merge_into = 1;

statement ok
drop table if exists t1_separate;

statement ok
drop table if exists t2_separate;

statement ok
create table t1_separate(a int,b string, c string) cluster by(a,b);

statement ok
create table t2_separate(a int,b string, c string);

statement ok
insert into t1_separate values(1,'a1','b1'),(2,'a2','b2');

statement ok
insert into t1_separate values(3,'a3','b3'),(4,'a4','b4');

statement ok
insert into t2_separate values(1,'a5','b5'),(3,'a6','b6');

statement ok
insert into t2_separate values(8,'a8','b8'),(9,'a9','b9');

query TTT
select * from t1_separate order by a,b,c;
----
1 a1 b1
2 a2 b2
3 a3 b3
4 a4 b4

query TTT
select * from t2_separate order by a,b,c;
----
1 a5 b5
3 a6 b6
8 a8 b8
9 a9 b9

## 1.test matched only
query T
merge into t1_separate as t1 using (select * from t2_separate) as t2 on t1.a = t2.a when matched and t2.b = 'a5' then update * when matched then update *;
----
2

query TTT
select * from t1_separate order by a,b,c;
----
1 a5 b5
2 a2 b2
3 a6 b6
4 a4 b4

## 2.test insert only
query T
merge into t1_separate as t1 using (select * from t2_separate) as t2 on t1.a = t2.a when not matched and t2.b = 'a5' then insert * when not matched then insert *;
----
2

query TTT
select * from t1_separate order by a,b,c;
----
1 a5 b5
2 a2 b2
3 a6 b6
4 a4 b4
8 a8 b8
9 a9 b9

## insert only semantic test
statement error 1065
merge into t1_separate as t1 using (select * from t2_separate) as t2 on t1.a = t2.a when not matched and t2.b = 'a5' then insert (b) values(t1.a);

statement ok
truncate table t1_separate;

## test merge into empty table for insert-only
query T
merge into t1_separate as t1 using (select * from t2_separate) as t2 on t1.a = t2.a when not matched and t2.b = 'a5' then insert * when not matched then insert *;
----
4

query TTT
select * from t1_separate order by a,b,c;
----
1 a5 b5
3 a6 b6
8 a8 b8
9 a9 b9

## test insert-only cluster by
statement ok
truncate table t1_separate;

statement ok
truncate table t2_separate;

statement ok
insert into t2_separate values(8,'a8','b8'),(9,'a9','b9'),(1,'a5','b5'),(3,'a6','b6');

query T
merge into t1_separate as t1 using (select * from t2_separate) as t2 on t1.a = t2.a when not matched then insert *;
----
4

## without order by
query TTT
select * from t1_separate;
----
1 a5 b5
3 a6 b6
8 a8 b8
9 a9 b9

## test matched-only cluster by
query T
merge into t1_separate as t1 using (select * from t2_separate) as t2 on t1.a = t2.a when matched then update *;
----
4

query TTT
select * from t1_separate;
----
1 a5 b5
3 a6 b6
8 a8 b8
9 a9 b9

## test full operation cluster by
statement ok
insert into t2_separate values(5,'a5','b5'),(7,'a7','b7');

query TT
merge into t1_separate as t1 using (select * from t2_separate) as t2 on t1.a = t2.a when matched then update * when not matched then insert *;
----
2 4

query T
select count(*) from fuse_block('db','t1_separate');
----
1

## we will do compact
query TTT
select * from t1_separate;
----
1 a5 b5
3 a6 b6
5 a5 b5
7 a7 b7
8 a8 b8
9 a9 b9

statement ok
set enable_experimental_merge_into = 0;
