# Generated by tests/sqllogictests/scripts/gen_table_kind_matrix.py. Do not edit by
# hand; change the generator and rerun it.
#
# The same sequence of write operations against every kind of fuse table, with the
# same expected results, so a kind-specific divergence shows up as a diff.

## regular table
statement ok
CREATE OR REPLACE TABLE tkm_regular(a INT, b STRING)

statement ok
INSERT INTO tkm_regular VALUES (1, 'a'), (2, 'b'), (3, 'c')

statement ok
INSERT INTO tkm_regular VALUES (4, 'd'), (5, 'e'), (6, 'f')

query II
SELECT count(*), sum(a) FROM tkm_regular
----
6 21

query I
SELECT count(*) FROM fuse_block('default', 'tkm_regular')
----
2

statement ok
UPDATE tkm_regular SET b = 'x' WHERE a = 2

query I
SELECT count(*) FROM tkm_regular WHERE b = 'x'
----
1

statement ok
DELETE FROM tkm_regular WHERE a = 6

query II
SELECT count(*), sum(a) FROM tkm_regular
----
5 15

statement ok
REPLACE INTO tkm_regular ON (a) VALUES (1, 'r'), (7, 'g')

query II
SELECT count(*), sum(a) FROM tkm_regular
----
6 22

query T
SELECT b FROM tkm_regular WHERE a = 1
----
r

statement ok
CREATE OR REPLACE TABLE tkm_regular_src(a INT, b STRING)

statement ok
INSERT INTO tkm_regular_src VALUES (2, 'm'), (8, 'h')

statement ok
MERGE INTO tkm_regular USING tkm_regular_src AS s ON tkm_regular.a = s.a WHEN MATCHED THEN UPDATE SET b = s.b WHEN NOT MATCHED THEN INSERT VALUES (s.a, s.b)

query II
SELECT count(*), sum(a) FROM tkm_regular
----
7 30

query T
SELECT b FROM tkm_regular WHERE a = 2
----
m

statement ok
ALTER TABLE tkm_regular ADD COLUMN c INT DEFAULT 9

query I
SELECT sum(c) FROM tkm_regular
----
63

statement ok
ALTER TABLE tkm_regular RENAME COLUMN c TO d

query I
SELECT sum(d) FROM tkm_regular
----
63

statement ok
ALTER TABLE tkm_regular DROP COLUMN d

statement error 1065
SELECT d FROM tkm_regular

query II
SELECT count(*), sum(a) FROM tkm_regular
----
7 30

statement ok
OPTIMIZE TABLE tkm_regular COMPACT

query II
SELECT count(*), sum(a) FROM tkm_regular
----
7 30

query I
SELECT count(*) FROM fuse_block('default', 'tkm_regular')
----
1

statement ok
SET auto_compaction_imperfect_blocks_threshold = 2

statement ok
INSERT INTO tkm_regular VALUES (9, 'i')

statement ok
INSERT INTO tkm_regular VALUES (10, 'j')

statement ok
INSERT INTO tkm_regular VALUES (11, 'k')

statement ok
UNSET auto_compaction_imperfect_blocks_threshold

query II
SELECT count(*), sum(a) FROM tkm_regular
----
10 60

query B
SELECT count(*) < 4 FROM fuse_block('default', 'tkm_regular')
----
1

statement ok
BEGIN

statement ok
INSERT INTO tkm_regular VALUES (12, 'l')

statement ok
DELETE FROM tkm_regular WHERE a = 12

statement ok
INSERT INTO tkm_regular VALUES (13, 'm')

statement ok
UPDATE tkm_regular SET b = 'M' WHERE a = 13

statement ok
COMMIT

query II
SELECT count(*), sum(a) FROM tkm_regular
----
11 73

query T
SELECT b FROM tkm_regular WHERE a = 13
----
M

statement ok
BEGIN

statement ok
INSERT INTO tkm_regular VALUES (14, 'n')

statement ok
ROLLBACK

query II
SELECT count(*), sum(a) FROM tkm_regular
----
11 73

statement ok
INSERT OVERWRITE tkm_regular VALUES (100, 'z')

query II
SELECT count(*), sum(a) FROM tkm_regular
----
1 100

statement ok
TRUNCATE TABLE tkm_regular

query I
SELECT count(*) FROM tkm_regular
----
0

statement ok
INSERT INTO tkm_regular VALUES (1, 'a')

query I
SELECT count(*) FROM tkm_regular
----
1

statement ok
CREATE OR REPLACE TABLE tkm_regular_ctas AS SELECT * FROM tkm_regular

query I
SELECT count(*) FROM tkm_regular_ctas
----
1

statement ok
SET data_retention_num_snapshots_to_keep = 20

statement ok
INSERT INTO tkm_regular VALUES (2, 'b')

statement ok
INSERT INTO tkm_regular VALUES (3, 'c')

statement ok
UNSET data_retention_num_snapshots_to_keep

query B
SELECT count(*) > 1 FROM fuse_snapshot('default', 'tkm_regular')
----
1

statement ok
CREATE OR REPLACE STREAM tkm_regular_stream ON TABLE tkm_regular

statement ok
INSERT INTO tkm_regular VALUES (4, 'd')

query I
SELECT count(*) FROM tkm_regular_stream
----
1

statement ok
DROP STREAM tkm_regular_stream

statement ok
DROP TABLE tkm_regular_ctas

statement ok
DROP TABLE tkm_regular

statement ok
DROP TABLE tkm_regular_src

## transient table
statement ok
CREATE OR REPLACE TRANSIENT TABLE tkm_transient(a INT, b STRING)

statement ok
INSERT INTO tkm_transient VALUES (1, 'a'), (2, 'b'), (3, 'c')

statement ok
INSERT INTO tkm_transient VALUES (4, 'd'), (5, 'e'), (6, 'f')

query II
SELECT count(*), sum(a) FROM tkm_transient
----
6 21

query I
SELECT count(*) FROM fuse_block('default', 'tkm_transient')
----
2

statement ok
UPDATE tkm_transient SET b = 'x' WHERE a = 2

query I
SELECT count(*) FROM tkm_transient WHERE b = 'x'
----
1

statement ok
DELETE FROM tkm_transient WHERE a = 6

query II
SELECT count(*), sum(a) FROM tkm_transient
----
5 15

statement ok
REPLACE INTO tkm_transient ON (a) VALUES (1, 'r'), (7, 'g')

query II
SELECT count(*), sum(a) FROM tkm_transient
----
6 22

query T
SELECT b FROM tkm_transient WHERE a = 1
----
r

statement ok
CREATE OR REPLACE TABLE tkm_transient_src(a INT, b STRING)

statement ok
INSERT INTO tkm_transient_src VALUES (2, 'm'), (8, 'h')

statement ok
MERGE INTO tkm_transient USING tkm_transient_src AS s ON tkm_transient.a = s.a WHEN MATCHED THEN UPDATE SET b = s.b WHEN NOT MATCHED THEN INSERT VALUES (s.a, s.b)

query II
SELECT count(*), sum(a) FROM tkm_transient
----
7 30

query T
SELECT b FROM tkm_transient WHERE a = 2
----
m

statement ok
ALTER TABLE tkm_transient ADD COLUMN c INT DEFAULT 9

query I
SELECT sum(c) FROM tkm_transient
----
63

statement ok
ALTER TABLE tkm_transient RENAME COLUMN c TO d

query I
SELECT sum(d) FROM tkm_transient
----
63

statement ok
ALTER TABLE tkm_transient DROP COLUMN d

statement error 1065
SELECT d FROM tkm_transient

query II
SELECT count(*), sum(a) FROM tkm_transient
----
7 30

statement ok
OPTIMIZE TABLE tkm_transient COMPACT

query II
SELECT count(*), sum(a) FROM tkm_transient
----
7 30

query I
SELECT count(*) FROM fuse_block('default', 'tkm_transient')
----
1

statement ok
SET auto_compaction_imperfect_blocks_threshold = 2

statement ok
INSERT INTO tkm_transient VALUES (9, 'i')

statement ok
INSERT INTO tkm_transient VALUES (10, 'j')

statement ok
INSERT INTO tkm_transient VALUES (11, 'k')

statement ok
UNSET auto_compaction_imperfect_blocks_threshold

query II
SELECT count(*), sum(a) FROM tkm_transient
----
10 60

query B
SELECT count(*) < 4 FROM fuse_block('default', 'tkm_transient')
----
1

statement ok
BEGIN

statement ok
INSERT INTO tkm_transient VALUES (12, 'l')

statement ok
DELETE FROM tkm_transient WHERE a = 12

statement ok
INSERT INTO tkm_transient VALUES (13, 'm')

statement ok
UPDATE tkm_transient SET b = 'M' WHERE a = 13

statement ok
COMMIT

query II
SELECT count(*), sum(a) FROM tkm_transient
----
11 73

query T
SELECT b FROM tkm_transient WHERE a = 13
----
M

statement ok
BEGIN

statement ok
INSERT INTO tkm_transient VALUES (14, 'n')

statement ok
ROLLBACK

query II
SELECT count(*), sum(a) FROM tkm_transient
----
11 73

statement ok
INSERT OVERWRITE tkm_transient VALUES (100, 'z')

query II
SELECT count(*), sum(a) FROM tkm_transient
----
1 100

statement ok
TRUNCATE TABLE tkm_transient

query I
SELECT count(*) FROM tkm_transient
----
0

statement ok
INSERT INTO tkm_transient VALUES (1, 'a')

query I
SELECT count(*) FROM tkm_transient
----
1

statement ok
CREATE OR REPLACE TRANSIENT TABLE tkm_transient_ctas AS SELECT * FROM tkm_transient

query I
SELECT count(*) FROM tkm_transient_ctas
----
1

statement ok
SET data_retention_num_snapshots_to_keep = 20

statement ok
INSERT INTO tkm_transient VALUES (2, 'b')

statement ok
INSERT INTO tkm_transient VALUES (3, 'c')

statement ok
UNSET data_retention_num_snapshots_to_keep

query B
SELECT count(*) = 1 FROM fuse_snapshot('default', 'tkm_transient')
----
1

statement error 2733
CREATE OR REPLACE STREAM tkm_transient_stream ON TABLE tkm_transient

statement ok
DROP TABLE tkm_transient_ctas

statement ok
DROP TABLE tkm_transient

statement ok
DROP TABLE tkm_transient_src

## temp table
statement ok
CREATE OR REPLACE TEMP TABLE tkm_temp(a INT, b STRING)

statement ok
INSERT INTO tkm_temp VALUES (1, 'a'), (2, 'b'), (3, 'c')

statement ok
INSERT INTO tkm_temp VALUES (4, 'd'), (5, 'e'), (6, 'f')

query II
SELECT count(*), sum(a) FROM tkm_temp
----
6 21

query I
SELECT count(*) FROM fuse_block('default', 'tkm_temp')
----
2

statement ok
UPDATE tkm_temp SET b = 'x' WHERE a = 2

query I
SELECT count(*) FROM tkm_temp WHERE b = 'x'
----
1

statement ok
DELETE FROM tkm_temp WHERE a = 6

query II
SELECT count(*), sum(a) FROM tkm_temp
----
5 15

statement ok
REPLACE INTO tkm_temp ON (a) VALUES (1, 'r'), (7, 'g')

query II
SELECT count(*), sum(a) FROM tkm_temp
----
6 22

query T
SELECT b FROM tkm_temp WHERE a = 1
----
r

statement ok
CREATE OR REPLACE TABLE tkm_temp_src(a INT, b STRING)

statement ok
INSERT INTO tkm_temp_src VALUES (2, 'm'), (8, 'h')

statement ok
MERGE INTO tkm_temp USING tkm_temp_src AS s ON tkm_temp.a = s.a WHEN MATCHED THEN UPDATE SET b = s.b WHEN NOT MATCHED THEN INSERT VALUES (s.a, s.b)

query II
SELECT count(*), sum(a) FROM tkm_temp
----
7 30

query T
SELECT b FROM tkm_temp WHERE a = 2
----
m

statement ok
ALTER TABLE tkm_temp ADD COLUMN c INT DEFAULT 9

query I
SELECT sum(c) FROM tkm_temp
----
63

statement ok
ALTER TABLE tkm_temp RENAME COLUMN c TO d

query I
SELECT sum(d) FROM tkm_temp
----
63

statement ok
ALTER TABLE tkm_temp DROP COLUMN d

statement error 1065
SELECT d FROM tkm_temp

query II
SELECT count(*), sum(a) FROM tkm_temp
----
7 30

statement ok
OPTIMIZE TABLE tkm_temp COMPACT

query II
SELECT count(*), sum(a) FROM tkm_temp
----
7 30

query I
SELECT count(*) FROM fuse_block('default', 'tkm_temp')
----
1

statement ok
SET auto_compaction_imperfect_blocks_threshold = 2

statement ok
INSERT INTO tkm_temp VALUES (9, 'i')

statement ok
INSERT INTO tkm_temp VALUES (10, 'j')

statement ok
INSERT INTO tkm_temp VALUES (11, 'k')

statement ok
UNSET auto_compaction_imperfect_blocks_threshold

query II
SELECT count(*), sum(a) FROM tkm_temp
----
10 60

query B
SELECT count(*) < 4 FROM fuse_block('default', 'tkm_temp')
----
1

statement ok
BEGIN

statement ok
INSERT INTO tkm_temp VALUES (12, 'l')

statement ok
DELETE FROM tkm_temp WHERE a = 12

statement ok
INSERT INTO tkm_temp VALUES (13, 'm')

statement ok
UPDATE tkm_temp SET b = 'M' WHERE a = 13

statement ok
COMMIT

query II
SELECT count(*), sum(a) FROM tkm_temp
----
11 73

query T
SELECT b FROM tkm_temp WHERE a = 13
----
M

statement ok
BEGIN

statement ok
INSERT INTO tkm_temp VALUES (14, 'n')

statement ok
ROLLBACK

query II
SELECT count(*), sum(a) FROM tkm_temp
----
11 73

statement ok
INSERT OVERWRITE tkm_temp VALUES (100, 'z')

query II
SELECT count(*), sum(a) FROM tkm_temp
----
1 100

statement ok
TRUNCATE TABLE tkm_temp

query I
SELECT count(*) FROM tkm_temp
----
0

statement ok
INSERT INTO tkm_temp VALUES (1, 'a')

query I
SELECT count(*) FROM tkm_temp
----
1

statement ok
CREATE OR REPLACE TEMP TABLE tkm_temp_ctas AS SELECT * FROM tkm_temp

query I
SELECT count(*) FROM tkm_temp_ctas
----
1

statement ok
SET data_retention_num_snapshots_to_keep = 20

statement ok
INSERT INTO tkm_temp VALUES (2, 'b')

statement ok
INSERT INTO tkm_temp VALUES (3, 'c')

statement ok
UNSET data_retention_num_snapshots_to_keep

query B
SELECT count(*) > 1 FROM fuse_snapshot('default', 'tkm_temp')
----
1

statement error 2733
CREATE OR REPLACE STREAM tkm_temp_stream ON TABLE tkm_temp

statement ok
DROP TABLE tkm_temp_ctas

statement ok
DROP TABLE tkm_temp

statement ok
DROP TABLE tkm_temp_src
