# Generated by tests/sqllogictests/scripts/gen_mutation_key_matrix.py.
# Do not edit by hand; change the generator and regenerate both files.
# Row-set assertions cover matching, nonmatching and all-NULL keys,
# including repeated mutations and multi-block targets.

statement ok
SET timezone = 'UTC'

# REPLACE / INT / NOT NULL
statement ok
CREATE TABLE mkm_replace_int_not_null (k INT NOT NULL, v STRING) ROW_PER_BLOCK = 2

statement ok
CREATE TABLE mkm_replace_int_not_null_src (k INT NOT NULL, v STRING)

statement ok
INSERT INTO mkm_replace_int_not_null VALUES (1, 'old1'), (2, 'old2')

statement ok
INSERT INTO mkm_replace_int_not_null VALUES (4, 'old4')

statement ok
INSERT INTO mkm_replace_int_not_null_src VALUES (1, 'new1'), (3, 'new3')

statement ok
REPLACE INTO mkm_replace_int_not_null ON (k) SELECT k, v FROM mkm_replace_int_not_null_src

query TI
SELECT v, if(k IS NULL, 1, 0) FROM mkm_replace_int_not_null ORDER BY v
----
new1 0
new3 0
old2 0
old4 0

statement ok
TRUNCATE TABLE mkm_replace_int_not_null_src

statement ok
INSERT INTO mkm_replace_int_not_null_src VALUES (1, 'new1_again')

statement ok
REPLACE INTO mkm_replace_int_not_null ON (k) SELECT k, v FROM mkm_replace_int_not_null_src

query TI
SELECT v, if(k IS NULL, 1, 0) FROM mkm_replace_int_not_null ORDER BY v
----
new1_again 0
new3 0
old2 0
old4 0

statement ok
DROP TABLE mkm_replace_int_not_null_src

statement ok
DROP TABLE mkm_replace_int_not_null

# REPLACE / INT / NULL
statement ok
CREATE TABLE mkm_replace_int_nullable (k INT NULL, v STRING) ROW_PER_BLOCK = 2

statement ok
CREATE TABLE mkm_replace_int_nullable_src (k INT NULL, v STRING)

statement ok
INSERT INTO mkm_replace_int_nullable VALUES (1, 'old1'), (2, 'old2')

statement ok
INSERT INTO mkm_replace_int_nullable VALUES (4, 'old4')

statement ok
INSERT INTO mkm_replace_int_nullable VALUES (NULL, 'null_old')

statement ok
INSERT INTO mkm_replace_int_nullable_src VALUES (1, 'new1'), (3, 'new3')

statement ok
INSERT INTO mkm_replace_int_nullable_src VALUES (NULL, 'null_new')

statement ok
REPLACE INTO mkm_replace_int_nullable ON (k) SELECT k, v FROM mkm_replace_int_nullable_src

query TI
SELECT v, if(k IS NULL, 1, 0) FROM mkm_replace_int_nullable ORDER BY v
----
new1 0
new3 0
null_new 1
null_old 1
old2 0
old4 0

statement ok
TRUNCATE TABLE mkm_replace_int_nullable_src

statement ok
INSERT INTO mkm_replace_int_nullable_src VALUES (1, 'new1_again')

statement ok
INSERT INTO mkm_replace_int_nullable_src VALUES (NULL, 'null_again')

statement ok
REPLACE INTO mkm_replace_int_nullable ON (k) SELECT k, v FROM mkm_replace_int_nullable_src

query TI
SELECT v, if(k IS NULL, 1, 0) FROM mkm_replace_int_nullable ORDER BY v
----
new1_again 0
new3 0
null_again 1
null_new 1
null_old 1
old2 0
old4 0

statement ok
TRUNCATE TABLE mkm_replace_int_nullable

statement ok
TRUNCATE TABLE mkm_replace_int_nullable_src

statement ok
INSERT INTO mkm_replace_int_nullable VALUES (NULL, 'only_old1'), (NULL, 'only_old2')

statement ok
INSERT INTO mkm_replace_int_nullable_src VALUES (NULL, 'only_new')

statement ok
REPLACE INTO mkm_replace_int_nullable ON (k) SELECT k, v FROM mkm_replace_int_nullable_src

query TI
SELECT v, if(k IS NULL, 1, 0) FROM mkm_replace_int_nullable ORDER BY v
----
only_new 1
only_old1 1
only_old2 1

statement ok
DROP TABLE mkm_replace_int_nullable_src

statement ok
DROP TABLE mkm_replace_int_nullable

# MERGE / INT / NOT NULL
statement ok
CREATE TABLE mkm_merge_int_not_null (k INT NOT NULL, v STRING) ROW_PER_BLOCK = 2

statement ok
CREATE TABLE mkm_merge_int_not_null_src (k INT NOT NULL, v STRING)

statement ok
INSERT INTO mkm_merge_int_not_null VALUES (1, 'old1'), (2, 'old2')

statement ok
INSERT INTO mkm_merge_int_not_null VALUES (4, 'old4')

statement ok
INSERT INTO mkm_merge_int_not_null_src VALUES (1, 'new1'), (3, 'new3')

statement ok
MERGE INTO mkm_merge_int_not_null USING mkm_merge_int_not_null_src AS s ON mkm_merge_int_not_null.k = s.k WHEN MATCHED THEN UPDATE SET v = s.v WHEN NOT MATCHED THEN INSERT (k, v) VALUES (s.k, s.v)

query TI
SELECT v, if(k IS NULL, 1, 0) FROM mkm_merge_int_not_null ORDER BY v
----
new1 0
new3 0
old2 0
old4 0

statement ok
TRUNCATE TABLE mkm_merge_int_not_null_src

statement ok
INSERT INTO mkm_merge_int_not_null_src VALUES (1, 'new1_again')

statement ok
MERGE INTO mkm_merge_int_not_null USING mkm_merge_int_not_null_src AS s ON mkm_merge_int_not_null.k = s.k WHEN MATCHED THEN UPDATE SET v = s.v WHEN NOT MATCHED THEN INSERT (k, v) VALUES (s.k, s.v)

query TI
SELECT v, if(k IS NULL, 1, 0) FROM mkm_merge_int_not_null ORDER BY v
----
new1_again 0
new3 0
old2 0
old4 0

statement ok
DROP TABLE mkm_merge_int_not_null_src

statement ok
DROP TABLE mkm_merge_int_not_null

# MERGE / INT / NULL
statement ok
CREATE TABLE mkm_merge_int_nullable (k INT NULL, v STRING) ROW_PER_BLOCK = 2

statement ok
CREATE TABLE mkm_merge_int_nullable_src (k INT NULL, v STRING)

statement ok
INSERT INTO mkm_merge_int_nullable VALUES (1, 'old1'), (2, 'old2')

statement ok
INSERT INTO mkm_merge_int_nullable VALUES (4, 'old4')

statement ok
INSERT INTO mkm_merge_int_nullable VALUES (NULL, 'null_old')

statement ok
INSERT INTO mkm_merge_int_nullable_src VALUES (1, 'new1'), (3, 'new3')

statement ok
INSERT INTO mkm_merge_int_nullable_src VALUES (NULL, 'null_new')

statement ok
MERGE INTO mkm_merge_int_nullable USING mkm_merge_int_nullable_src AS s ON mkm_merge_int_nullable.k = s.k WHEN MATCHED THEN UPDATE SET v = s.v WHEN NOT MATCHED THEN INSERT (k, v) VALUES (s.k, s.v)

query TI
SELECT v, if(k IS NULL, 1, 0) FROM mkm_merge_int_nullable ORDER BY v
----
new1 0
new3 0
null_new 1
null_old 1
old2 0
old4 0

statement ok
TRUNCATE TABLE mkm_merge_int_nullable_src

statement ok
INSERT INTO mkm_merge_int_nullable_src VALUES (1, 'new1_again')

statement ok
INSERT INTO mkm_merge_int_nullable_src VALUES (NULL, 'null_again')

statement ok
MERGE INTO mkm_merge_int_nullable USING mkm_merge_int_nullable_src AS s ON mkm_merge_int_nullable.k = s.k WHEN MATCHED THEN UPDATE SET v = s.v WHEN NOT MATCHED THEN INSERT (k, v) VALUES (s.k, s.v)

query TI
SELECT v, if(k IS NULL, 1, 0) FROM mkm_merge_int_nullable ORDER BY v
----
new1_again 0
new3 0
null_again 1
null_new 1
null_old 1
old2 0
old4 0

statement ok
TRUNCATE TABLE mkm_merge_int_nullable

statement ok
TRUNCATE TABLE mkm_merge_int_nullable_src

statement ok
INSERT INTO mkm_merge_int_nullable VALUES (NULL, 'only_old1'), (NULL, 'only_old2')

statement ok
INSERT INTO mkm_merge_int_nullable_src VALUES (NULL, 'only_new')

statement ok
MERGE INTO mkm_merge_int_nullable USING mkm_merge_int_nullable_src AS s ON mkm_merge_int_nullable.k = s.k WHEN MATCHED THEN UPDATE SET v = s.v WHEN NOT MATCHED THEN INSERT (k, v) VALUES (s.k, s.v)

query TI
SELECT v, if(k IS NULL, 1, 0) FROM mkm_merge_int_nullable ORDER BY v
----
only_new 1
only_old1 1
only_old2 1

statement ok
DROP TABLE mkm_merge_int_nullable_src

statement ok
DROP TABLE mkm_merge_int_nullable

# REPLACE / DECIMAL(38, 6) / NOT NULL
statement ok
CREATE TABLE mkm_replace_decimal128_not_null (k DECIMAL(38, 6) NOT NULL, v STRING) ROW_PER_BLOCK = 2

statement ok
CREATE TABLE mkm_replace_decimal128_not_null_src (k DECIMAL(38, 6) NOT NULL, v STRING)

statement ok
INSERT INTO mkm_replace_decimal128_not_null VALUES (1.000001, 'old1'), (2.000002, 'old2')

statement ok
INSERT INTO mkm_replace_decimal128_not_null VALUES (4.000004, 'old4')

statement ok
INSERT INTO mkm_replace_decimal128_not_null_src VALUES (1.000001, 'new1'), (3.000003, 'new3')

statement ok
REPLACE INTO mkm_replace_decimal128_not_null ON (k) SELECT k, v FROM mkm_replace_decimal128_not_null_src

query TI
SELECT v, if(k IS NULL, 1, 0) FROM mkm_replace_decimal128_not_null ORDER BY v
----
new1 0
new3 0
old2 0
old4 0

statement ok
TRUNCATE TABLE mkm_replace_decimal128_not_null_src

statement ok
INSERT INTO mkm_replace_decimal128_not_null_src VALUES (1.000001, 'new1_again')

statement ok
REPLACE INTO mkm_replace_decimal128_not_null ON (k) SELECT k, v FROM mkm_replace_decimal128_not_null_src

query TI
SELECT v, if(k IS NULL, 1, 0) FROM mkm_replace_decimal128_not_null ORDER BY v
----
new1_again 0
new3 0
old2 0
old4 0

statement ok
DROP TABLE mkm_replace_decimal128_not_null_src

statement ok
DROP TABLE mkm_replace_decimal128_not_null

# REPLACE / DECIMAL(38, 6) / NULL
statement ok
CREATE TABLE mkm_replace_decimal128_nullable (k DECIMAL(38, 6) NULL, v STRING) ROW_PER_BLOCK = 2

statement ok
CREATE TABLE mkm_replace_decimal128_nullable_src (k DECIMAL(38, 6) NULL, v STRING)

statement ok
INSERT INTO mkm_replace_decimal128_nullable VALUES (1.000001, 'old1'), (2.000002, 'old2')

statement ok
INSERT INTO mkm_replace_decimal128_nullable VALUES (4.000004, 'old4')

statement ok
INSERT INTO mkm_replace_decimal128_nullable VALUES (NULL, 'null_old')

statement ok
INSERT INTO mkm_replace_decimal128_nullable_src VALUES (1.000001, 'new1'), (3.000003, 'new3')

statement ok
INSERT INTO mkm_replace_decimal128_nullable_src VALUES (NULL, 'null_new')

statement ok
REPLACE INTO mkm_replace_decimal128_nullable ON (k) SELECT k, v FROM mkm_replace_decimal128_nullable_src

query TI
SELECT v, if(k IS NULL, 1, 0) FROM mkm_replace_decimal128_nullable ORDER BY v
----
new1 0
new3 0
null_new 1
null_old 1
old2 0
old4 0

statement ok
TRUNCATE TABLE mkm_replace_decimal128_nullable_src

statement ok
INSERT INTO mkm_replace_decimal128_nullable_src VALUES (1.000001, 'new1_again')

statement ok
INSERT INTO mkm_replace_decimal128_nullable_src VALUES (NULL, 'null_again')

statement ok
REPLACE INTO mkm_replace_decimal128_nullable ON (k) SELECT k, v FROM mkm_replace_decimal128_nullable_src

query TI
SELECT v, if(k IS NULL, 1, 0) FROM mkm_replace_decimal128_nullable ORDER BY v
----
new1_again 0
new3 0
null_again 1
null_new 1
null_old 1
old2 0
old4 0

statement ok
TRUNCATE TABLE mkm_replace_decimal128_nullable

statement ok
TRUNCATE TABLE mkm_replace_decimal128_nullable_src

statement ok
INSERT INTO mkm_replace_decimal128_nullable VALUES (NULL, 'only_old1'), (NULL, 'only_old2')

statement ok
INSERT INTO mkm_replace_decimal128_nullable_src VALUES (NULL, 'only_new')

statement ok
REPLACE INTO mkm_replace_decimal128_nullable ON (k) SELECT k, v FROM mkm_replace_decimal128_nullable_src

query TI
SELECT v, if(k IS NULL, 1, 0) FROM mkm_replace_decimal128_nullable ORDER BY v
----
only_new 1
only_old1 1
only_old2 1

statement ok
DROP TABLE mkm_replace_decimal128_nullable_src

statement ok
DROP TABLE mkm_replace_decimal128_nullable

# MERGE / DECIMAL(38, 6) / NOT NULL
statement ok
CREATE TABLE mkm_merge_decimal128_not_null (k DECIMAL(38, 6) NOT NULL, v STRING) ROW_PER_BLOCK = 2

statement ok
CREATE TABLE mkm_merge_decimal128_not_null_src (k DECIMAL(38, 6) NOT NULL, v STRING)

statement ok
INSERT INTO mkm_merge_decimal128_not_null VALUES (1.000001, 'old1'), (2.000002, 'old2')

statement ok
INSERT INTO mkm_merge_decimal128_not_null VALUES (4.000004, 'old4')

statement ok
INSERT INTO mkm_merge_decimal128_not_null_src VALUES (1.000001, 'new1'), (3.000003, 'new3')

statement ok
MERGE INTO mkm_merge_decimal128_not_null USING mkm_merge_decimal128_not_null_src AS s ON mkm_merge_decimal128_not_null.k = s.k WHEN MATCHED THEN UPDATE SET v = s.v WHEN NOT MATCHED THEN INSERT (k, v) VALUES (s.k, s.v)

query TI
SELECT v, if(k IS NULL, 1, 0) FROM mkm_merge_decimal128_not_null ORDER BY v
----
new1 0
new3 0
old2 0
old4 0

statement ok
TRUNCATE TABLE mkm_merge_decimal128_not_null_src

statement ok
INSERT INTO mkm_merge_decimal128_not_null_src VALUES (1.000001, 'new1_again')

statement ok
MERGE INTO mkm_merge_decimal128_not_null USING mkm_merge_decimal128_not_null_src AS s ON mkm_merge_decimal128_not_null.k = s.k WHEN MATCHED THEN UPDATE SET v = s.v WHEN NOT MATCHED THEN INSERT (k, v) VALUES (s.k, s.v)

query TI
SELECT v, if(k IS NULL, 1, 0) FROM mkm_merge_decimal128_not_null ORDER BY v
----
new1_again 0
new3 0
old2 0
old4 0

statement ok
DROP TABLE mkm_merge_decimal128_not_null_src

statement ok
DROP TABLE mkm_merge_decimal128_not_null

# MERGE / DECIMAL(38, 6) / NULL
statement ok
CREATE TABLE mkm_merge_decimal128_nullable (k DECIMAL(38, 6) NULL, v STRING) ROW_PER_BLOCK = 2

statement ok
CREATE TABLE mkm_merge_decimal128_nullable_src (k DECIMAL(38, 6) NULL, v STRING)

statement ok
INSERT INTO mkm_merge_decimal128_nullable VALUES (1.000001, 'old1'), (2.000002, 'old2')

statement ok
INSERT INTO mkm_merge_decimal128_nullable VALUES (4.000004, 'old4')

statement ok
INSERT INTO mkm_merge_decimal128_nullable VALUES (NULL, 'null_old')

statement ok
INSERT INTO mkm_merge_decimal128_nullable_src VALUES (1.000001, 'new1'), (3.000003, 'new3')

statement ok
INSERT INTO mkm_merge_decimal128_nullable_src VALUES (NULL, 'null_new')

statement ok
MERGE INTO mkm_merge_decimal128_nullable USING mkm_merge_decimal128_nullable_src AS s ON mkm_merge_decimal128_nullable.k = s.k WHEN MATCHED THEN UPDATE SET v = s.v WHEN NOT MATCHED THEN INSERT (k, v) VALUES (s.k, s.v)

query TI
SELECT v, if(k IS NULL, 1, 0) FROM mkm_merge_decimal128_nullable ORDER BY v
----
new1 0
new3 0
null_new 1
null_old 1
old2 0
old4 0

statement ok
TRUNCATE TABLE mkm_merge_decimal128_nullable_src

statement ok
INSERT INTO mkm_merge_decimal128_nullable_src VALUES (1.000001, 'new1_again')

statement ok
INSERT INTO mkm_merge_decimal128_nullable_src VALUES (NULL, 'null_again')

statement ok
MERGE INTO mkm_merge_decimal128_nullable USING mkm_merge_decimal128_nullable_src AS s ON mkm_merge_decimal128_nullable.k = s.k WHEN MATCHED THEN UPDATE SET v = s.v WHEN NOT MATCHED THEN INSERT (k, v) VALUES (s.k, s.v)

query TI
SELECT v, if(k IS NULL, 1, 0) FROM mkm_merge_decimal128_nullable ORDER BY v
----
new1_again 0
new3 0
null_again 1
null_new 1
null_old 1
old2 0
old4 0

statement ok
TRUNCATE TABLE mkm_merge_decimal128_nullable

statement ok
TRUNCATE TABLE mkm_merge_decimal128_nullable_src

statement ok
INSERT INTO mkm_merge_decimal128_nullable VALUES (NULL, 'only_old1'), (NULL, 'only_old2')

statement ok
INSERT INTO mkm_merge_decimal128_nullable_src VALUES (NULL, 'only_new')

statement ok
MERGE INTO mkm_merge_decimal128_nullable USING mkm_merge_decimal128_nullable_src AS s ON mkm_merge_decimal128_nullable.k = s.k WHEN MATCHED THEN UPDATE SET v = s.v WHEN NOT MATCHED THEN INSERT (k, v) VALUES (s.k, s.v)

query TI
SELECT v, if(k IS NULL, 1, 0) FROM mkm_merge_decimal128_nullable ORDER BY v
----
only_new 1
only_old1 1
only_old2 1

statement ok
DROP TABLE mkm_merge_decimal128_nullable_src

statement ok
DROP TABLE mkm_merge_decimal128_nullable

# REPLACE / DATE / NOT NULL
statement ok
CREATE TABLE mkm_replace_date_not_null (k DATE NOT NULL, v STRING) ROW_PER_BLOCK = 2

statement ok
CREATE TABLE mkm_replace_date_not_null_src (k DATE NOT NULL, v STRING)

statement ok
INSERT INTO mkm_replace_date_not_null VALUES ('2026-01-01', 'old1'), ('2026-01-02', 'old2')

statement ok
INSERT INTO mkm_replace_date_not_null VALUES ('2026-01-04', 'old4')

statement ok
INSERT INTO mkm_replace_date_not_null_src VALUES ('2026-01-01', 'new1'), ('2026-01-03', 'new3')

statement ok
REPLACE INTO mkm_replace_date_not_null ON (k) SELECT k, v FROM mkm_replace_date_not_null_src

query TI
SELECT v, if(k IS NULL, 1, 0) FROM mkm_replace_date_not_null ORDER BY v
----
new1 0
new3 0
old2 0
old4 0

statement ok
TRUNCATE TABLE mkm_replace_date_not_null_src

statement ok
INSERT INTO mkm_replace_date_not_null_src VALUES ('2026-01-01', 'new1_again')

statement ok
REPLACE INTO mkm_replace_date_not_null ON (k) SELECT k, v FROM mkm_replace_date_not_null_src

query TI
SELECT v, if(k IS NULL, 1, 0) FROM mkm_replace_date_not_null ORDER BY v
----
new1_again 0
new3 0
old2 0
old4 0

statement ok
DROP TABLE mkm_replace_date_not_null_src

statement ok
DROP TABLE mkm_replace_date_not_null

# REPLACE / DATE / NULL
statement ok
CREATE TABLE mkm_replace_date_nullable (k DATE NULL, v STRING) ROW_PER_BLOCK = 2

statement ok
CREATE TABLE mkm_replace_date_nullable_src (k DATE NULL, v STRING)

statement ok
INSERT INTO mkm_replace_date_nullable VALUES ('2026-01-01', 'old1'), ('2026-01-02', 'old2')

statement ok
INSERT INTO mkm_replace_date_nullable VALUES ('2026-01-04', 'old4')

statement ok
INSERT INTO mkm_replace_date_nullable VALUES (NULL, 'null_old')

statement ok
INSERT INTO mkm_replace_date_nullable_src VALUES ('2026-01-01', 'new1'), ('2026-01-03', 'new3')

statement ok
INSERT INTO mkm_replace_date_nullable_src VALUES (NULL, 'null_new')

statement ok
REPLACE INTO mkm_replace_date_nullable ON (k) SELECT k, v FROM mkm_replace_date_nullable_src

query TI
SELECT v, if(k IS NULL, 1, 0) FROM mkm_replace_date_nullable ORDER BY v
----
new1 0
new3 0
null_new 1
null_old 1
old2 0
old4 0

statement ok
TRUNCATE TABLE mkm_replace_date_nullable_src

statement ok
INSERT INTO mkm_replace_date_nullable_src VALUES ('2026-01-01', 'new1_again')

statement ok
INSERT INTO mkm_replace_date_nullable_src VALUES (NULL, 'null_again')

statement ok
REPLACE INTO mkm_replace_date_nullable ON (k) SELECT k, v FROM mkm_replace_date_nullable_src

query TI
SELECT v, if(k IS NULL, 1, 0) FROM mkm_replace_date_nullable ORDER BY v
----
new1_again 0
new3 0
null_again 1
null_new 1
null_old 1
old2 0
old4 0

statement ok
TRUNCATE TABLE mkm_replace_date_nullable

statement ok
TRUNCATE TABLE mkm_replace_date_nullable_src

statement ok
INSERT INTO mkm_replace_date_nullable VALUES (NULL, 'only_old1'), (NULL, 'only_old2')

statement ok
INSERT INTO mkm_replace_date_nullable_src VALUES (NULL, 'only_new')

statement ok
REPLACE INTO mkm_replace_date_nullable ON (k) SELECT k, v FROM mkm_replace_date_nullable_src

query TI
SELECT v, if(k IS NULL, 1, 0) FROM mkm_replace_date_nullable ORDER BY v
----
only_new 1
only_old1 1
only_old2 1

statement ok
DROP TABLE mkm_replace_date_nullable_src

statement ok
DROP TABLE mkm_replace_date_nullable

# MERGE / DATE / NOT NULL
statement ok
CREATE TABLE mkm_merge_date_not_null (k DATE NOT NULL, v STRING) ROW_PER_BLOCK = 2

statement ok
CREATE TABLE mkm_merge_date_not_null_src (k DATE NOT NULL, v STRING)

statement ok
INSERT INTO mkm_merge_date_not_null VALUES ('2026-01-01', 'old1'), ('2026-01-02', 'old2')

statement ok
INSERT INTO mkm_merge_date_not_null VALUES ('2026-01-04', 'old4')

statement ok
INSERT INTO mkm_merge_date_not_null_src VALUES ('2026-01-01', 'new1'), ('2026-01-03', 'new3')

statement ok
MERGE INTO mkm_merge_date_not_null USING mkm_merge_date_not_null_src AS s ON mkm_merge_date_not_null.k = s.k WHEN MATCHED THEN UPDATE SET v = s.v WHEN NOT MATCHED THEN INSERT (k, v) VALUES (s.k, s.v)

query TI
SELECT v, if(k IS NULL, 1, 0) FROM mkm_merge_date_not_null ORDER BY v
----
new1 0
new3 0
old2 0
old4 0

statement ok
TRUNCATE TABLE mkm_merge_date_not_null_src

statement ok
INSERT INTO mkm_merge_date_not_null_src VALUES ('2026-01-01', 'new1_again')

statement ok
MERGE INTO mkm_merge_date_not_null USING mkm_merge_date_not_null_src AS s ON mkm_merge_date_not_null.k = s.k WHEN MATCHED THEN UPDATE SET v = s.v WHEN NOT MATCHED THEN INSERT (k, v) VALUES (s.k, s.v)

query TI
SELECT v, if(k IS NULL, 1, 0) FROM mkm_merge_date_not_null ORDER BY v
----
new1_again 0
new3 0
old2 0
old4 0

statement ok
DROP TABLE mkm_merge_date_not_null_src

statement ok
DROP TABLE mkm_merge_date_not_null

# MERGE / DATE / NULL
statement ok
CREATE TABLE mkm_merge_date_nullable (k DATE NULL, v STRING) ROW_PER_BLOCK = 2

statement ok
CREATE TABLE mkm_merge_date_nullable_src (k DATE NULL, v STRING)

statement ok
INSERT INTO mkm_merge_date_nullable VALUES ('2026-01-01', 'old1'), ('2026-01-02', 'old2')

statement ok
INSERT INTO mkm_merge_date_nullable VALUES ('2026-01-04', 'old4')

statement ok
INSERT INTO mkm_merge_date_nullable VALUES (NULL, 'null_old')

statement ok
INSERT INTO mkm_merge_date_nullable_src VALUES ('2026-01-01', 'new1'), ('2026-01-03', 'new3')

statement ok
INSERT INTO mkm_merge_date_nullable_src VALUES (NULL, 'null_new')

statement ok
MERGE INTO mkm_merge_date_nullable USING mkm_merge_date_nullable_src AS s ON mkm_merge_date_nullable.k = s.k WHEN MATCHED THEN UPDATE SET v = s.v WHEN NOT MATCHED THEN INSERT (k, v) VALUES (s.k, s.v)

query TI
SELECT v, if(k IS NULL, 1, 0) FROM mkm_merge_date_nullable ORDER BY v
----
new1 0
new3 0
null_new 1
null_old 1
old2 0
old4 0

statement ok
TRUNCATE TABLE mkm_merge_date_nullable_src

statement ok
INSERT INTO mkm_merge_date_nullable_src VALUES ('2026-01-01', 'new1_again')

statement ok
INSERT INTO mkm_merge_date_nullable_src VALUES (NULL, 'null_again')

statement ok
MERGE INTO mkm_merge_date_nullable USING mkm_merge_date_nullable_src AS s ON mkm_merge_date_nullable.k = s.k WHEN MATCHED THEN UPDATE SET v = s.v WHEN NOT MATCHED THEN INSERT (k, v) VALUES (s.k, s.v)

query TI
SELECT v, if(k IS NULL, 1, 0) FROM mkm_merge_date_nullable ORDER BY v
----
new1_again 0
new3 0
null_again 1
null_new 1
null_old 1
old2 0
old4 0

statement ok
TRUNCATE TABLE mkm_merge_date_nullable

statement ok
TRUNCATE TABLE mkm_merge_date_nullable_src

statement ok
INSERT INTO mkm_merge_date_nullable VALUES (NULL, 'only_old1'), (NULL, 'only_old2')

statement ok
INSERT INTO mkm_merge_date_nullable_src VALUES (NULL, 'only_new')

statement ok
MERGE INTO mkm_merge_date_nullable USING mkm_merge_date_nullable_src AS s ON mkm_merge_date_nullable.k = s.k WHEN MATCHED THEN UPDATE SET v = s.v WHEN NOT MATCHED THEN INSERT (k, v) VALUES (s.k, s.v)

query TI
SELECT v, if(k IS NULL, 1, 0) FROM mkm_merge_date_nullable ORDER BY v
----
only_new 1
only_old1 1
only_old2 1

statement ok
DROP TABLE mkm_merge_date_nullable_src

statement ok
DROP TABLE mkm_merge_date_nullable

# REPLACE / TIMESTAMP / NOT NULL
statement ok
CREATE TABLE mkm_replace_timestamp_not_null (k TIMESTAMP NOT NULL, v STRING) ROW_PER_BLOCK = 2

statement ok
CREATE TABLE mkm_replace_timestamp_not_null_src (k TIMESTAMP NOT NULL, v STRING)

statement ok
INSERT INTO mkm_replace_timestamp_not_null VALUES ('2026-01-01 00:00:01', 'old1'), ('2026-01-01 00:00:02', 'old2')

statement ok
INSERT INTO mkm_replace_timestamp_not_null VALUES ('2026-01-01 00:00:04', 'old4')

statement ok
INSERT INTO mkm_replace_timestamp_not_null_src VALUES ('2026-01-01 00:00:01', 'new1'), ('2026-01-01 00:00:03', 'new3')

statement ok
REPLACE INTO mkm_replace_timestamp_not_null ON (k) SELECT k, v FROM mkm_replace_timestamp_not_null_src

query TI
SELECT v, if(k IS NULL, 1, 0) FROM mkm_replace_timestamp_not_null ORDER BY v
----
new1 0
new3 0
old2 0
old4 0

statement ok
TRUNCATE TABLE mkm_replace_timestamp_not_null_src

statement ok
INSERT INTO mkm_replace_timestamp_not_null_src VALUES ('2026-01-01 00:00:01', 'new1_again')

statement ok
REPLACE INTO mkm_replace_timestamp_not_null ON (k) SELECT k, v FROM mkm_replace_timestamp_not_null_src

query TI
SELECT v, if(k IS NULL, 1, 0) FROM mkm_replace_timestamp_not_null ORDER BY v
----
new1_again 0
new3 0
old2 0
old4 0

statement ok
DROP TABLE mkm_replace_timestamp_not_null_src

statement ok
DROP TABLE mkm_replace_timestamp_not_null

# REPLACE / TIMESTAMP / NULL
statement ok
CREATE TABLE mkm_replace_timestamp_nullable (k TIMESTAMP NULL, v STRING) ROW_PER_BLOCK = 2

statement ok
CREATE TABLE mkm_replace_timestamp_nullable_src (k TIMESTAMP NULL, v STRING)

statement ok
INSERT INTO mkm_replace_timestamp_nullable VALUES ('2026-01-01 00:00:01', 'old1'), ('2026-01-01 00:00:02', 'old2')

statement ok
INSERT INTO mkm_replace_timestamp_nullable VALUES ('2026-01-01 00:00:04', 'old4')

statement ok
INSERT INTO mkm_replace_timestamp_nullable VALUES (NULL, 'null_old')

statement ok
INSERT INTO mkm_replace_timestamp_nullable_src VALUES ('2026-01-01 00:00:01', 'new1'), ('2026-01-01 00:00:03', 'new3')

statement ok
INSERT INTO mkm_replace_timestamp_nullable_src VALUES (NULL, 'null_new')

statement ok
REPLACE INTO mkm_replace_timestamp_nullable ON (k) SELECT k, v FROM mkm_replace_timestamp_nullable_src

query TI
SELECT v, if(k IS NULL, 1, 0) FROM mkm_replace_timestamp_nullable ORDER BY v
----
new1 0
new3 0
null_new 1
null_old 1
old2 0
old4 0

statement ok
TRUNCATE TABLE mkm_replace_timestamp_nullable_src

statement ok
INSERT INTO mkm_replace_timestamp_nullable_src VALUES ('2026-01-01 00:00:01', 'new1_again')

statement ok
INSERT INTO mkm_replace_timestamp_nullable_src VALUES (NULL, 'null_again')

statement ok
REPLACE INTO mkm_replace_timestamp_nullable ON (k) SELECT k, v FROM mkm_replace_timestamp_nullable_src

query TI
SELECT v, if(k IS NULL, 1, 0) FROM mkm_replace_timestamp_nullable ORDER BY v
----
new1_again 0
new3 0
null_again 1
null_new 1
null_old 1
old2 0
old4 0

statement ok
TRUNCATE TABLE mkm_replace_timestamp_nullable

statement ok
TRUNCATE TABLE mkm_replace_timestamp_nullable_src

statement ok
INSERT INTO mkm_replace_timestamp_nullable VALUES (NULL, 'only_old1'), (NULL, 'only_old2')

statement ok
INSERT INTO mkm_replace_timestamp_nullable_src VALUES (NULL, 'only_new')

statement ok
REPLACE INTO mkm_replace_timestamp_nullable ON (k) SELECT k, v FROM mkm_replace_timestamp_nullable_src

query TI
SELECT v, if(k IS NULL, 1, 0) FROM mkm_replace_timestamp_nullable ORDER BY v
----
only_new 1
only_old1 1
only_old2 1

statement ok
DROP TABLE mkm_replace_timestamp_nullable_src

statement ok
DROP TABLE mkm_replace_timestamp_nullable

# MERGE / TIMESTAMP / NOT NULL
statement ok
CREATE TABLE mkm_merge_timestamp_not_null (k TIMESTAMP NOT NULL, v STRING) ROW_PER_BLOCK = 2

statement ok
CREATE TABLE mkm_merge_timestamp_not_null_src (k TIMESTAMP NOT NULL, v STRING)

statement ok
INSERT INTO mkm_merge_timestamp_not_null VALUES ('2026-01-01 00:00:01', 'old1'), ('2026-01-01 00:00:02', 'old2')

statement ok
INSERT INTO mkm_merge_timestamp_not_null VALUES ('2026-01-01 00:00:04', 'old4')

statement ok
INSERT INTO mkm_merge_timestamp_not_null_src VALUES ('2026-01-01 00:00:01', 'new1'), ('2026-01-01 00:00:03', 'new3')

statement ok
MERGE INTO mkm_merge_timestamp_not_null USING mkm_merge_timestamp_not_null_src AS s ON mkm_merge_timestamp_not_null.k = s.k WHEN MATCHED THEN UPDATE SET v = s.v WHEN NOT MATCHED THEN INSERT (k, v) VALUES (s.k, s.v)

query TI
SELECT v, if(k IS NULL, 1, 0) FROM mkm_merge_timestamp_not_null ORDER BY v
----
new1 0
new3 0
old2 0
old4 0

statement ok
TRUNCATE TABLE mkm_merge_timestamp_not_null_src

statement ok
INSERT INTO mkm_merge_timestamp_not_null_src VALUES ('2026-01-01 00:00:01', 'new1_again')

statement ok
MERGE INTO mkm_merge_timestamp_not_null USING mkm_merge_timestamp_not_null_src AS s ON mkm_merge_timestamp_not_null.k = s.k WHEN MATCHED THEN UPDATE SET v = s.v WHEN NOT MATCHED THEN INSERT (k, v) VALUES (s.k, s.v)

query TI
SELECT v, if(k IS NULL, 1, 0) FROM mkm_merge_timestamp_not_null ORDER BY v
----
new1_again 0
new3 0
old2 0
old4 0

statement ok
DROP TABLE mkm_merge_timestamp_not_null_src

statement ok
DROP TABLE mkm_merge_timestamp_not_null

# MERGE / TIMESTAMP / NULL
statement ok
CREATE TABLE mkm_merge_timestamp_nullable (k TIMESTAMP NULL, v STRING) ROW_PER_BLOCK = 2

statement ok
CREATE TABLE mkm_merge_timestamp_nullable_src (k TIMESTAMP NULL, v STRING)

statement ok
INSERT INTO mkm_merge_timestamp_nullable VALUES ('2026-01-01 00:00:01', 'old1'), ('2026-01-01 00:00:02', 'old2')

statement ok
INSERT INTO mkm_merge_timestamp_nullable VALUES ('2026-01-01 00:00:04', 'old4')

statement ok
INSERT INTO mkm_merge_timestamp_nullable VALUES (NULL, 'null_old')

statement ok
INSERT INTO mkm_merge_timestamp_nullable_src VALUES ('2026-01-01 00:00:01', 'new1'), ('2026-01-01 00:00:03', 'new3')

statement ok
INSERT INTO mkm_merge_timestamp_nullable_src VALUES (NULL, 'null_new')

statement ok
MERGE INTO mkm_merge_timestamp_nullable USING mkm_merge_timestamp_nullable_src AS s ON mkm_merge_timestamp_nullable.k = s.k WHEN MATCHED THEN UPDATE SET v = s.v WHEN NOT MATCHED THEN INSERT (k, v) VALUES (s.k, s.v)

query TI
SELECT v, if(k IS NULL, 1, 0) FROM mkm_merge_timestamp_nullable ORDER BY v
----
new1 0
new3 0
null_new 1
null_old 1
old2 0
old4 0

statement ok
TRUNCATE TABLE mkm_merge_timestamp_nullable_src

statement ok
INSERT INTO mkm_merge_timestamp_nullable_src VALUES ('2026-01-01 00:00:01', 'new1_again')

statement ok
INSERT INTO mkm_merge_timestamp_nullable_src VALUES (NULL, 'null_again')

statement ok
MERGE INTO mkm_merge_timestamp_nullable USING mkm_merge_timestamp_nullable_src AS s ON mkm_merge_timestamp_nullable.k = s.k WHEN MATCHED THEN UPDATE SET v = s.v WHEN NOT MATCHED THEN INSERT (k, v) VALUES (s.k, s.v)

query TI
SELECT v, if(k IS NULL, 1, 0) FROM mkm_merge_timestamp_nullable ORDER BY v
----
new1_again 0
new3 0
null_again 1
null_new 1
null_old 1
old2 0
old4 0

statement ok
TRUNCATE TABLE mkm_merge_timestamp_nullable

statement ok
TRUNCATE TABLE mkm_merge_timestamp_nullable_src

statement ok
INSERT INTO mkm_merge_timestamp_nullable VALUES (NULL, 'only_old1'), (NULL, 'only_old2')

statement ok
INSERT INTO mkm_merge_timestamp_nullable_src VALUES (NULL, 'only_new')

statement ok
MERGE INTO mkm_merge_timestamp_nullable USING mkm_merge_timestamp_nullable_src AS s ON mkm_merge_timestamp_nullable.k = s.k WHEN MATCHED THEN UPDATE SET v = s.v WHEN NOT MATCHED THEN INSERT (k, v) VALUES (s.k, s.v)

query TI
SELECT v, if(k IS NULL, 1, 0) FROM mkm_merge_timestamp_nullable ORDER BY v
----
only_new 1
only_old1 1
only_old2 1

statement ok
DROP TABLE mkm_merge_timestamp_nullable_src

statement ok
DROP TABLE mkm_merge_timestamp_nullable

statement ok
UNSET timezone
