statement ok
DROP DATABASE IF EXISTS db1

statement ok
CREATE DATABASE db1

statement ok
USE db1

statement ok
set enable_table_lock = 0

statement ok
create table t(a int) cluster by(a) change_tracking = false

statement ok
insert into t values(1),(2)

statement error 1065
select a, _origin_version is null, _origin_block_id is null, _origin_block_row_num from t order by a

statement ok
alter table t set options(change_tracking = true)

statement ok
insert into t values(3),(4)

query IBBI
select a, _origin_version is null, _origin_block_id is null, _origin_block_row_num from t order by a
----
1 1 1 NULL
2 1 1 NULL
3 1 1 NULL
4 1 1 NULL

statement ok
delete from t where a = 3

query IBBI
select a, _origin_version is null, _origin_block_id is null, _origin_block_row_num from t order by a
----
1 1 1 NULL
2 1 1 NULL
4 0 0 0

statement ok
update t set a=3 where _origin_version is not null

statement ok
optimize table t compact

query IBBI
select a, _origin_version is null, _origin_block_id is null, _origin_block_row_num from t order by a
----
1 0 0 0
2 0 0 1
3 0 0 0

statement ok
insert into t values(5),(6)

statement ok
alter table t recluster

query IBBI
select a, _origin_version is null, _origin_block_id is null, _origin_block_row_num from t order by a
----
1 0 0 0
2 0 0 1
3 0 0 0
5 0 0 0
6 0 0 1

statement error 1065
select change$is_update from t

statement error 1002
replace into t on(a) values(7)

statement ok
create table t2(a int)

statement ok
insert into t2 values(1)

statement error 1002
merge into t using t2 on t.a = t2.a when matched then delete

statement ok
set enable_table_lock = 1

statement ok
drop table t all

statement ok
drop table t2 all

statement ok
drop database db1
