statement ok
DROP DATABASE IF EXISTS db_09_0054

statement ok
CREATE DATABASE db_09_0054

statement ok
USE db_09_0054

statement ok
CREATE TABLE t(p INT, c INT, v STRING) PARTITION BY (p % 3) CLUSTER BY (c) ROW_PER_BLOCK=1000 BLOCK_PER_SEGMENT=1000

statement ok
INSERT INTO t VALUES (0, 30, 'a0'), (1, 20, 'a1'), (2, 10, 'a2')

statement ok
INSERT INTO t VALUES (3, 31, 'b0'), (4, 21, 'b1'), (5, 11, 'b2')

query II
SELECT segment_count, block_count FROM fuse_snapshot('db_09_0054', 't') LIMIT 1
----
6 6

# Segment compaction may combine metadata only inside one physical partition.
statement ok
OPTIMIZE TABLE t COMPACT SEGMENT

query II
SELECT segment_count, block_count FROM fuse_snapshot('db_09_0054', 't') LIMIT 1
----
3 6

# Block compaction may merge the two small blocks in each partition, but never
# merge blocks from different partition values.
statement ok
OPTIMIZE TABLE t COMPACT

query II
SELECT segment_count, block_count FROM fuse_snapshot('db_09_0054', 't') LIMIT 1
----
3 3

# The exact partition expression is evaluated against the partition prefix in
# Segment ClusterStatistics before BlockMeta is read.
query T
EXPLAIN SELECT p, c, v FROM t WHERE p % 3 = 1
----
TableScan
├── table: default.db_09_0054.t
├── scan id: 0
├── output columns: [p (#0), c (#1), v (#2)]
├── read rows: 2
├── read size: < 1 KiB
├── partitions total: 3
├── partitions scanned: 1
├── pruning stats: [segments: <read cost: <slt:ignore>, decompress cost: <slt:ignore>, range pruning: 3 to 1 cost: <slt:ignore>>, blocks: <range pruning: 1 to 1 cost: <slt:ignore>>]
├── push downs: [filters: [is_true(t.p (#0) % 3 = 1)], limit: NONE]
└── estimated rows: 2.00

# An equality on the source column is projected through the partition expression.
query T
EXPLAIN SELECT p, c, v FROM t WHERE p = 4
----
TableScan
├── table: default.db_09_0054.t
├── scan id: 0
├── output columns: [p (#0), c (#1), v (#2)]
├── read rows: 2
├── read size: < 1 KiB
├── partitions total: 3
├── partitions scanned: 1
├── pruning stats: [segments: <read cost: <slt:ignore>, decompress cost: <slt:ignore>, range pruning: 3 to 1 cost: <slt:ignore>>, blocks: <range pruning: 1 to 1 cost: <slt:ignore>, bloom index read cost: <slt:ignore>, bloom pruning: 1 to 1 cost: <slt:ignore>>]
├── push downs: [filters: [is_true(t.p (#0) = 4)], limit: NONE]
└── estimated rows: 1.00

# Conjunctive source-column ranges are combined before being projected through
# the partition expression.
statement ok
CREATE TABLE range_partitioned(p INT, v STRING) PARTITION BY (abs(p)) ROW_PER_BLOCK=1000 BLOCK_PER_SEGMENT=1000

statement ok
INSERT INTO range_partitioned VALUES (-5, 'n5'), (5, 'p5'), (-4, 'n4'), (4, 'p4'), (-3, 'n3'), (3, 'p3'), (-2, 'n2'), (2, 'p2'), (-1, 'n1'), (1, 'p1'), (0, 'z')

query T
EXPLAIN SELECT p, v FROM range_partitioned WHERE p >= 3 AND p <= 4
----
TableScan
├── table: default.db_09_0054.range_partitioned
├── scan id: 0
├── output columns: [p (#0), v (#1)]
├── read rows: 4
├── read size: < 1 KiB
├── partitions total: 6
├── partitions scanned: 2
├── pruning stats: [segments: <read cost: <slt:ignore>, decompress cost: <slt:ignore>, range pruning: 6 to 2 cost: <slt:ignore>>, blocks: <range pruning: 2 to 2 cost: <slt:ignore>>]
├── push downs: [filters: [range_partitioned.p (#0) >= 3 and range_partitioned.p (#0) <= 4], limit: NONE]
└── estimated rows: 2.00

# Range pruning must not remove matching rows.
query II rowsort
SELECT p, length(v) FROM range_partitioned WHERE p >= 3 AND p <= 4
----
3 2
4 2

# Strict bounds with constants on the left are normalized before projection.
query T
EXPLAIN SELECT p, v FROM range_partitioned WHERE 4 > p AND 2 < p
----
TableScan
├── table: default.db_09_0054.range_partitioned
├── scan id: 0
├── output columns: [p (#0), v (#1)]
├── read rows: 2
├── read size: < 1 KiB
├── partitions total: 6
├── partitions scanned: 1
├── pruning stats: [segments: <read cost: <slt:ignore>, decompress cost: <slt:ignore>, range pruning: 6 to 1 cost: <slt:ignore>>, blocks: <range pruning: 1 to 1 cost: <slt:ignore>>]
├── push downs: [filters: [range_partitioned.p (#0) < 4 and range_partitioned.p (#0) > 2], limit: NONE]
└── estimated rows: 1.00

query I
SELECT p FROM range_partitioned WHERE 4 > p AND 2 < p
----
3

# Comparisons inside OR are simplified independently, never merged as an AND range.
query T
EXPLAIN SELECT p, v FROM range_partitioned WHERE p = 3 OR p = -5
----
TableScan
├── table: default.db_09_0054.range_partitioned
├── scan id: 0
├── output columns: [p (#0), v (#1)]
├── read rows: 4
├── read size: < 1 KiB
├── partitions total: 6
├── partitions scanned: 2
├── pruning stats: [segments: <read cost: <slt:ignore>, decompress cost: <slt:ignore>, range pruning: 6 to 2 cost: <slt:ignore>>, blocks: <range pruning: 2 to 2 cost: <slt:ignore>, bloom index read cost: <slt:ignore>, bloom pruning: 2 to 2 cost: <slt:ignore>>]
├── push downs: [filters: [range_partitioned.p (#0) = 3 or range_partitioned.p (#0) = -5], limit: NONE]
└── estimated rows: 1.91

query IS rowsort
SELECT p, v FROM range_partitioned WHERE p = 3 OR p = -5
----
-5 n5
3 p3

# Each source-column predicate is projected through its matching partition key.
statement ok
CREATE TABLE multi_partitioned(a INT, b INT) PARTITION BY (a % 2, b % 2) ROW_PER_BLOCK=1000 BLOCK_PER_SEGMENT=1000

statement ok
INSERT INTO multi_partitioned VALUES (0, 0), (2, 2), (0, 1), (2, 3), (1, 0), (3, 2), (1, 1), (3, 3)

query T
EXPLAIN SELECT a, b FROM multi_partitioned WHERE a = 2 AND b = 3
----
TableScan
├── table: default.db_09_0054.multi_partitioned
├── scan id: 0
├── output columns: [a (#0), b (#1)]
├── read rows: 2
├── read size: < 1 KiB
├── partitions total: 4
├── partitions scanned: 1
├── pruning stats: [segments: <read cost: <slt:ignore>, decompress cost: <slt:ignore>, range pruning: 4 to 1 cost: <slt:ignore>>, blocks: <range pruning: 1 to 1 cost: <slt:ignore>, bloom index read cost: <slt:ignore>, bloom pruning: 1 to 1 cost: <slt:ignore>>]
├── push downs: [filters: [multi_partitioned.a (#0) = 2 and multi_partitioned.b (#1) = 3], limit: NONE]
└── estimated rows: 2.00

query II
SELECT a, b FROM multi_partitioned WHERE a = 2 AND b = 3
----
2 3

# OR keeps every partition that can satisfy either partition-key dimension.
query T
EXPLAIN SELECT a, b FROM multi_partitioned WHERE a = 2 OR b = 3
----
TableScan
├── table: default.db_09_0054.multi_partitioned
├── scan id: 0
├── output columns: [a (#0), b (#1)]
├── read rows: 6
├── read size: < 1 KiB
├── partitions total: 4
├── partitions scanned: 3
├── pruning stats: [segments: <read cost: <slt:ignore>, decompress cost: <slt:ignore>, range pruning: 4 to 3 cost: <slt:ignore>>, blocks: <range pruning: 3 to 3 cost: <slt:ignore>, bloom index read cost: <slt:ignore>, bloom pruning: 3 to 3 cost: <slt:ignore>>]
├── push downs: [filters: [multi_partitioned.a (#0) = 2 or multi_partitioned.b (#1) = 3], limit: NONE]
└── estimated rows: 3.50

query II rowsort
SELECT a, b FROM multi_partitioned WHERE a = 2 OR b = 3
----
2 2
2 3
3 3

query IIT rowsort
SELECT p, c, v FROM t
----
0 30 a0
1 20 a1
2 10 a2
3 31 b0
4 21 b1
5 11 b2

statement ok
UPDATE t SET p = p + 1 WHERE p = 0

query IIT rowsort
SELECT p, c, v FROM t
----
1 20 a1
1 30 a0
2 10 a2
3 31 b0
4 21 b1
5 11 b2

# Moving a row to another partition must preserve physical partition boundaries.
statement ok
OPTIMIZE TABLE t COMPACT

query II
SELECT segment_count, block_count FROM fuse_snapshot('db_09_0054', 't') LIMIT 1
----
3 3

statement error
ALTER TABLE t PARTITION BY (c)

statement error PARTITION BY cannot be combined with HILBERT CLUSTER BY
ALTER TABLE t CLUSTER BY HILBERT(p, c)

statement error referenced by partition key
ALTER TABLE t DROP COLUMN p

statement ok
ALTER TABLE t RENAME COLUMN p TO part

statement ok
INSERT INTO t VALUES (6, 32, 'c0')

query I
SELECT count(*) FROM t
----
7

statement ok
CREATE TABLE partition_only(p INT, v STRING) PARTITION BY (p % 2) ROW_PER_BLOCK=1000 BLOCK_PER_SEGMENT=1000

statement ok
INSERT INTO partition_only VALUES (0, 'a'), (1, 'b'), (2, 'c'), (3, 'd')

query II
SELECT segment_count, block_count FROM fuse_snapshot('db_09_0054', 'partition_only') LIMIT 1
----
2 2

query II rowsort
SELECT p, length(v) FROM partition_only
----
0 1
1 1
2 1
3 1

statement ok
CREATE TABLE replace_partitioned(id INT, p INT) PARTITION BY (p % 2) ROW_PER_BLOCK=1000 BLOCK_PER_SEGMENT=1000

statement ok
REPLACE INTO replace_partitioned ON(id) VALUES (1, 0), (2, 1), (3, 2), (4, 3)

# REPLACE INTO is sorted and split before serialization, so a mixed input block
# produces one block and segment per physical partition.
query II
SELECT segment_count, block_count FROM fuse_snapshot('db_09_0054', 'replace_partitioned') LIMIT 1
----
2 2

query II rowsort
SELECT id, p FROM replace_partitioned
----
1 0
2 1
3 2
4 3

statement ok
CREATE TABLE merge_partitioned(id INT, p INT) PARTITION BY (p % 2) ROW_PER_BLOCK=1000 BLOCK_PER_SEGMENT=1000

statement ok
INSERT INTO merge_partitioned VALUES (1, 0), (2, 0), (3, 1)

statement ok
MERGE INTO merge_partitioned AS t USING (SELECT 1 AS id, 1 AS p) AS s ON t.id = s.id WHEN MATCHED THEN UPDATE SET t.p = s.p

query II rowsort
SELECT id, p FROM merge_partitioned
----
1 1
2 0
3 1

statement ok
OPTIMIZE TABLE merge_partitioned COMPACT

query II
SELECT segment_count, block_count FROM fuse_snapshot('db_09_0054', 'merge_partitioned') LIMIT 1
----
2 2

# Like CLUSTER BY, each physical key expression may reference only one source
# column. Composite partitioning is expressed as PARTITION BY (a, b).
statement error PARTITION BY expression `a \+ b` is invalid
CREATE TABLE multi_column_expr(a INT, b INT) PARTITION BY (a + b)

statement ok
DROP DATABASE db_09_0054
