## Copyright 2023 Databend Cloud
##
## Licensed under the Elastic License, Version 2.0 (the "License");
## you may not use this file except in compliance with the License.
## You may obtain a copy of the License at
##
##     https://www.elastic.co/licensing/elastic-license
##
## Unless required by applicable law or agreed to in writing, software
## distributed under the License is distributed on an "AS IS" BASIS,
## WITHOUT WARRANTIES OR CONDITIONS OF ANY KIND, either express or implied.
## See the License for the specific language governing permissions and
## limitations under the License.

statement ok
create or replace database issue_19037;

statement ok
use issue_19037;

statement ok
create or replace table t( a int, b BITMAP);

statement ok
create or replace stream s on table t APPEND_ONLY = false;

statement ok
insert into t values(1,  BUILD_BITMAP([3, 7, 9]));

query I
select  count() from s  with consume;
----
1

statement ok
update t set b = BUILD_BITMAP([3, 7, 10]) where a = 1;

query I
select count() from s  with consume;
----
2
