## Copyright 2023 Databend Cloud
##
## Licensed under the Elastic License, Version 2.0 (the "License");
## you may not use this file except in compliance with the License.
## You may obtain a copy of the License at
##
##     https://www.elastic.co/licensing/elastic-license
##
## Unless required by applicable law or agreed to in writing, software
## distributed under the License is distributed on an "AS IS" BASIS,
## WITHOUT WARRANTIES OR CONDITIONS OF ANY KIND, either express or implied.
## See the License for the specific language governing permissions and
## limitations under the License.

statement ok
DROP DATABASE IF EXISTS test_stream

statement ok
CREATE DATABASE test_stream

statement ok
USE test_stream

statement ok
drop table if exists t

statement ok
create table t(a int)

statement ok
insert into t values(1)

statement ok
alter table t set options(change_tracking=true)

statement ok
create stream if not exists s on table t

statement error 2732
create stream s on table t

statement ok
insert into t values(2)

statement error 1025
create stream s1 on table t1

statement ok
create stream s1 on table t append_only = true

statement ok
insert into t values(3)

statement ok
optimize table t compact

query I
select * from t
----
1
2
3

query ITB
select a, change$action, change$is_update from s
----
2 INSERT 0
3 INSERT 0

query ITB
select a, change$action, change$is_update from s1
----
3 INSERT 0

statement ok
create stream s2 on table t at (stream => s) comment='this is a stream'

query ITB
select a, change$action, change$is_update from s2
----
2 INSERT 0
3 INSERT 0

statement ok
create table t1(a int)

statement ok
insert into t1 select a from s

query I
select a from s
----

statement ok
insert into t values(4)

statement ok
replace into t1 on(a) select a from s

query I
select * from t1 order by a
----
2
3
4

statement ok
set enable_experimental_merge_into = 1

query I
merge into t1 using (select a from s1) as t2 on t1.a = t2.a when matched then delete
----
2

query I
select * from t1
----
2

query I
select a from s1
----

query ITB
select a, change$action, change$is_update from s2 order by a
----
2 INSERT 0
3 INSERT 0
4 INSERT 0

statement ok
create table t2(a int)

statement ok
create stream s3 on table t2

statement ok
set hide_options_in_show_create_table=0

query TT
show create table t2
----
t2 CREATE TABLE t2 ( a INT NULL ) ENGINE=FUSE CHANGE_TRACKING='true' COMPRESSION='zstd' STORAGE_FORMAT='parquet'

statement ok
insert into t2 values(3),(4)

query ITB
select a, change$action, change$is_update from s3
----
3 INSERT 0
4 INSERT 0

statement ok
insert into t1 select s2.a from s2 join s3 on s2.a = s3.a

query I
select * from t1 order by a
----
2
3
4

query I
select a from s2
----

query I
select a from s3
----

statement ok
drop stream s3

statement ok
drop table t2 all

query TTTTT
select catalog, database, name, mode, table_name, comment from system.streams where database='test_stream' order by name
----
default test_stream s append_only test_stream.t (empty)
default test_stream s1 append_only test_stream.t (empty)
default test_stream s2 append_only test_stream.t this is a stream

statement ok
drop stream s

statement ok
drop stream s1

statement error 2730
drop stream s1

statement error 1302
drop stream t1

statement ok
drop table t1 all

query T
show columns from s2
----
a INT YES (empty) NULL NULL

statement ok
alter table t set options(change_tracking = false)

query TT
select name, invalid_reason from system.streams where database='test_stream' order by name
----
s2 Change tracking is not enabled on table 'test_stream'.'t'

statement ok
drop table t all

query TTT
select name, invalid_reason from system.streams where database='test_stream' order by name
----
s2 Unknown table 't'

query T
show columns from s2
----

statement ok
create table t(a int) change_tracking = true

statement error 2733
select * from s2

statement error 1302
drop table s2

statement ok
drop stream s2

###############
# issue 14062 #
###############

statement ok
create table t_14062 (c int)

statement ok
create stream s_14062 on table t_14062

statement ok
insert into t_14062 values(1)

query I
select c from s_14062 where change$action = 'INSERT'
----
1

query I
select c from s_14062 where change$is_update = false
----
1

query I
select c from s_14062 where change$row_id = '1'
----

statement ok
drop stream s_14062

statement ok
drop table t_14062 all

######################
# end of issue 14062 #
######################

###############
# issue 14099 #
###############

statement ok
create table t_14099 (a int, b int)

statement ok
create stream s_14099 on table t_14099

statement ok
insert into t_14099 values(1, 1), (2, 2)

query IITB
select a, b, change$action, change$is_update from s_14099 where a>1 limit 1
----
2 2 INSERT 0

statement ok
drop table t_14099 all

statement ok
drop stream s_14099

######################
# end of issue 14099 #
######################

statement ok
create table t3(a int, b int)

statement ok
insert into t3 values(1, 1), (2, 2), (3, 3)

statement ok
create stream s3 on table t3 append_only = false

statement ok
insert into t3 values(4, 4), (5, 5)

statement ok
delete from t3 where a = 2

statement ok
update t3 set a = 0 where b = 1

statement ok
update t3 set a = 6 where b = 5

statement ok
optimize table t3 compact

query IIBBII
select a, b, _origin_version is null, _origin_block_id is null, _origin_block_row_num, _row_version from t3 order by a
----
0 1 0 0 0 1
3 3 0 0 2 0
4 4 0 0 0 0
6 5 0 0 1 1

query IITB
select a, b, change$action, change$is_update from s3 order by a
----
0 1 INSERT 1
1 1 DELETE 1
2 2 DELETE 0
4 4 INSERT 0
6 5 INSERT 0

query IITB
select a, b, change$action, change$is_update from s3 as _change_delete order by a
----
0 1 INSERT 1
1 1 DELETE 1
2 2 DELETE 0
4 4 INSERT 0
6 5 INSERT 0

statement ok
create table t4(a int, b int)

statement ok
insert into t4 values(1,1),(2,2),(3,3)

query II
merge into t4 using (select a, b, change$action from s3) as t3 on t3.a=t4.a when matched and change$action = 'DELETE' then delete 
when not matched and change$action = 'INSERT' then insert (a,b) values(t3.a,t3.b)
----
3 2

query II
select * from t4 order by a
----
0 1
3 3
4 4
6 5

query II
select a, b from s3
----

###############
# issue 14431 #
###############

statement ok
create stream default.s4 on table t3

statement ok
insert into t3 values(7, 7)

query II
select a, b from default.s4
----
7 7

statement ok
drop stream default.s4

######################
# end of issue 14431 #
######################

###############
# issue 14506 #
###############

statement ok
create table t6(a int, `B` int, `c` int)

statement ok
insert into t6 values(1, 1, 1), (2, 2, 2)

statement ok
create stream s6 on table t6 append_only = false

statement ok
insert into t6 values(3, 3, 3), (4, 4, 4)

statement ok
delete from t6 where a = 1

statement ok
update t6 set a = 1 where `B` = 2

statement error 1065
select a, b, c from s6

query IIITB
select a, `B`, c, change$action, change$is_update from s6 order by a, `B`
----
1 1 1 DELETE 0
1 2 2 INSERT 1
2 2 2 DELETE 1
3 3 3 INSERT 0
4 4 4 INSERT 0

# test truncate
statement ok
truncate table t6

query IIITB
select a, `B`, c, change$action, change$is_update from s6 order by a, `B`
----
1 1 1 DELETE 0
2 2 2 DELETE 0

######################
# end of issue 14506 #
######################

###############
# issue 15058 #
###############

statement ok
alter table t6 set options(change_tracking = false)

statement ok
insert into t6 values(5, 5, 5)

statement error 2733
select * from s6

statement ok
alter table t6 set options(change_tracking = true)

statement error 2733
select * from s6

statement ok
drop stream s6

######################
# end of issue 15058 #
######################

statement ok
create table t7(a int, b int)

statement ok
insert into t7 values(1, 1), (2, 2), (3, 3)

statement ok
create stream s7 on table t7 append_only = false

statement ok
create table t8(a int, b int, c int)

statement ok
insert into t8 values(2, 2, 2), (3, 3, 3), (4, 4, 4)

# test replace into
statement ok
replace into t7 on(a, b) delete when a = 3 select * from t8

query IITB
select a, b, change$action, change$is_update from s7 order by a, change$action
----
2 2 DELETE 0
2 2 INSERT 0
3 3 DELETE 0
4 4 INSERT 0

query IIBBII
select a, b, _origin_version is null, _origin_block_id is null, _origin_block_row_num, _row_version from t7 order by a
----
1 1 0 0 0 0
2 2 0 0 0 0
4 4 0 0 1 0

statement ok
create stream s7_1 on table t7 at(stream => s7)

query IITB
select a, b, change$action, change$is_update from s7_1 order by a, b
----
2 2 INSERT 0
4 4 INSERT 0

statement ok
drop stream s7

statement ok
drop stream s7_1

statement ok
create stream s8 on table t7 append_only = false

statement ok
create stream s8_1 on table t7

# test merge into insert only
query T
merge into t7 using (select a, b from t8) as s on t7.a=s.a when not matched then insert *
----
1

query IITB
select a, b, change$action, change$is_update from s8_1 order by a, b
----
3 3 INSERT 0

# test merge into matched only
query TT
merge into t7 using (select a, b+1 as b from t8) as s on t7.a=s.a when matched and s.a=2 then update * when matched and s.a=4 then delete
----
1 1

query IITB
select a, b, change$action, change$is_update from s8 order by a, b
----
2 2 DELETE 1
2 3 INSERT 1
3 3 INSERT 0
4 4 DELETE 0

statement ok
drop stream s8

statement ok
drop stream s8_1

statement ok
create stream s9 on table t7 append_only = false

statement ok
create stream s9_1 on table t7

# test merge into full operation
query TTT
merge into t7 using t8 on t7.a=t8.a when matched and t8.a=2 then update set t7.b=t8.b when matched and t8.a=3 then delete when not matched then insert (a,b) values(t8.a,t8.b)
----
1 1 1

query IITB
select a, b, change$action, change$is_update from s9 order by a, b
----
2 2 INSERT 1
2 3 DELETE 1
3 3 DELETE 0
4 4 INSERT 0

query IITB
select a, b, change$action, change$is_update from s9_1 order by a, b
----
4 4 INSERT 0

statement ok
drop stream s9

statement ok
drop stream s9_1

statement ok
drop table t7 all

statement ok
drop table t8 all

###############
# issue 15899 #
###############

statement ok
create table t_15899(a int)

statement ok
insert into t_15899 values(1)

statement ok
create stream s_15899 on table t_15899 append_only = false

statement ok
insert into t_15899 values(2)

statement ok
alter table t_15899 add b int default 0

statement ok
insert into t_15899 values(3, 3)

query II
select a, b from t_15899 order by a
----
1 0
2 0
3 3

query IITB
select a, b, change$action, change$is_update from s_15899 order by a
----
2 0 INSERT 0
3 3 INSERT 0

statement ok
drop stream s_15899

statement ok
drop table t_15899 all

######################
# end of issue 15899 #
######################

statement error 2733
create stream s_err on table t4 at (stream => s3)

statement ok
create transient table t5(a int)

statement error 2733
create stream s5 on table t5

statement ok
drop stream s3

statement ok
drop table t3 all

statement ok
drop table t4 all

statement ok
drop table t5 all

statement ok
drop table t6 all

statement ok
create table replace_t1(a int);

statement ok
alter table replace_t1 set options(change_tracking=true);

statement ok
create table replace_t2(a int);

statement ok
alter table replace_t2 set options(change_tracking=true);

statement ok
create stream replace_s on table replace_t1;

statement ok
insert into table replace_t1 values(1);

statement error 1005
create or replace stream if not exists replace_s on table replace_t2;

statement ok
create or replace stream replace_s on table replace_t2;

statement ok
insert into table replace_t2 values(2);

query I
select a from replace_s;
----
2

statement ok
set enable_experimental_merge_into = 0;

statement ok
drop table replace_t1;

statement ok
drop table replace_t2;

statement ok
drop stream replace_s;

## test explain and target build optimization
statement ok
set enable_experimental_merge_into = 1;

statement ok
set join_spilling_memory_ratio = 0;

statement ok
drop table if exists t1;

statement ok
create table t1(a int, b int);

statement ok
drop table if exists t2;

statement ok
create table t2(a int, b int);

statement ok
drop stream if exists s1;

statement ok
create stream s1 on table t1 append_only = false;

statement ok
drop stream if exists s2;

statement ok
create stream s2 on table t1 append_only = true;

statement ok
insert into t2 values(2,2),(3,3),(4,4);

statement ok
insert into t1 values(1,1),(2,3),(3,3);

statement ok
explain merge into t1 using t2 on t1.a=t2.a when matched then update set t1.b=t2.b when not matched then insert *;

query TT
merge into t1 using t2 on t1.a=t2.a when matched then update set t1.b=t2.b when not matched then insert *;
----
1 2

statement ok
set enable_experimental_merge_into = 0;

statement ok
alter table t1 rename to t1_1

query T
select name, invalid_reason from system.streams where database='test_stream' order by name
----
s1 (empty)
s2 (empty)

query IITB
select a, b, change$action, change$is_update from s1 order by a, b
----
1 1 INSERT 0
2 2 INSERT 0
3 3 INSERT 0
4 4 INSERT 0

statement ok
alter database test_stream rename to test_stream_1

query TTTT
select database, name, mode, table_name from system.streams where database='test_stream_1' order by name
----
test_stream_1 s1 standard test_stream_1.t1_1
test_stream_1 s2 append_only test_stream_1.t1_1

query IITB
select a, b, change$action, change$is_update from test_stream_1.s2 order by a, b
----
1 1 INSERT 0
2 2 INSERT 0
3 3 INSERT 0
4 4 INSERT 0

statement ok
DROP DATABASE IF EXISTS test_stream_1
