## Copyright 2023 Databend Cloud
##
## Licensed under the Elastic License, Version 2.0 (the "License");
## you may not use this file except in compliance with the License.
## You may obtain a copy of the License at
##
##     https://www.elastic.co/licensing/elastic-license
##
## Unless required by applicable law or agreed to in writing, software
## distributed under the License is distributed on an "AS IS" BASIS,
## WITHOUT WARRANTIES OR CONDITIONS OF ANY KIND, either express or implied.
## See the License for the specific language governing permissions and
## limitations under the License.

# Materialized view DDL, maintenance, and source-binding guards.
# CREATE enables source CHANGE_TRACKING atomically when needed.

statement ok
drop database if exists test_mv_ddl

statement ok
create database test_mv_ddl

statement ok
use test_mv_ddl

statement ok
create table source (
    id int,
    amount int,
    category string,
    active boolean
)

query B
select table_option like '%CHANGE_TRACKING=''true''%'
from system.tables
where database = 'test_mv_ddl' and name = 'source'
----
0

# Explicit MV column names are exposed to users. CREATE atomically enables source change tracking.
statement ok
create materialized view mv_detail (item_id, doubled_amount) as
select id, amount * 2 from source where active

query B
select table_option like '%CHANGE_TRACKING=''true''%'
from system.tables
where database = 'test_mv_ddl' and name = 'source'
----
1

# A rejected cross-engine replacement must not enable change tracking on its source.
statement ok
create table atomic_source (id int)

statement ok
create table atomic_target (id int)

statement error 1302
create or replace materialized view atomic_target as select id from atomic_source where id > 0

query B
select table_option like '%CHANGE_TRACKING=''true''%'
from system.tables
where database = 'test_mv_ddl' and name = 'atomic_source'
----
0

# CREATE IF NOT EXISTS is a complete no-op when the target MV already exists.
statement ok
create materialized view if not exists mv_detail as select id from atomic_source where id > 0

query B
select table_option like '%CHANGE_TRACKING=''true''%'
from system.tables
where database = 'test_mv_ddl' and name = 'atomic_source'
----
0

# A successful CREATE publishes the MV and enables source tracking atomically.
statement ok
drop table atomic_target

statement ok
create materialized view atomic_target as select id from atomic_source where id > 0

query B
select table_option like '%CHANGE_TRACKING=''true''%'
from system.tables
where database = 'test_mv_ddl' and name = 'atomic_source'
----
1

statement ok
drop materialized view atomic_target

statement ok
drop table atomic_source

statement ok
drop materialized view mv_detail

statement ok
drop table source

statement ok
CREATE TABLE mv_base_t (id INT, val VARCHAR, amount INT)

statement ok
CREATE TABLE mv_base_t2 (id INT)

statement ok
INSERT INTO mv_base_t VALUES (1, 'a', 10), (2, 'b', 20), (3, 'a', 30), (4, 'b', 40)

statement ok
ALTER TABLE mv_base_t SET OPTIONS (change_tracking = true)

# EXPLAIN prints the metadata-only CREATE operation, not the stored definition query plan.
query T
EXPLAIN CREATE MATERIALIZED VIEW test_mv_explain AS SELECT id FROM mv_base_t WHERE 1 = 1
----
CreateMaterializedView

# CREATE leaves storage empty, but reads use the live definition until the first refresh.
statement ok
CREATE MATERIALIZED VIEW test_mv AS SELECT id, val, amount FROM mv_base_t WHERE id <= 2

query I
SELECT count(*) FROM test_mv
----
2

# DESC does not expose the materialized view's physical storage schema.
statement error 1302
DESC test_mv

# SHOW CREATE MATERIALIZED VIEW
query TT
SHOW CREATE MATERIALIZED VIEW test_mv
----
test_mv CREATE MATERIALIZED VIEW `test_mv_ddl`.`test_mv` (`id`, `val`, `amount`) AS SELECT id, val, amount FROM test_mv_ddl.mv_base_t WHERE id <= 2

# SHOW CREATE TABLE does not accept materialized views.
statement error 1302
SHOW CREATE TABLE test_mv

# Materialized view creation is always asynchronous; explicit creation modes are rejected.
statement error 1005
CREATE SYNC MATERIALIZED VIEW test_mv_sync AS SELECT id FROM mv_base_t WHERE 1 = 1

statement error 1005
CREATE ASYNC MATERIALIZED VIEW test_mv_async AS SELECT id FROM mv_base_t WHERE 1 = 1

# SHOW CREATE MATERIALIZED VIEW rejects base tables.
statement error 1302
SHOW CREATE MATERIALIZED VIEW mv_base_t

# SHOW MATERIALIZED VIEWS surfaces the MV object. Its system.tables metadata is verified below
# together with the clustered MV.
statement ok
SHOW MATERIALIZED VIEWS FROM default.test_mv_ddl LIKE 'test_mv'

# IF NOT EXISTS
statement ok
CREATE MATERIALIZED VIEW IF NOT EXISTS test_mv AS SELECT id FROM mv_base_t WHERE 1 = 1

# Error: already exists
statement error 2329
CREATE MATERIALIZED VIEW test_mv AS SELECT id FROM mv_base_t WHERE 1 = 1

# CREATE OR REPLACE MATERIALIZED VIEW
statement ok
CREATE OR REPLACE MATERIALIZED VIEW test_mv AS SELECT val, COUNT(*) AS cnt FROM mv_base_t WHERE 1 = 1 GROUP BY val

query I
SELECT count(*) FROM test_mv
----
2

# CREATE OR REPLACE MATERIALIZED VIEW cannot depend on the old MV object.
statement error 1302
CREATE OR REPLACE MATERIALIZED VIEW test_mv AS SELECT val, cnt FROM test_mv WHERE 1 = 1

# Replace back to a stable definition for guard/drop tests.
statement ok
CREATE OR REPLACE MATERIALIZED VIEW test_mv AS SELECT id, val, amount FROM mv_base_t WHERE id <= 2

# Protected options: user cannot set MV options via CREATE TABLE.
statement error 1301
CREATE TABLE fake_mv (x INT) materialized_view_source_table_id = '1'

# The MV engine cannot be used to bypass CREATE MATERIALIZED VIEW metadata creation.
statement error 1005
CREATE TABLE fake_mv_engine (x INT) ENGINE = MATERIALIZED_VIEW

# Protected options: user cannot set MV options via ALTER TABLE.
statement error 1301
ALTER TABLE test_mv SET OPTIONS (materialized_view_source_table_id = '1')

# Even an option valid for the MV engine cannot be changed through ALTER TABLE.
statement error 3905
ALTER TABLE test_mv SET OPTIONS (aggressive_recluster = 1)

statement error 3905
ALTER TABLE test_mv UNSET OPTIONS (block_per_segment)

statement error 1002
ALTER VIEW test_mv AS SELECT 1

statement error 3905
ALTER TABLE test_mv RENAME TO test_mv_renamed

statement error 3905
ALTER TABLE test_mv SWAP WITH mv_base_t

# All ALTER TABLE operations are blocked on materialized views.
statement error 3905
ALTER TABLE test_mv COMMENT = 'changed'

statement error 3905
ALTER TABLE test_mv CONNECTION = (CONNECTION_NAME = 'missing')

statement error 3905
ALTER TABLE test_mv ADD COLUMN new_col INT

statement error 3905
ALTER TABLE test_mv DROP COLUMN val

statement error 3905
ALTER TABLE test_mv RENAME COLUMN val TO value

statement error 3905
ALTER TABLE test_mv MODIFY COLUMN amount BIGINT

statement error 3905
ALTER TABLE test_mv ADD CONSTRAINT positive_id CHECK (id > 0)

statement error 3905
ALTER TABLE test_mv DROP CONSTRAINT positive_id

statement error 3905
ALTER TABLE test_mv RECLUSTER

statement error 3905
ALTER TABLE test_mv FLASHBACK TO (SNAPSHOT => '00000000-0000-0000-0000-000000000000')

statement error 3905
ALTER TABLE test_mv CREATE TAG mv_snapshot

statement error 3905
ALTER TABLE test_mv DROP TAG mv_snapshot

# TRUNCATE is blocked on materialized views.
statement error 3905
TRUNCATE TABLE test_mv

# User writes are blocked on materialized views.
statement error 3905
INSERT INTO test_mv VALUES (5, 'c', 50)

statement error 3905
UPDATE test_mv SET val = 'changed' WHERE id = 1

statement error 3905
DELETE FROM test_mv WHERE id = 1

statement error 3905
MERGE INTO test_mv AS target
USING (SELECT 1 AS id, 'changed' AS val, 100 AS amount) AS source
ON target.id = source.id
WHEN MATCHED THEN UPDATE SET target.val = source.val
WHEN NOT MATCHED THEN INSERT (id, val, amount) VALUES (source.id, source.val, source.amount)

statement error 3905
REPLACE INTO test_mv ON CONFLICT(id) VALUES (1, 'changed', 100)

statement error 1302
INSERT ALL
    INTO test_mv VALUES (id, val, amount)
SELECT 5 AS id, 'c' AS val, 50 AS amount

statement ok
CREATE STAGE mv_empty_stage

statement error 3905
COPY INTO test_mv FROM @mv_empty_stage FILE_FORMAT = (TYPE = CSV)

statement ok
DROP STAGE mv_empty_stage

query I
SELECT count(*) FROM test_mv
----
2

# ALTER CLUSTER KEY is blocked on materialized views.
statement error 3905
ALTER TABLE test_mv CLUSTER BY (id)

statement error 3905
ALTER TABLE test_mv DROP CLUSTER KEY

statement error 3905
OPTIMIZE TABLE test_mv COMPACT

# Dedicated MV maintenance reuses Fuse plans without opening TABLE syntax on MVs.
statement ok
ALTER MATERIALIZED VIEW test_mv CLUSTER BY (id)

query TT
SHOW CREATE MATERIALIZED VIEW test_mv
----
test_mv CREATE MATERIALIZED VIEW `test_mv_ddl`.`test_mv` (`id`, `val`, `amount`) CLUSTER BY (id) AS SELECT id, val, amount FROM test_mv_ddl.mv_base_t WHERE id <= 2

# Hidden refresh columns are not valid MV cluster keys.
statement error 1081
ALTER MATERIALIZED VIEW test_mv CLUSTER BY (_mv_source_row_id)

# RECLUSTER WHERE is intentionally not part of the first MV maintenance version.
statement error 1002
ALTER MATERIALIZED VIEW test_mv RECLUSTER WHERE id = 1

statement ok
ALTER MATERIALIZED VIEW test_mv RECLUSTER LIMIT 1

statement ok
ALTER MATERIALIZED VIEW test_mv RECLUSTER FINAL LIMIT 1

statement ok
ALTER MATERIALIZED VIEW test_mv DROP CLUSTER KEY

query TT
SHOW CREATE MATERIALIZED VIEW test_mv
----
test_mv CREATE MATERIALIZED VIEW `test_mv_ddl`.`test_mv` (`id`, `val`, `amount`) AS SELECT id, val, amount FROM test_mv_ddl.mv_base_t WHERE id <= 2

# The dedicated syntax rejects ordinary tables and unrelated ALTER actions.
statement error 1302
ALTER MATERIALIZED VIEW mv_base_t CLUSTER BY (id)

statement error 1065
ALTER MATERIALIZED VIEW test_mv ADD COLUMN extra INT

statement error 1005
ALTER MATERIALIZED VIEW test_mv COMPACT

# All MV maintenance follows the existing MV access rule: SELECT or ownership on the source table.
statement ok
CREATE ROLE mv_maintenance_role

statement ok
GRANT SELECT ON test_mv_ddl.mv_base_t TO ROLE mv_maintenance_role

statement ok
SET ROLE mv_maintenance_role

statement ok
ALTER MATERIALIZED VIEW test_mv CLUSTER BY (id)

statement ok
ALTER MATERIALIZED VIEW test_mv RECLUSTER LIMIT 1

statement ok
SET ROLE account_admin

statement ok
DROP ROLE mv_maintenance_role

# Snowflake-compatible syntax requires a column list whenever CLUSTER BY is present.
statement error 1065
CREATE MATERIALIZED VIEW test_mv_cluster_without_columns CLUSTER BY (val) AS SELECT val FROM mv_base_t WHERE 1 = 1

# Invalid cluster keys are rejected before table metadata is stored.
statement error 1081
CREATE MATERIALIZED VIEW test_mv_bad_cluster (val) CLUSTER BY (missing_col) AS SELECT val FROM mv_base_t WHERE 1 = 1

# CREATE MATERIALIZED VIEW with CLUSTER BY
statement ok
CREATE MATERIALIZED VIEW test_mv2 (val, cnt) CLUSTER BY (val) AS SELECT val, COUNT(*) AS cnt FROM mv_base_t WHERE 1 = 1 GROUP BY val

statement ok
REFRESH MATERIALIZED VIEW test_mv2

query I
SELECT count(*) FROM test_mv2
----
2

query TT
SHOW CREATE MATERIALIZED VIEW test_mv2
----
test_mv2 CREATE MATERIALIZED VIEW `test_mv_ddl`.`test_mv2` (`val`, `cnt`) CLUSTER BY (val) AS SELECT val, COUNT(*) AS cnt FROM test_mv_ddl.mv_base_t WHERE 1 = 1 GROUP BY val

# Aggregate result/state columns cannot be used as MV cluster keys.
statement error 1081
CREATE MATERIALIZED VIEW test_mv_bad_aggregate_cluster (val, cnt) CLUSTER BY (cnt) AS SELECT val, COUNT(*) AS cnt FROM mv_base_t WHERE 1 = 1 GROUP BY val

statement error 1081
ALTER MATERIALIZED VIEW test_mv2 CLUSTER BY (cnt)

statement ok
ALTER MATERIALIZED VIEW test_mv2 CLUSTER BY (val)

# Cross-database MV creation resolves source references in the session database.
statement ok
CREATE DATABASE mv_src_db

statement ok
CREATE DATABASE mv_dst_db

statement ok
CREATE TABLE mv_src_db.t (id INT)

statement ok
CREATE TABLE mv_dst_db.t (id INT)

statement ok
ALTER TABLE mv_src_db.t SET OPTIONS (change_tracking = true)

statement ok
INSERT INTO mv_src_db.t VALUES (1), (2)

statement ok
INSERT INTO mv_dst_db.t VALUES (100)

statement ok
USE mv_src_db

statement ok
CREATE MATERIALIZED VIEW mv_dst_db.cross_mv AS SELECT id FROM t WHERE 1 = 1

query I
SELECT count(*) FROM mv_dst_db.cross_mv
----
2

query TT
SHOW CREATE MATERIALIZED VIEW mv_dst_db.cross_mv
----
cross_mv CREATE MATERIALIZED VIEW `mv_dst_db`.`cross_mv` (`id`) AS SELECT id FROM mv_src_db.t WHERE 1 = 1

statement ok
USE test_mv_ddl

# CTE definitions remain outside the query shapes supported by feat-mv-insert.
statement error 1065
CREATE MATERIALIZED VIEW test_mv_cte AS WITH c AS (SELECT val, SUM(amount) AS total FROM mv_base_t GROUP BY val) SELECT * FROM c WHERE 1 = 1

# CTE in materialized view: nested CTE inside subquery
statement error 1065
CREATE MATERIALIZED VIEW test_mv_nested_cte AS SELECT * FROM (WITH c AS (SELECT val, SUM(amount) AS total FROM mv_base_t GROUP BY val) SELECT * FROM c) s WHERE 1 = 1

# MV metadata records one real, persistent, ordinary FUSE source identity.
statement error 1065
CREATE MATERIALIZED VIEW test_mv_no_source AS SELECT 1 WHERE 1 = 1

statement error 1065
CREATE MATERIALIZED VIEW test_mv_join AS SELECT a.id FROM mv_base_t a JOIN mv_base_t2 b ON a.id = b.id WHERE 1 = 1

statement ok
CREATE VIEW mv_source_view AS SELECT id FROM mv_base_t

statement error 1065
CREATE MATERIALIZED VIEW test_mv_from_view AS SELECT id FROM mv_source_view WHERE 1 = 1

statement error 1302
CREATE MATERIALIZED VIEW test_mv_from_mv AS SELECT id FROM test_mv WHERE 1 = 1

statement ok
CREATE TABLE mv_null_source (id INT) ENGINE = NULL

statement error 1065
CREATE MATERIALIZED VIEW test_mv_from_null AS SELECT * FROM mv_null_source WHERE 1 = 1

statement ok
CREATE TEMPORARY TABLE mv_temp_source (id INT)

statement error 1065
CREATE MATERIALIZED VIEW test_mv_from_temp AS SELECT * FROM mv_temp_source WHERE 1 = 1

statement ok
DROP TABLE mv_temp_source

# SHOW MATERIALIZED VIEWS column/format verification via system.tables
query TTTT
SELECT name, database, engine, table_type FROM system.tables WHERE database = 'test_mv_ddl' AND table_type = 'MATERIALIZED VIEW' ORDER BY name
----
test_mv test_mv_ddl MATERIALIZED_VIEW MATERIALIZED VIEW
test_mv2 test_mv_ddl MATERIALIZED_VIEW MATERIALIZED VIEW

# DROP TABLE cannot drop materialized views.
statement error 1302
DROP TABLE test_mv

# DROP MATERIALIZED VIEW
statement ok
DROP MATERIALIZED VIEW test_mv

statement error 1025
SELECT * FROM test_mv

# DROP removes the MV definition, so the backing table cannot be restored.
statement error 2309
UNDROP TABLE test_mv

# DROP MATERIALIZED VIEW on non-MV table should error.
statement error 1302
DROP MATERIALIZED VIEW mv_base_t

# A persisted definition resolving to a same-named replacement table must not read old MV storage
# or execute against the replacement source.
statement ok
create table replaced_source (id int) change_tracking = true

statement ok
create materialized view replaced_mv as select id from replaced_source where id > 0

statement ok
insert into replaced_source values (1)

statement ok
refresh materialized view replaced_mv

statement ok
alter table replaced_source rename to renamed_replaced_source

# Renaming the source invalidates the persisted query binding.
statement error 1025
select * from replaced_mv

statement error (?s)2328.*source table changed
refresh materialized view replaced_mv

statement ok
create table replaced_source (id int) change_tracking = true

statement error (?s)2328.*source table changed
select * from replaced_mv

statement error (?s)2328.*source table changed
refresh materialized view replaced_mv

statement ok
drop materialized view replaced_mv

statement ok
drop table replaced_source

statement ok
drop table renamed_replaced_source

# Source schema changes invalidate the MV binding without blocking DDL.
statement ok
CREATE TABLE mv_guard_source (a INT, b INT)

statement ok
ALTER TABLE mv_guard_source SET OPTIONS (change_tracking = true)

statement ok
CREATE MATERIALIZED VIEW mv_guard AS SELECT a, b FROM mv_guard_source WHERE 1 = 1

# ADD COLUMN does not invalidate the bound columns and remains allowed.
statement ok
ALTER TABLE mv_guard_source ADD COLUMN c INT

# ADD COLUMN preserves the source generation, so refresh remains valid.
statement ok
REFRESH MATERIALIZED VIEW mv_guard

statement ok
ALTER TABLE mv_guard_source RENAME COLUMN a TO renamed_a

statement error 2328
REFRESH MATERIALIZED VIEW mv_guard

# Reads reject the same stale source binding instead of using MV storage.
statement error 2328
SELECT * FROM mv_guard

# Management paths retain the raw definition after the source binding becomes invalid.
query TT
SHOW CREATE MATERIALIZED VIEW mv_guard
----
mv_guard CREATE MATERIALIZED VIEW `test_mv_ddl`.`mv_guard` (`a`, `b`) AS SELECT a, b FROM test_mv_ddl.mv_guard_source WHERE 1 = 1

# CREATE observes the nonzero generation produced by RENAME and can publish a new binding.
statement ok
CREATE MATERIALIZED VIEW mv_guard_recreated AS SELECT renamed_a, b, c FROM mv_guard_source WHERE 1 = 1

statement ok
ALTER TABLE mv_guard_source MODIFY COLUMN renamed_a BIGINT

statement error 2328
REFRESH MATERIALIZED VIEW mv_guard_recreated

statement error 2328
SELECT * FROM mv_guard_recreated

statement ok
ALTER TABLE mv_guard_source DROP COLUMN b

statement ok
DROP MATERIALIZED VIEW mv_guard

statement ok
DROP MATERIALIZED VIEW mv_guard_recreated

statement ok
DROP TABLE mv_guard_source

# Cleanup
statement ok
DROP MATERIALIZED VIEW IF EXISTS test_mv2

statement ok
DROP MATERIALIZED VIEW IF EXISTS mv_dst_db.cross_mv

statement ok
DROP DATABASE IF EXISTS mv_src_db

statement ok
DROP DATABASE IF EXISTS mv_dst_db

statement ok
DROP TABLE IF EXISTS mv_base_t

statement ok
DROP TABLE IF EXISTS mv_base_t2

statement ok
DROP TABLE IF EXISTS mv_null_source

statement ok
DROP VIEW IF EXISTS mv_source_view

statement ok
use default

statement ok
drop database test_mv_ddl
