## Copyright 2023 Databend Cloud
##
## Licensed under the Elastic License, Version 2.0 (the "License");
## you may not use this file except in compliance with the License.
## You may obtain a copy of the License at
##
##     https://www.elastic.co/licensing/elastic-license
##
## Unless required by applicable law or agreed to in writing, software
## distributed under the License is distributed on an "AS IS" BASIS,
## WITHOUT WARRANTIES OR CONDITIONS OF ANY KIND, either express or implied.
## See the License for the specific language governing permissions and
## limitations under the License.

statement ok
set global enable_experimental_row_access_policy = 1;

statement ok
set enable_planner_cache = 0;

statement ok
drop table if exists rap_dml_test;

statement ok
drop table if exists rap_dml_aux;

statement ok
drop table if exists rap_dml_src;

statement ok
drop row access policy if exists rap_dml_policy;

statement ok
create row access policy rap_dml_policy as (dept string) returns boolean -> dept = 'sales';

statement ok
create table rap_dml_test(id int, dept string, val int);

statement ok
insert into rap_dml_test values (1, 'sales', 100), (2, 'eng', 200), (3, 'sales', 300);

statement ok
alter table rap_dml_test add row access policy rap_dml_policy on (dept);

## SELECT should only see policy-visible rows
query IIT
select id, val, dept from rap_dml_test order by id;
----
1 100 sales
3 300 sales

## Direct UPDATE without WHERE should only affect policy-visible rows
statement ok
update rap_dml_test set val = 444;

statement ok
alter table rap_dml_test drop row access policy rap_dml_policy;

query IIT
select id, val, dept from rap_dml_test order by id;
----
1 444 sales
2 200 eng
3 444 sales

statement ok
alter table rap_dml_test add row access policy rap_dml_policy on (dept);

## Direct UPDATE should not affect invisible rows
statement ok
update rap_dml_test set val = 999 where dept = 'eng';

statement ok
alter table rap_dml_test drop row access policy rap_dml_policy;

query IIT
select id, val, dept from rap_dml_test order by id;
----
1 444 sales
2 200 eng
3 444 sales

statement ok
alter table rap_dml_test add row access policy rap_dml_policy on (dept);

## Direct DELETE should not affect invisible rows
statement ok
delete from rap_dml_test where dept = 'eng';

statement ok
alter table rap_dml_test drop row access policy rap_dml_policy;

query IIT
select id, val, dept from rap_dml_test order by id;
----
1 444 sales
2 200 eng
3 444 sales

statement ok
alter table rap_dml_test add row access policy rap_dml_policy on (dept);

## Direct UPDATE should still affect visible rows
statement ok
update rap_dml_test set val = 111 where id = 1;

query IIT
select id, val, dept from rap_dml_test order by id;
----
1 111 sales
3 444 sales

statement ok
alter table rap_dml_test drop row access policy rap_dml_policy;

query IIT
select id, val, dept from rap_dml_test order by id;
----
1 111 sales
2 200 eng
3 444 sales

statement ok
alter table rap_dml_test add row access policy rap_dml_policy on (dept);

## Direct DELETE should still affect visible rows
statement ok
delete from rap_dml_test where id = 3;

query IIT
select id, val, dept from rap_dml_test order by id;
----
1 111 sales

statement ok
alter table rap_dml_test drop row access policy rap_dml_policy;

query IIT
select id, val, dept from rap_dml_test order by id;
----
1 111 sales
2 200 eng

statement ok
insert into rap_dml_test values (3, 'sales', 300);

statement ok
alter table rap_dml_test add row access policy rap_dml_policy on (dept);

## DELETE without WHERE must not truncate invisible rows
statement ok
delete from rap_dml_test;

query IIT
select id, val, dept from rap_dml_test order by id;
----

statement ok
alter table rap_dml_test drop row access policy rap_dml_policy;

query IIT
select id, val, dept from rap_dml_test order by id;
----
2 200 eng

statement ok
truncate table rap_dml_test;

statement ok
insert into rap_dml_test values (1, 'sales', 100), (2, 'eng', 200), (3, 'sales', 300);

statement ok
create table rap_dml_aux(id int, dept string);

statement ok
insert into rap_dml_aux values (2, 'eng'), (3, 'sales');

statement ok
alter table rap_dml_test add row access policy rap_dml_policy on (dept);

## Non-Direct UPDATE with subquery should not affect invisible rows
statement ok
update rap_dml_test
set val = 555
where id in (select id from rap_dml_aux where dept = 'eng');

statement ok
alter table rap_dml_test drop row access policy rap_dml_policy;

query IIT
select id, val, dept from rap_dml_test order by id;
----
1 100 sales
2 200 eng
3 300 sales

statement ok
alter table rap_dml_test add row access policy rap_dml_policy on (dept);

## Non-Direct DELETE with subquery should not affect invisible rows
statement ok
delete from rap_dml_test
where id in (select id from rap_dml_aux where dept = 'eng');

statement ok
alter table rap_dml_test drop row access policy rap_dml_policy;

query IIT
select id, val, dept from rap_dml_test order by id;
----
1 100 sales
2 200 eng
3 300 sales

statement ok
create table rap_dml_src(id int, new_val int);

statement ok
insert into rap_dml_src values (2, 777), (3, 888);

statement ok
alter table rap_dml_test add row access policy rap_dml_policy on (dept);

## MERGE should not affect invisible target rows
statement ok
merge into rap_dml_test as t
using rap_dml_src as s
on t.id = s.id
when matched then update set t.val = s.new_val;

statement ok
alter table rap_dml_test drop row access policy rap_dml_policy;

query IIT
select id, val, dept from rap_dml_test order by id;
----
1 100 sales
2 200 eng
3 888 sales

statement ok
drop table rap_dml_src;

statement ok
drop table rap_dml_aux;

statement ok
drop table rap_dml_test;

statement ok
drop row access policy rap_dml_policy;

statement ok
drop table if exists t_dialect_policy;

statement ok
drop row access policy if exists rap_dialect_test;

statement ok
drop masking policy if exists mask_dialect_test;

## Create policies under default (PostgreSQL) dialect
statement ok
CREATE ROW ACCESS POLICY rap_dialect_test AS (dept STRING) RETURNS boolean ->
  CASE WHEN dept = 'Engineering' THEN true ELSE false END;

statement ok
CREATE MASKING POLICY mask_dialect_test AS (val STRING) RETURNS STRING ->
  CASE WHEN current_role() = 'admin' THEN val ELSE '***' END;

statement ok
create table t_dialect_policy(id int, name string, department string);

statement ok
insert into t_dialect_policy values (1, 'alice', 'Engineering'), (2, 'bob', 'Sales'), (3, 'charlie', 'Engineering');

statement ok
alter table t_dialect_policy add row access policy rap_dialect_test on (department);

statement ok
alter table t_dialect_policy modify column name set masking policy mask_dialect_test;

## ---- PostgreSQL dialect (default) ----

statement ok
set sql_dialect = 'PostgreSQL';

query ITT
select * from t_dialect_policy order by id;
----
1 *** Engineering
3 *** Engineering

## ---- MySQL dialect ----

statement ok
set sql_dialect = 'MySQL';

query ITT
select * from t_dialect_policy order by id;
----
1 *** Engineering
3 *** Engineering

## ---- Hive dialect ----

statement ok
set sql_dialect = 'Hive';

query ITT
select * from t_dialect_policy order by id;
----
1 *** Engineering
3 *** Engineering

## ---- Experimental dialect ----

statement ok
set sql_dialect = 'Experimental';

query ITT
select * from t_dialect_policy order by id;
----
1 *** Engineering
3 *** Engineering

## Cleanup

statement ok
set sql_dialect = 'PostgreSQL';

statement ok
alter table t_dialect_policy drop all row access policies;

statement ok
alter table t_dialect_policy modify column name unset masking policy;

statement ok
drop table if exists t_dialect_policy;

statement ok
drop row access policy if exists rap_dialect_test;

statement ok
drop masking policy if exists mask_dialect_test;
