statement ok
DROP VIEW IF EXISTS bad_test_view

statement ok
DROP VIEW IF EXISTS main.main_view

statement ok
DROP VIEW IF EXISTS out_of_path.oop_view

statement ok
DROP VIEW IF EXISTS test_view

statement ok
DROP TABLE IF EXISTS main.main_table

statement ok
DROP TABLE IF EXISTS main.main_table2

statement ok
DROP TABLE IF EXISTS out_of_path.oop_table

statement ok
DROP TABLE IF EXISTS test_table

statement ok
DROP TABLE IF EXISTS test_table2

statement ok
DROP TABLE IF EXISTS test_table3

statement ok
DROP TABLE IF EXISTS test_table4

# This test focuses on actual name lookup.
# See also test_set_search_path.test
# TODO: unsupported feature
# statement ok
# CREATE SCHEMA test;

# TODO: unsupported feature
# statement ok
# CREATE SCHEMA out_of_path;

# TODO: unsupported feature
# statement ok
# CREATE TABLE main.main_table(j INTEGER);

statement ok
CREATE TABLE test_table(i INTEGER);

statement ok
CREATE TABLE out_of_path.oop_table(k INTEGER);

# TODO: unsupported feature
# statement ok
# SELECT * FROM test.test_table;

statement ok
SELECT * FROM test_table;

# TODO: unsupported feature
# statement ok
# SELECT * FROM main_table;

statement ok
SELECT * FROM out_of_path.oop_table;

statement error
SELECT * FROM out_of_path.test_table;

statement error
SELECT * FROM main.test_table;

statement error
INSERT INTO main.test_table (i) VALUES (1);

statement ok
INSERT INTO test_table (i) VALUES (1);

# TODO: unsupported feature
# statement ok
# INSERT INTO test.test_table (i) VALUES (2), (3);

# TODO: unsupported feature
# statement ok
# INSERT INTO main_table (j) VALUES (4);

# TODO: unsupported feature
# statement ok
# INSERT INTO main.main_table (j) VALUES (5), (6);

statement error
INSERT INTO oop_table (k) VALUES (7);

statement ok
INSERT INTO out_of_path.oop_table (k) VALUES (8), (9);

statement error
DELETE FROM main.test_table WHERE i=3;

statement error
DELETE FROM test.main_table WHERE i=5;

statement error
DELETE FROM oop_table WHERE k=8;

# TODO: unsupported feature
# statement ok
# DELETE FROM test.test_table WHERE i=1;

statement ok
DELETE FROM test_table WHERE i=2;

# TODO: unsupported feature
# statement ok
# DELETE FROM main.main_table WHERE j=4;

# TODO: unsupported feature
# statement ok
# DELETE FROM main_table WHERE j=5;

statement ok
DELETE FROM out_of_path.oop_table WHERE k=8;

query I
SELECT i FROM test_table;
----
1

# TODO: unsupported feature
# query I
# SELECT j FROM main.main_table;
# ----
# 6

query I
SELECT k FROM out_of_path.oop_table;
----
9

statement error
UPDATE main.test_table SET i=10 WHERE i=1;

statement ok
UPDATE test_table SET i=30 WHERE i=3;

# TODO: unsupported feature
# statement ok
# UPDATE test.test_table SET i=300 WHERE i=30;

# TODO: unsupported feature
# statement ok
# UPDATE main_table SET j=60 WHERE j=6;

# TODO: unsupported feature
# statement ok
# UPDATE main.main_table SET j=600 WHERE j=60;

query I
SELECT i FROM test_table;
----
1

# TODO: unsupported feature
# query I
# SELECT j FROM main_table;
# ----
# 600

# Testing temp table.
# test_temp_table should *not* be created in the test schema, but in the temp schema

statement ok
CREATE TEMP TABLE test_temp_table(i INTEGER);

statement error
SELECT * FROM memory.main.test_temp_table;

statement error
SELECT * FROM test.test_temp_table;

statement ok
SELECT * FROM test_temp_table;

# TODO: unsupported feature
# statement ok
# SELECT * FROM temp.test_temp_table;

# Testing functions and aggregates

query I
SELECT abs(i) FROM test_table;
----
1

# aggregates should work as expected

query I
SELECT sum(i) FROM test_table;
----
1

# Testing Views

statement ok
CREATE VIEW test_view AS SELECT * FROM test_table;

# TODO: unsupported feature
# statement ok
# CREATE VIEW main.main_view AS SELECT * FROM main.main_table;

statement ok
CREATE VIEW out_of_path.oop_view AS SELECT * FROM out_of_path.oop_table;

statement error
SELECT * FROM main.test_view;

# TODO: unsupported feature
# statement ok
# SELECT * FROM test.test_view;

statement ok
SELECT * FROM test_view;

# TODO: unsupported feature
# statement ok
# SELECT * FROM main.main_view;

# TODO: unsupported feature
# statement ok
# SELECT * FROM main_view;

# TODO: unsupported feature
# statement error
# SELECT * FROM oop_view;

# TODO: unsupported feature
# statement ok
# SELECT * FROM out_of_path.oop_view;

# TODO: result differs
# statement error
# CREATE VIEW bad_test_view AS SELECT * FROM test_table;

# TODO: unsupported feature
# statement ok
# SELECT * FROM test.test_view;

# TODO: unsupported feature
# statement error
# DROP VIEW main.test_view

# TODO: unsupported feature
# statement ok
# DROP VIEW test_view

# TODO: unsupported feature
# statement ok
# DROP VIEW main_view

statement error
DROP VIEW oop_view

# TODO: unsupported feature
# statement ok
# DROP VIEW out_of_path.oop_view

# Testing Macros

# TODO: unsupported feature
# statement ok
# CREATE MACRO test_macro(a, b) AS a + b;

# TODO: unsupported feature
# statement ok
# CREATE MACRO test_macro2(c, d) AS c * d;

# TODO: unsupported feature
# statement ok
# CREATE MACRO main.main_macro(a, b) AS a - b;

# TODO: unsupported feature
# statement ok
# CREATE MACRO out_of_path.oop_macro(a, b) AS a * b;

# TODO: unsupported feature
# statement error
# SELECT main.test_macro(1, 2);

# TODO: unsupported feature
# statement error
# SELECT oop_macro(1, 2);

# TODO: unknown function
# statement ok
# SELECT main_macro(1, 2);

# TODO: unsupported feature
# statement ok
# SELECT main.main_macro(1, 2);

# TODO: unsupported feature
# statement ok
# SELECT test.test_macro(1, 2);

# TODO: unknown function
# statement ok
# SELECT test_macro(1, 2);

# TODO: unsupported feature
# statement ok
# SELECT out_of_path.oop_macro(1, 2);

# TODO: unsupported feature
# statement error
# DROP MACRO main.test_macro;

# TODO: unsupported feature
# statement ok
# DROP MACRO test_macro;

# TODO: unsupported feature
# statement ok
# DROP MACRO test.test_macro2;

# TODO: unsupported feature
# statement ok
# DROP MACRO main_macro;

# TODO: unsupported feature
# statement error
# DROP MACRO oop_macro;

# TODO: unsupported feature
# statement ok
# DROP MACRO out_of_path.oop_macro;

# Testing sequences.

# TODO: unsupported feature
# statement ok
# CREATE SEQUENCE test_sequence;

# TODO: unsupported feature
# statement ok
# CREATE SEQUENCE test_sequence2;

# TODO: unsupported feature
# statement ok
# CREATE SEQUENCE main.main_sequence;

# TODO: unsupported feature
# statement ok
# CREATE SEQUENCE out_of_path.oop_sequence;

statement error
SELECT main.nextval('main.test_sequence');

# TODO: unsupported feature
# statement ok
# SELECT main.nextval('test.test_sequence');

# TODO: unsupported feature
# statement ok
# SELECT main.nextval('test_sequence');

# TODO: unsupported feature
# statement ok
# SELECT main.nextval('main.main_sequence');

# TODO: unsupported feature
# statement ok
# SELECT main.nextval('main_sequence');

statement error
SELECT main.nextval('oop_sequence');

# TODO: unsupported feature
# statement ok
# SELECT main.nextval('out_of_path.oop_sequence');

statement error
DROP SEQUENCE main.test_sequence;

# TODO: unsupported feature
# statement ok
# DROP SEQUENCE test_sequence;

# TODO: unsupported feature
# statement ok
# DROP SEQUENCE test.test_sequence2;

# TODO: unsupported feature
# statement ok
# DROP SEQUENCE main_sequence;

statement error
DROP SEQUENCE oop_sequence;

# TODO: unsupported feature
# statement ok
# DROP SEQUENCE out_of_path.oop_sequence;

# Testing ALTER TABLE

statement error
ALTER TABLE main.test_table ADD COLUMN k INTEGER;

# TODO: unsupported feature
# statement ok
# ALTER TABLE main.main_table ADD COLUMN k INTEGER;

# TODO: unsupported feature
# statement ok
# ALTER TABLE main_table ADD COLUMN l INTEGER;

statement ok
ALTER TABLE test_table ADD COLUMN m INTEGER;

# TODO: unsupported feature
# statement ok
# ALTER TABLE test.test_table ADD COLUMN n INTEGER;

statement error
ALTER TABLE oop_table ADD COLUMN o INTEGER;

# TODO: unsupported feature
# statement ok
# ALTER TABLE out_of_path.oop_table ADD COLUMN p INTEGER;

# Testing DROP TABLE

statement error
DROP TABLE main.test_table;

statement error
DROP TABLE test.main_table;

statement ok
DROP TABLE test_table;

# TODO: unsupported feature
# statement ok
# DROP TABLE main_table;

statement error
DROP TABLE oop_table;

statement ok
DROP TABLE out_of_path.oop_table;

# TODO: unsupported feature
# statement ok
# CREATE TABLE test_table2(i INTEGER);

# TODO: unsupported feature
# statement ok
# DROP TABLE test.test_table2;

statement ok
CREATE TABLE test_table3(i INTEGER);

statement ok
DROP TABLE IF EXISTS test_table3;

statement ok
DROP TABLE IF EXISTS test_table3;

statement ok
CREATE TABLE test_table4(i INTEGER);

statement ok
DROP TABLE IF EXISTS test.test_table4;

statement ok
DROP TABLE IF EXISTS test.test_table4;

# TODO: unsupported feature
# statement ok
# CREATE TABLE main.main_table2(i INTEGER);

statement ok
DROP TABLE IF EXISTS main.main_table2;

statement ok
DROP TABLE IF EXISTS main.main_table2;
