statement ok
DROP VIEW IF EXISTS bad_test_view

statement ok
DROP VIEW IF EXISTS main.main_view

statement ok
DROP VIEW IF EXISTS out_of_path.oop_view

statement ok
DROP VIEW IF EXISTS test_view

statement ok
DROP TABLE IF EXISTS main.main_table

statement ok
DROP TABLE IF EXISTS main.main_table2

statement ok
DROP TABLE IF EXISTS out_of_path.oop_table

statement ok
DROP TABLE IF EXISTS test_table

statement ok
DROP TABLE IF EXISTS test_table2

statement ok
DROP TABLE IF EXISTS test_table3

statement ok
DROP TABLE IF EXISTS test_table4

# This test focuses on actual name lookup.
# See also test_set_search_path.test
statement ok
CREATE TABLE test_table(i INTEGER);

statement ok
CREATE TABLE out_of_path.oop_table(k INTEGER);

statement ok
SELECT * FROM test_table;

statement ok
SELECT * FROM out_of_path.oop_table;

statement error
SELECT * FROM out_of_path.test_table;

statement error
SELECT * FROM main.test_table;

statement error
INSERT INTO main.test_table (i) VALUES (1);

statement ok
INSERT INTO test_table (i) VALUES (1);

statement error
INSERT INTO oop_table (k) VALUES (7);

statement ok
INSERT INTO out_of_path.oop_table (k) VALUES (8), (9);

statement error
DELETE FROM main.test_table WHERE i=3;

statement error
DELETE FROM test.main_table WHERE i=5;

statement error
DELETE FROM oop_table WHERE k=8;

statement ok
DELETE FROM test_table WHERE i=2;

statement ok
DELETE FROM out_of_path.oop_table WHERE k=8;

query I
SELECT i FROM test_table;
----
1

query I
SELECT k FROM out_of_path.oop_table;
----
9

statement error
UPDATE main.test_table SET i=10 WHERE i=1;

statement ok
UPDATE test_table SET i=30 WHERE i=3;

query I
SELECT i FROM test_table;
----
1

# Testing temp table.
# test_temp_table should *not* be created in the test schema, but in the temp schema

statement ok
CREATE TEMP TABLE test_temp_table(i INTEGER);

statement error
SELECT * FROM memory.main.test_temp_table;

statement error
SELECT * FROM test.test_temp_table;

statement ok
SELECT * FROM test_temp_table;

# Testing functions and aggregates

query I
SELECT abs(i) FROM test_table;
----
1

# aggregates should work as expected

query I
SELECT sum(i) FROM test_table;
----
1

# Testing Views

statement ok
CREATE VIEW test_view AS SELECT * FROM test_table;

statement ok
CREATE VIEW out_of_path.oop_view AS SELECT * FROM out_of_path.oop_table;

statement error
SELECT * FROM main.test_view;

statement ok
SELECT * FROM test_view;

statement error
DROP VIEW oop_view

# Testing Macros

# Testing sequences.

statement error
SELECT main.nextval('main.test_sequence');

statement error
SELECT main.nextval('oop_sequence');

statement error
DROP SEQUENCE main.test_sequence;

statement error
DROP SEQUENCE oop_sequence;

# Testing ALTER TABLE

statement error
ALTER TABLE main.test_table ADD COLUMN k INTEGER;

statement ok
ALTER TABLE test_table ADD COLUMN m INTEGER;

statement error
ALTER TABLE oop_table ADD COLUMN o INTEGER;

# Testing DROP TABLE

statement error
DROP TABLE main.test_table;

statement error
DROP TABLE test.main_table;

statement ok
DROP TABLE test_table;

statement error
DROP TABLE oop_table;

statement ok
DROP TABLE out_of_path.oop_table;

statement ok
CREATE TABLE test_table3(i INTEGER);

statement ok
DROP TABLE IF EXISTS test_table3;

statement ok
DROP TABLE IF EXISTS test_table3;

statement ok
CREATE TABLE test_table4(i INTEGER);

statement ok
DROP TABLE IF EXISTS test.test_table4;

statement ok
DROP TABLE IF EXISTS test.test_table4;

statement ok
DROP TABLE IF EXISTS main.main_table2;

statement ok
DROP TABLE IF EXISTS main.main_table2;
