statement ok
DROP TABLE IF EXISTS integers

statement ok
CREATE TABLE integers(i INTEGER, j INTEGER)

statement ok
INSERT INTO integers VALUES (NULL, 3)

query II
SELECT * FROM integers
----
NULL	3

# begin a transaction in con2

statement ok
BEGIN TRANSACTION

# update the row in con1

statement ok
UPDATE integers SET i=1,j=1

# con1 should see the value "1"

query II
SELECT * FROM integers
----
1	1

# con2 should see the value "NULL"

query II
SELECT * FROM integers
----
1 1

# after a rollback con2 should see the value "1" as well

statement ok
ROLLBACK

query II
SELECT * FROM integers
----
NULL 3
