statement ok
DROP TABLE IF EXISTS integers

statement ok
CREATE TABLE integers(i INTEGER);

statement ok
INSERT INTO integers VALUES (1), (2), (3);

# we can query the database using both connections

query I
SELECT SUM(i) FROM integers
----
6

query I
SELECT SUM(i) FROM integers
----
6

# now update the database in connection 1

statement ok
BEGIN TRANSACTION;

statement ok
UPDATE integers SET i=5 WHERE i=1;

query I
SELECT SUM(i) FROM integers
----
10

# con 2 still has the same result

query I
SELECT SUM(i) FROM integers
----
10

# we can update the same data point again in con 1

statement ok
UPDATE integers SET i=10 WHERE i=5;

query I
SELECT SUM(i) FROM integers
----
15

# con 2 still has the same result

query I
SELECT SUM(i) FROM integers
----
15

# now delete it

statement ok
DELETE FROM integers WHERE i>5;

query I
SELECT SUM(i) FROM integers
----
5

# con 2 still has the same result

query I
SELECT SUM(i) FROM integers
----
5

# insert some new data again

statement ok
INSERT INTO integers VALUES (1), (2)

query I
SELECT SUM(i) FROM integers
----
8

# con 2 still has the same result

query I
SELECT SUM(i) FROM integers
----
8

# now commit

statement ok
COMMIT

# con 2 now has the updated results

query I
SELECT SUM(i) FROM integers
----
8
