statement ok
DROP TABLE IF EXISTS integers

statement ok
CREATE TABLE integers(i INTEGER)

statement ok
BEGIN TRANSACTION

statement ok
INSERT INTO integers VALUES (1)

statement ok
BEGIN TRANSACTION

statement ok
INSERT INTO integers VALUES (2)

# transaction local only

query I
SELECT SUM(i) FROM integers
----
3

query I
SELECT SUM(i) FROM integers
----
3

query I
SELECT SUM(i) FROM integers
----
3

# commit con1 only

statement ok
COMMIT

query I
SELECT SUM(i) FROM integers
----
3

query I
SELECT SUM(i) FROM integers
----
3

query I
SELECT SUM(i) FROM integers
----
3

# commit con2 as well

statement ok
COMMIT

query I
SELECT SUM(i) FROM integers
----
3

query I
SELECT SUM(i) FROM integers
----
3

query I
SELECT SUM(i) FROM integers
----
3

# now delete a tuple in both con1 and con2

statement ok
BEGIN TRANSACTION

statement ok
BEGIN TRANSACTION

statement ok
DELETE FROM integers WHERE i=1

statement ok
DELETE FROM integers WHERE i=2

query I
SELECT SUM(i) FROM integers
----
NULL

query I
SELECT SUM(i) FROM integers
----
NULL

query I
SELECT SUM(i) FROM integers
----
NULL

# commit con1

statement ok
COMMIT

query I
SELECT SUM(i) FROM integers
----
NULL

query I
SELECT SUM(i) FROM integers
----
NULL

query I
SELECT SUM(i) FROM integers
----
NULL

# commit con2

statement ok
COMMIT

query I
SELECT SUM(i) FROM integers
----
NULL

query I
SELECT SUM(i) FROM integers
----
NULL

query I
SELECT SUM(i) FROM integers
----
NULL
