statement ok
DROP TABLE IF EXISTS integers

statement ok
CREATE TABLE integers(i INTEGER);

statement ok
INSERT INTO integers VALUES (1), (2), (3), (4);

# 4 -> 8

statement ok
INSERT INTO integers SELECT * FROM integers

# 8 -> 16

statement ok
INSERT INTO integers SELECT * FROM integers

# 16 -> 32

statement ok
INSERT INTO integers SELECT * FROM integers

# 32 -> 64

statement ok
INSERT INTO integers SELECT * FROM integers

query I
SELECT COUNT(*) FROM integers WHERE i=1
----
16

# 64 -> 128

statement ok
INSERT INTO integers SELECT * FROM integers

# 128 -> 256

statement ok
INSERT INTO integers SELECT * FROM integers

# 256 -> 512

statement ok
INSERT INTO integers SELECT * FROM integers

# 512 -> 1024

statement ok
INSERT INTO integers SELECT * FROM integers

# 1024 -> 2048

statement ok
INSERT INTO integers SELECT * FROM integers

# 2048 -> 4096

statement ok
INSERT INTO integers SELECT * FROM integers

# 4096 -> 8192

statement ok
INSERT INTO integers SELECT * FROM integers

# 8192 -> 16384

statement ok
INSERT INTO integers SELECT * FROM integers

# 16384 -> 32768

statement ok
INSERT INTO integers SELECT * FROM integers

# 32768 -> 65536

statement ok
INSERT INTO integers SELECT * FROM integers

# 65536 -> 131072

statement ok
INSERT INTO integers SELECT * FROM integers

# verify the count and sum

query I
SELECT COUNT(*) FROM integers
----
131072

query I
SELECT COUNT(*) FROM integers WHERE i=2
----
32768

query I
SELECT COUNT(*) FROM integers WHERE i=3
----
32768

query I
SELECT COUNT(*) FROM integers WHERE i=4
----
32768

# now delete some tuples

statement ok
BEGIN TRANSACTION;

query I
DELETE FROM integers WHERE i=1
----
32768

# check the updated count and sum

query I
SELECT COUNT(*) FROM integers
----
98304

# con2 still has the same count and sum

# rollback

statement ok
ROLLBACK;

# now the count and sum are back to normal

query I
SELECT COUNT(*) FROM integers
----
131072

# now delete some tuples

statement ok
BEGIN TRANSACTION;

statement ok
DELETE FROM integers WHERE i=2

# check the updated count and sum

query I
SELECT COUNT(*) FROM integers
----
98304

# con2 still has the same count and sum

# rollback

statement ok
ROLLBACK;

# now the count and sum are back to normal

query I
SELECT COUNT(*) FROM integers
----
131072

# now delete some tuples

statement ok
BEGIN TRANSACTION;

statement ok
DELETE FROM integers WHERE i=3

# check the updated count and sum

query I
SELECT COUNT(*) FROM integers
----
98304

# con2 still has the same count and sum

# rollback

statement ok
ROLLBACK;

# now the count and sum are back to normal

query I
SELECT COUNT(*) FROM integers
----
131072

# now delete some tuples

statement ok
BEGIN TRANSACTION;

statement ok
DELETE FROM integers WHERE i=4

# check the updated count and sum

query I
SELECT COUNT(*) FROM integers
----
98304

# con2 still has the same count and sum

# rollback

statement ok
ROLLBACK;

# now the count and sum are back to normal

query I
SELECT COUNT(*) FROM integers
----
131072

