statement ok
DROP TABLE IF EXISTS integers

statement ok
CREATE TABLE integers(i INTEGER);

# insert 1000 integers

statement ok
INSERT INTO integers FROM range(0, 1000);

statement ok
BEGIN TRANSACTION

statement ok
BEGIN TRANSACTION

# con1 inserts more rows

statement ok
INSERT INTO integers FROM range(1000,3000);

# con2 deletes all existing rows

query I
DELETE FROM integers
----
3000

statement ok
COMMIT

statement ok
COMMIT

statement ok
DELETE FROM integers

query I
SELECT COUNT(*) FROM integers
----
0
