statement ok
DROP TABLE IF EXISTS i2

statement ok
DROP TABLE IF EXISTS integers

statement ok
DROP TABLE IF EXISTS presentations

statement ok
CREATE TABLE integers(i INTEGER)

statement ok
INSERT INTO integers VALUES (1), (2), (3), (4), (5)

# insert a constant 1 for every uneven value in "integers"

statement ok
CREATE TABLE i2 AS SELECT 1 AS i FROM integers WHERE i % 2 <> 0

query I
SELECT * FROM i2 ORDER BY 1
----
1
1
1

# now update the table with a constant

statement ok
UPDATE i2 SET i=NULL

query I
SELECT * FROM i2 ORDER BY 1
----
NULL
NULL
NULL

# Test insert with long string constant
# found by Pedro Holanda

