statement ok
DROP TABLE IF EXISTS integers

statement ok
CREATE TABLE integers(i integer)

statement ok
INSERT INTO integers SELECT * FROM range(0, 50000);

query I
SELECT i FROM integers WHERE i = 100
----
100

statement ok
DELETE FROM integers WHERE i = 42;

query I
SELECT i FROM integers WHERE i = 100
----
100
