# Named connections share the file's sandbox, but retain independent sessions.
# `connection` applies only to the immediately following statement/query.
# Default connection = transaction A; writer = independently committing B.
# No sleeps or client retries: B commits after A has buffered a stale version.

statement ok
CREATE DATABASE logical_change_retry

statement ok
USE logical_change_retry

connection writer
statement ok
USE logical_change_retry

# Disable maintenance hooks to keep concurrent appends from rewriting base segments.
statement ok
SET auto_compaction_imperfect_blocks_threshold = 0

statement ok
SET enable_auto_analyze = 0

connection writer
statement ok
SET auto_compaction_imperfect_blocks_threshold = 0

connection writer
statement ok
SET enable_auto_analyze = 0

statement ok
CREATE TABLE t1(id INT)

statement ok
CREATE TABLE t2(id INT)

statement ok
INSERT INTO t1 VALUES (1), (2)

statement ok
INSERT INTO t2 VALUES (1), (2)

# ANALYZE buffers metadata without logical changes; concurrent append forces rebasing.
statement ok
BEGIN

statement ok
ANALYZE TABLE t1

connection writer
statement ok
INSERT INTO t1 VALUES (3)

statement ok
COMMIT

query I
SELECT id FROM t1 ORDER BY id
----
1
2
3

# Multi-table INSERT preserves its own rows and the concurrent append.
statement ok
BEGIN

statement ok
INSERT ALL INTO t1 INTO t2 SELECT 4

connection writer
statement ok
INSERT INTO t2 VALUES (5)

statement ok
COMMIT

query I
SELECT id FROM t1 ORDER BY id
----
1
2
3
4

query I
SELECT id FROM t2 ORDER BY id
----
1
2
4
5

# OVERWRITE replaces original segments; B's appended segment survives the merge.
statement ok
BEGIN

statement ok
INSERT OVERWRITE ALL INTO t1 INTO t2 SELECT 9

connection writer
statement ok
INSERT INTO t2 VALUES (6)

statement ok
COMMIT

query I
SELECT id FROM t1 ORDER BY id
----
9

query I
SELECT id FROM t2 ORDER BY id
----
6
9

# Multiple single-table mutations are applied exactly once on retry.
statement ok
BEGIN

statement ok
UPDATE t2 SET id = 60 WHERE id = 6

statement ok
DELETE FROM t2 WHERE id = 9

connection writer
statement ok
INSERT INTO t2 VALUES (7)

statement ok
COMMIT

query I
SELECT id FROM t2 ORDER BY id
----
7
60

statement ok
BEGIN

statement ok
DELETE FROM t2

statement ok
ROLLBACK

query I
SELECT id FROM t2 ORDER BY id
----
7
60

# Reuse A after rollback; the discarded transaction must not affect this commit.
statement ok
BEGIN

statement ok
INSERT INTO t2 VALUES (8)

connection writer
statement ok
INSERT INTO t2 VALUES (10)

statement ok
COMMIT

query I
SELECT id FROM t2 ORDER BY id
----
7
8
10
60

connection writer
statement ok
USE default

statement ok
USE default

statement ok
DROP DATABASE logical_change_retry
