statement ok
DROP DATABASE IF EXISTS db1

statement ok
CREATE DATABASE db1

statement ok
USE db1

statement ok
CREATE TABLE IF NOT EXISTS t(c1 Int, c2 Int )

statement ok
INSERT INTO t VALUES(1,2)

statement ok
INSERT INTO t VALUES(3,4)

statement ok
delete from t where c1 > 3

query B
select count(*) = 2 from t
----
1



statement ok
delete from t where c1 = 1

query B
select count(*) = 0 from t where c1 = 1
----
1



query B
select count(*) = 1 from t where c1 <> 1
----
1



statement ok
delete from t

query B
select count(*) = 0 from t
----
1



statement ok
drop table t all

statement ok
create table t (c Int null)

statement ok
insert into t values (1),(2),(NULL)

statement ok
delete from t where 1 = 0

query B
select count(*) = 3 from t
----
1



statement ok
delete from t where c = 1

query B
select count(*) = 2 from t
----
1



query B
select count(*) = 1 from t where c IS NULL
----
1



statement ok
delete from t where c IS NULL

query B
select count(*) = 0 from t where c IS NULL
----
1



query B
select count(*) = 1 from t where c IS NOT NULL
----
1



statement ok
delete from t where 1 = 1

query B
select count(*) = 0 from t
----
1



statement ok
insert into t values (1),(2),(NULL)

statement ok
delete from t where now()

query B
select count(*) = 0 from t
----
1



statement ok
drop table t all

statement ok
create table t(c Int) CLUSTER BY(c+1)

statement ok
insert into t values (1),(3)

statement ok
insert into t values (2),(4)

statement ok
delete from t where c > 2;

query B
select count(*) = 2 from t
----
1

statement ok
drop table t all

statement ok
create table t(a Int, b Int)

statement ok
insert into t select number, 50 - number from numbers(100)

query B
select count(*) = 100 from t
----
1

statement ok
delete from t where b > 0

query B
select count(*) = 50 from t
----
1



statement ok
drop table t all

statement ok
DROP DATABASE db1
