## Copyright 2023 Databend Cloud
##
## Licensed under the Elastic License, Version 2.0 (the "License");
## you may not use this file except in compliance with the License.
## You may obtain a copy of the License at
##
##     https://www.elastic.co/licensing/elastic-license
##
## Unless required by applicable law or agreed to in writing, software
## distributed under the License is distributed on an "AS IS" BASIS,
## WITHOUT WARRANTIES OR CONDITIONS OF ANY KIND, either express or implied.
## See the License for the specific language governing permissions and
## limitations under the License.

statement ok
drop database if exists test_index

statement ok
create database test_index

statement ok
use test_index

statement ok
CREATE TABLE t (id int, content string)

statement ok
INSERT INTO t VALUES 
(1, 'The quick brown fox jumps over the lazy dog'),
(2, 'A picture is worth a thousand words'),
(3, 'The early bird catches the worm'),
(4, 'Actions speak louder than words'),
(5, 'Time flies like an arrow; fruit flies like a banana'),
(6, 'Beauty is in the eye of the beholder'),
(7, 'When life gives you lemons, make lemonade'),
(8, 'Put all your eggs in one basket'),
(9, 'You can not judge a book by its cover'),
(10, 'An apple a day keeps the doctor away')

statement ok
CREATE INVERTED INDEX IF NOT EXISTS idx1 ON t(content) tokenizer = 'chinese'

query TT
SHOW CREATE TABLE t
----
t CREATE TABLE t ( id INT NULL, content VARCHAR NULL, SYNC INVERTED INDEX idx1 (content) tokenizer = 'chinese' ) ENGINE=FUSE

statement ok
REFRESH INVERTED INDEX idx1 ON t

query I?T
SELECT id, score(), content FROM t WHERE match(content, 'test')
----

query I?T
SELECT id, score(), content FROM t WHERE match(content, 'the')
----

query I?T
SELECT id, score(), content FROM t WHERE match(content, 'fly')
----
5 2.4594712 Time flies like an arrow; fruit flies like a banana

query I?T
SELECT id, score(), content FROM t WHERE match(content, 'word')
----
2 1.5948367 A picture is worth a thousand words
4 1.6550698 Actions speak louder than words

query I?T
SELECT id, score(), content FROM t WHERE match(content, '"early bird"')
----
3 4.503372 The early bird catches the worm

statement ok
INSERT INTO t VALUES 
(11, '我喜欢在周末的时候去公园散步，感受大自然的美丽。'),
(12, '北京的故宫是中国古代建筑的瑰宝，吸引了无数游客前来参观。'),
(13, '随着科技的发展，人们的生活变得越来越便利。'),
(14, '我最喜欢的食物是火锅，因为它既美味又热闹。'),
(15, '中国的茶文化源远流长，品茶已经成为一种生活方式。'),
(16, '虽然学习很辛苦，但是收获的快乐是无法言喻的。'),
(17, '我喜欢阅读，因为它可以让我开阔眼界，增长见识。'),
(18, '在旅行中，我遇到了很多有趣的人和事，这些都成为了我宝贵的回忆。'),
(19, '人生就像一场马拉松，只有坚持不懈才能到达终点。'),
(20, '互联网的发展改变了我们的生活方式，让我们更加便捷地获取信息。')

statement ok
INSERT INTO t VALUES 
(21, '中国的古代诗词充满了深邃的意境和独特的韵味，是中华文化的重要组成部分。'),
(22, '现代社会中，人工智能的快速发展正在改变我们的生活方式和工作方式。'),
(23, '每个人都有自己的梦想，只要努力追求，就一定能够实现。'),
(24, '中国的传统节日蕴含着丰富的文化内涵，是传承和弘扬中华文化的重要途径。'),
(25, '在互联网时代，信息的传播速度越来越快，我们需要更加警惕网络安全问题。'),
(26, '环境保护是每个人的责任，只有大家共同努力，才能保护好我们的家园。'),
(27, '无论是学习还是工作，团队合作都是不可或缺的一部分，只有团结合作才能取得更好的成果。'),
(28, '中国的饮食文化博大精深，各地的美食各具特色，让人流连忘返。'),
(29, '每个人的人生都是一部独特的传奇，我们需要珍惜每一个瞬间，用心去感受生活的美好。'),
(30, '张华考上了北京大学，李萍进了中等技术学校，我在百货公司当售货员，我们都有光明的前途。')

query I?T
SELECT id, score(), content FROM t WHERE match(content, '中国') ORDER BY score()
----
21 1.1111465 中国的古代诗词充满了深邃的意境和独特的韵味，是中华文化的重要组成部分。
24 1.1111465 中国的传统节日蕴含着丰富的文化内涵，是传承和弘扬中华文化的重要途径。
28 1.2247349 中国的饮食文化博大精深，各地的美食各具特色，让人流连忘返。
12 1.4482267 北京的故宫是中国古代建筑的瑰宝，吸引了无数游客前来参观。
15 1.5346593 中国的茶文化源远流长，品茶已经成为一种生活方式。

query I?T
SELECT id, score(), content FROM t WHERE match(content, '北京') ORDER BY score()
----
30 1.7396812 张华考上了北京大学，李萍进了中等技术学校，我在百货公司当售货员，我们都有光明的前途。
12 1.9475443 北京的故宫是中国古代建筑的瑰宝，吸引了无数游客前来参观。

query I?T
SELECT id, score(), content FROM t WHERE match(content, '北京大学') ORDER BY score()
----
30 5.2190437 张华考上了北京大学，李萍进了中等技术学校，我在百货公司当售货员，我们都有光明的前途。

query I?T
SELECT id, score(), content FROM t WHERE match(content, '文化博大精深') ORDER BY score()
----
28 7.61753 中国的饮食文化博大精深，各地的美食各具特色，让人流连忘返。

query I?T
SELECT id, score(), content FROM t WHERE match(content, '文化 博大精深') ORDER BY score()
----
21 1.1111465 中国的古代诗词充满了深邃的意境和独特的韵味，是中华文化的重要组成部分。
24 1.542129 中国的传统节日蕴含着丰富的文化内涵，是传承和弘扬中华文化的重要途径。
15 2.063777 中国的茶文化源远流长，品茶已经成为一种生活方式。
28 7.61753 中国的饮食文化博大精深，各地的美食各具特色，让人流连忘返。

query I?T
SELECT id, score(), content FROM t WHERE match(content, '化博') ORDER BY score()
----


query I?T
SELECT id, score(), content FROM t WHERE match(content, '。') ORDER BY score()
----


query I?T
SELECT id, score(), content FROM t WHERE match(content, '不存在') ORDER BY score()
----


statement ok
UPDATE t SET content = '科技创新是推动社会进步的重要动力，我们应该积极支持和推动科技创新。' WHERE id=24

query I?T
SELECT id, score(), content FROM t WHERE match(content, '中国') ORDER BY score()
----
21 1.423108 中国的古代诗词充满了深邃的意境和独特的韵味，是中华文化的重要组成部分。
12 1.4482267 北京的故宫是中国古代建筑的瑰宝，吸引了无数游客前来参观。
15 1.5346593 中国的茶文化源远流长，品茶已经成为一种生活方式。
28 1.5707673 中国的饮食文化博大精深，各地的美食各具特色，让人流连忘返。

query I?T
SELECT id, score(), content FROM t WHERE match(content, '科技') ORDER BY score()
----
13 2.1947646 随着科技的发展，人们的生活变得越来越便利。
24 2.8508463 科技创新是推动社会进步的重要动力，我们应该积极支持和推动科技创新。

statement ok
DELETE FROM t WHERE id=21

query I?T
SELECT id, score(), content FROM t WHERE match(content, '中国') ORDER BY score()
----
12 1.4482267 北京的故宫是中国古代建筑的瑰宝，吸引了无数游客前来参观。
15 1.5346593 中国的茶文化源远流长，品茶已经成为一种生活方式。
28 2.002842 中国的饮食文化博大精深，各地的美食各具特色，让人流连忘返。

# Test pruning status

statement ok
CREATE TABLE t_small_blocks (id int, content string) row_per_block=2

statement ok
CREATE INVERTED INDEX IF NOT EXISTS inverted_idx2 ON t_small_blocks(content) tokenizer = 'chinese'

statement ok
INSERT INTO t_small_blocks VALUES
(1, 'The quick brown fox jumps over the lazy dog'),
(2, 'A picture is worth a thousand words'),
(3, 'The early bird catches the worm'),
(4, 'Actions speak louder than words'),
(5, 'Time flies like an arrow; fruit flies like a banana'),
(6, 'Beauty is in the eye of the beholder'),
(7, 'When life gives you lemons, make lemonade'),
(8, 'Put all your eggs in one basket'),
(9, 'You can not judge a book by its cover'),
(10, 'An apple a day keeps the doctor away')

query I?T
SELECT id, content FROM t WHERE match(content, '"early bird"')
----
3 The early bird catches the worm

query I?T
EXPLAIN SELECT id, content FROM t WHERE match(content, '"early bird"')
----
Filter
├── output columns: [t.id (#0), t.content (#1)]
├── filters: [t._search_matched (#2)]
├── estimated rows: 29.00
└── TableScan
    ├── table: default.test_index.t
    ├── output columns: [id (#0), content (#1), _search_matched (#2)]
    ├── read rows: 10
    ├── read size: < 1 KiB
    ├── partitions total: 3
    ├── partitions scanned: 1
    ├── pruning stats: [segments: <range pruning: 3 to 3>, blocks: <range pruning: 3 to 3, inverted pruning: 3 to 1>]
    ├── push downs: [filters: [t._search_matched (#2)], limit: NONE]
    └── estimated rows: 29.00

statement ok
use default

statement ok
drop database test_index
