statement ok
DROP DATABASE IF EXISTS db1

statement ok
CREATE DATABASE db1

statement ok
USE db1

statement ok
CREATE TABLE IF NOT EXISTS t1(a Int, b Date)

statement ok
INSERT INTO t1 VALUES(1, '2022-12-30')

statement ok
INSERT INTO t1 VALUES(2, '2023-01-01')

statement ok
UPDATE t1 SET a = 3 WHERE b > '2022-12-31'

query IT
SELECT * FROM t1 ORDER BY b
----
1 2022-12-30
3 2023-01-01

statement ok
UPDATE t1 SET a = 2, b = '2022-12-31' WHERE b > '2022-12-31'

query IT
SELECT * FROM t1 ORDER BY b
----
1 2022-12-30
2 2022-12-31

statement ok
UPDATE t1 SET a = 3 WHERE false

query B
select count(*) = 0 from t1 WHERE a = 3
----
1

statement ok
UPDATE t1 SET a = 3 WHERE true

query B
select count(*) = 2 from t1 WHERE a = 3
----
1

statement error 1006
UPDATE t1 SET a = 3, a = 4 WHERE b > '2022-12-31'

statement ok
CREATE TABLE IF NOT EXISTS t2(a Int, b Date)

statement ok
INSERT INTO t2 VALUES(1, '2022-12-30')

statement ok
INSERT INTO t2 VALUES(2, '2023-01-01')

statement error 1001
UPDATE t1 SET a = 2 WHERE a in (SELECT a FROM t2 WHERE b > '2022-12-31')

statement ok
drop table t1 all

statement ok
drop table t2 all

statement ok
DROP DATABASE db1
