statement ok
DROP TABLE IF EXISTS tbl

statement ok
DROP TABLE IF EXISTS tbl2

statement ok
CREATE TABLE tbl2(i INT);

statement ok
INSERT INTO tbl2 VALUES (42);

onlyif mode=with_open_transaction

statement ok
BEGIN

statement ok
BEGIN

# con2 deletes rows 0M...1M

# and inserts into tbl2

statement ok
DELETE FROM tbl2

# con1 now alters tbl2

statement ok
ALTER TABLE tbl2 ADD COLUMN j INTEGER

statement ok
COMMIT

onlyif mode=with_open_transaction

query I
FROM tbl WHERE i=50_000
----
50000

statement error
INSERT INTO tbl VALUES (50_000)

statement ok
DROP TABLE tbl2

statement ok
CREATE TABLE tbl2(i INT);

statement ok
INSERT INTO tbl2 VALUES (42);

onlyif mode=with_open_transaction

statement ok
BEGIN

statement ok
BEGIN

# con2 deletes rows 0M...1M

# and inserts into tbl2

statement ok
DELETE FROM tbl2

# con1 now alters tbl2

statement ok
ALTER TABLE tbl2 ADD COLUMN j INTEGER

statement ok
COMMIT

onlyif mode=with_open_transaction

query I
FROM tbl WHERE i=50_000
----
50000

statement error
INSERT INTO tbl VALUES (50_000)

statement ok
DROP TABLE tbl2
