statement ok
DROP MATERIALIZED VIEW IF EXISTS test_mv

statement ok
DROP MATERIALIZED VIEW IF EXISTS test_mv2

statement ok
DROP MATERIALIZED VIEW IF EXISTS test_mv_cte

statement ok
DROP MATERIALIZED VIEW IF EXISTS test_mv_nested_cte

statement ok
DROP MATERIALIZED VIEW IF EXISTS test_mv_tracking_disabled

statement ok
DROP MATERIALIZED VIEW IF EXISTS mv_dst_db.cross_mv

statement ok
DROP ROLE IF EXISTS mv_maintenance_role

statement ok
DROP TABLE IF EXISTS mv_src_db.t

statement ok
DROP TABLE IF EXISTS mv_dst_db.t

statement ok
DROP DATABASE IF EXISTS mv_src_db

statement ok
DROP DATABASE IF EXISTS mv_dst_db

statement ok
DROP TABLE IF EXISTS mv_base_t

statement ok
DROP TABLE IF EXISTS mv_base_t2

statement ok
DROP TABLE IF EXISTS mv_null_source

statement ok
DROP VIEW IF EXISTS mv_source_view

statement ok
DROP TABLE IF EXISTS mv_temp_source

statement ok
CREATE TABLE mv_base_t (id INT, val VARCHAR, amount INT)

statement ok
CREATE TABLE mv_base_t2 (id INT)

statement ok
INSERT INTO mv_base_t VALUES (1, 'a', 10), (2, 'b', 20), (3, 'a', 30), (4, 'b', 40)

# Change tracking is a creation-time prerequisite instead of an error deferred
# until the first refresh.
statement error 2328
CREATE MATERIALIZED VIEW test_mv_tracking_disabled AS SELECT id FROM mv_base_t

query I
SELECT count(*) FROM system.tables WHERE database = 'default' AND name = 'test_mv_tracking_disabled'
----
0

statement ok
ALTER TABLE mv_base_t SET OPTIONS (change_tracking = true)

# EXPLAIN prints the metadata-only CREATE operation, not the stored definition query plan.
query T
EXPLAIN CREATE MATERIALIZED VIEW test_mv_explain AS SELECT id FROM mv_base_t
----
CreateMaterializedView

# CREATE leaves storage empty, but reads use the live definition until the first refresh.
statement ok
CREATE MATERIALIZED VIEW test_mv AS SELECT id, val, amount FROM mv_base_t WHERE id <= 2

query I
SELECT count(*) FROM test_mv
----
2

# DESC sees the materialized view schema.
query TTTTT
DESC test_mv
----
id INT YES NULL (empty)
val VARCHAR YES NULL (empty)
amount INT YES NULL (empty)

# SHOW CREATE MATERIALIZED VIEW
query TT
SHOW CREATE MATERIALIZED VIEW test_mv
----
test_mv CREATE MATERIALIZED VIEW `default`.`test_mv` (`id`, `val`, `amount`) AS SELECT id, val, amount FROM default.mv_base_t WHERE id <= 2

# SHOW CREATE TABLE on MV outputs MV DDL.
query TT
SHOW CREATE TABLE test_mv
----
test_mv CREATE MATERIALIZED VIEW `default`.`test_mv` (`id`, `val`, `amount`) AS SELECT id, val, amount FROM default.mv_base_t WHERE id <= 2

# Materialized view creation is always asynchronous; explicit creation modes are rejected.
statement error
CREATE SYNC MATERIALIZED VIEW test_mv_sync AS SELECT id FROM mv_base_t

statement error
CREATE ASYNC MATERIALIZED VIEW test_mv_async AS SELECT id FROM mv_base_t

# SHOW CREATE MATERIALIZED VIEW rejects base tables.
statement error
SHOW CREATE MATERIALIZED VIEW mv_base_t

# SHOW MATERIALIZED VIEWS surfaces the MV object.
query T
SELECT name FROM system.tables WHERE database = 'default' AND table_type = 'MATERIALIZED VIEW' ORDER BY name
----
test_mv

query I
SELECT count(*) FROM system.tables WHERE database = 'default' AND name = 'test_mv' AND table_type = 'BASE TABLE'
----
0

query TT
SELECT engine, table_type FROM system.tables WHERE database = 'default' AND name = 'test_mv'
----
MATERIALIZED_VIEW MATERIALIZED VIEW

statement ok
SHOW MATERIALIZED VIEWS FROM default.default LIKE 'test_mv'

# IF NOT EXISTS
statement ok
CREATE MATERIALIZED VIEW IF NOT EXISTS test_mv AS SELECT id FROM mv_base_t

# Error: already exists
statement error 2329
CREATE MATERIALIZED VIEW test_mv AS SELECT id FROM mv_base_t

# CREATE OR REPLACE MATERIALIZED VIEW
statement ok
CREATE OR REPLACE MATERIALIZED VIEW test_mv AS SELECT val, COUNT(*) AS cnt FROM mv_base_t GROUP BY val

query I
SELECT count(*) FROM test_mv
----
2

# CREATE OR REPLACE MATERIALIZED VIEW cannot depend on the old MV object.
statement error 1302
CREATE OR REPLACE MATERIALIZED VIEW test_mv AS SELECT val, cnt FROM test_mv

# Replace back to a stable definition for guard/drop tests.
statement ok
CREATE OR REPLACE MATERIALIZED VIEW test_mv AS SELECT id, val, amount FROM mv_base_t WHERE id <= 2

# Protected options: user cannot set MV options via CREATE TABLE.
statement error 1301
CREATE TABLE fake_mv (x INT) materialized_view = 'true'

# The MV engine cannot be used to bypass CREATE MATERIALIZED VIEW metadata creation.
statement error 1005
CREATE TABLE fake_mv_engine (x INT) ENGINE = MATERIALIZED_VIEW

# Protected options: user cannot set MV options via ALTER TABLE.
statement error 3905
ALTER TABLE test_mv SET OPTIONS (materialized_view_query = 'SELECT 1')

statement error
ALTER TABLE test_mv SET OPTIONS (block_per_segment = 10)

statement error
ALTER TABLE test_mv UNSET OPTIONS (block_per_segment)

statement error
ALTER VIEW test_mv AS SELECT 1

statement error
ALTER TABLE test_mv RENAME TO test_mv_renamed

statement error
ALTER TABLE test_mv SWAP WITH mv_base_t

# All ALTER TABLE operations are blocked on materialized views.
statement error 3905
ALTER TABLE test_mv COMMENT = 'changed'

statement error 3905
ALTER TABLE test_mv CONNECTION = (CONNECTION_NAME = 'missing')

statement error 3905
ALTER TABLE test_mv ADD COLUMN new_col INT

statement error 3905
ALTER TABLE test_mv DROP COLUMN val

statement error 3905
ALTER TABLE test_mv RENAME COLUMN val TO value

statement error 3905
ALTER TABLE test_mv MODIFY COLUMN amount BIGINT

statement error 3905
ALTER TABLE test_mv ADD CONSTRAINT positive_id CHECK (id > 0)

statement error 3905
ALTER TABLE test_mv DROP CONSTRAINT positive_id

statement error 3905
ALTER TABLE test_mv RECLUSTER

statement error 3905
ALTER TABLE test_mv FLASHBACK TO (SNAPSHOT => '00000000-0000-0000-0000-000000000000')

statement error 3905
ALTER TABLE test_mv CREATE TAG mv_snapshot

statement error 3905
ALTER TABLE test_mv DROP TAG mv_snapshot

statement error 3905
ALTER TABLE test_mv SET TAG missing_tag = 'value'

statement error 3905
ALTER TABLE test_mv UNSET TAG missing_tag

# TRUNCATE is blocked on materialized views.
statement error 3905
TRUNCATE TABLE test_mv

# User writes are blocked on materialized views.
statement error 3905
INSERT INTO test_mv VALUES (5, 'c', 50)

statement error 3905
UPDATE test_mv SET val = 'changed' WHERE id = 1

statement error 3905
DELETE FROM test_mv WHERE id = 1

statement error 3905
MERGE INTO test_mv AS target
USING (SELECT 1 AS id, 'changed' AS val, 100 AS amount) AS source
ON target.id = source.id
WHEN MATCHED THEN UPDATE SET target.val = source.val
WHEN NOT MATCHED THEN INSERT (id, val, amount) VALUES (source.id, source.val, source.amount)

statement error 3905
REPLACE INTO test_mv ON CONFLICT(id) VALUES (1, 'changed', 100)

statement error 1302
INSERT ALL
    INTO test_mv VALUES (id, val, amount)
SELECT 5 AS id, 'c' AS val, 50 AS amount

statement ok
CREATE STAGE mv_empty_stage

statement error 3905
COPY INTO test_mv FROM @mv_empty_stage FILE_FORMAT = (TYPE = CSV)

statement ok
DROP STAGE mv_empty_stage

query I
SELECT count(*) FROM test_mv
----
2

# ALTER CLUSTER KEY is blocked on materialized views.
statement error 3905
ALTER TABLE test_mv CLUSTER BY (id)

statement error 3905
ALTER TABLE test_mv DROP CLUSTER KEY

statement error 3905
OPTIMIZE TABLE test_mv COMPACT

# Dedicated MV maintenance reuses Fuse plans without opening TABLE syntax on MVs.
statement ok
ALTER MATERIALIZED VIEW test_mv CLUSTER BY (id)

query TT
SHOW CREATE MATERIALIZED VIEW test_mv
----
test_mv CREATE MATERIALIZED VIEW `default`.`test_mv` (`id`, `val`, `amount`) CLUSTER BY (id) AS SELECT id, val, amount FROM default.mv_base_t WHERE id <= 2

# Hidden refresh columns are not valid MV cluster keys.
statement error
ALTER MATERIALIZED VIEW test_mv CLUSTER BY (_mv_source_row_id)

# RECLUSTER WHERE is intentionally not part of the first MV maintenance version.
statement error
ALTER MATERIALIZED VIEW test_mv RECLUSTER WHERE id = 1

statement ok
ALTER MATERIALIZED VIEW test_mv RECLUSTER LIMIT 1

statement ok
ALTER MATERIALIZED VIEW test_mv RECLUSTER FINAL LIMIT 1

statement ok
OPTIMIZE MATERIALIZED VIEW test_mv COMPACT LIMIT 1

statement ok
OPTIMIZE MATERIALIZED VIEW test_mv COMPACT SEGMENT LIMIT 2

statement ok
ALTER MATERIALIZED VIEW test_mv DROP CLUSTER KEY

query TT
SHOW CREATE MATERIALIZED VIEW test_mv
----
test_mv CREATE MATERIALIZED VIEW `default`.`test_mv` (`id`, `val`, `amount`) AS SELECT id, val, amount FROM default.mv_base_t WHERE id <= 2

# The dedicated syntax rejects ordinary tables and unrelated ALTER/OPTIMIZE actions.
statement error
ALTER MATERIALIZED VIEW mv_base_t CLUSTER BY (id)

statement error
OPTIMIZE MATERIALIZED VIEW mv_base_t COMPACT

statement error
ALTER MATERIALIZED VIEW test_mv ADD COLUMN extra INT

statement error
ALTER MATERIALIZED VIEW test_mv COMPACT

statement error
OPTIMIZE MATERIALIZED VIEW test_mv PURGE

statement error
OPTIMIZE MATERIALIZED VIEW test_mv ALL

# All MV maintenance follows the existing MV access rule: SELECT or ownership on the source table.
statement ok
CREATE ROLE mv_maintenance_role

statement ok
GRANT SELECT ON default.mv_base_t TO ROLE mv_maintenance_role

statement ok
SET ROLE mv_maintenance_role

statement ok
ALTER MATERIALIZED VIEW test_mv CLUSTER BY (id)

statement ok
ALTER MATERIALIZED VIEW test_mv RECLUSTER LIMIT 1

statement ok
OPTIMIZE MATERIALIZED VIEW test_mv COMPACT LIMIT 1

statement ok
OPTIMIZE MATERIALIZED VIEW test_mv COMPACT SEGMENT LIMIT 1

statement ok
SET ROLE account_admin

statement ok
DROP ROLE mv_maintenance_role

# Snowflake-compatible syntax requires a column list whenever CLUSTER BY is present.
statement error 1065
CREATE MATERIALIZED VIEW test_mv_cluster_without_columns CLUSTER BY (val) AS SELECT val FROM mv_base_t

# Invalid cluster keys are rejected before table metadata is stored.
statement error 1081
CREATE MATERIALIZED VIEW test_mv_bad_cluster (val) CLUSTER BY (missing_col) AS SELECT val FROM mv_base_t

# CREATE MATERIALIZED VIEW with CLUSTER BY
statement ok
CREATE MATERIALIZED VIEW test_mv2 (val, cnt) CLUSTER BY (val) AS SELECT val, COUNT(*) AS cnt FROM mv_base_t GROUP BY val

statement ok
REFRESH MATERIALIZED VIEW test_mv2

query I
SELECT count(*) FROM test_mv2
----
2

query TT
SHOW CREATE MATERIALIZED VIEW test_mv2
----
test_mv2 CREATE MATERIALIZED VIEW `default`.`test_mv2` (`val`, `cnt`) CLUSTER BY (val) AS SELECT val, COUNT(*) AS cnt FROM default.mv_base_t GROUP BY val

# Aggregate result/state columns cannot be used as MV cluster keys.
statement error 1081
CREATE MATERIALIZED VIEW test_mv_bad_aggregate_cluster (val, cnt) CLUSTER BY (cnt) AS SELECT val, COUNT(*) AS cnt FROM mv_base_t GROUP BY val

statement error 1081
ALTER MATERIALIZED VIEW test_mv2 CLUSTER BY (cnt)

statement ok
ALTER MATERIALIZED VIEW test_mv2 CLUSTER BY (val)

# Cross-database MV creation resolves source references in the session database.
statement ok
CREATE DATABASE mv_src_db

statement ok
CREATE DATABASE mv_dst_db

statement ok
CREATE TABLE mv_src_db.t (id INT)

statement ok
CREATE TABLE mv_dst_db.t (id INT)

statement ok
ALTER TABLE mv_src_db.t SET OPTIONS (change_tracking = true)

statement ok
INSERT INTO mv_src_db.t VALUES (1), (2)

statement ok
INSERT INTO mv_dst_db.t VALUES (100)

statement ok
USE mv_src_db

statement ok
CREATE MATERIALIZED VIEW mv_dst_db.cross_mv AS SELECT id FROM t

query I
SELECT count(*) FROM mv_dst_db.cross_mv
----
2

query TT
SHOW CREATE MATERIALIZED VIEW mv_dst_db.cross_mv
----
cross_mv CREATE MATERIALIZED VIEW `mv_dst_db`.`cross_mv` (`id`) AS SELECT id FROM mv_src_db.t

statement ok
USE default

# CTE definitions remain outside the query shapes supported by feat-mv-insert.
statement error
CREATE MATERIALIZED VIEW test_mv_cte AS WITH c AS (SELECT val, SUM(amount) AS total FROM mv_base_t GROUP BY val) SELECT * FROM c

# CTE in materialized view: nested CTE inside subquery
statement error
CREATE MATERIALIZED VIEW test_mv_nested_cte AS SELECT * FROM (WITH c AS (SELECT val, SUM(amount) AS total FROM mv_base_t GROUP BY val) SELECT * FROM c) s

# MV metadata records one real, persistent, ordinary FUSE source identity.
statement error
CREATE MATERIALIZED VIEW test_mv_no_source AS SELECT 1

statement error
CREATE MATERIALIZED VIEW test_mv_join AS SELECT a.id FROM mv_base_t a JOIN mv_base_t2 b ON a.id = b.id

statement ok
CREATE VIEW mv_source_view AS SELECT id FROM mv_base_t

statement error
CREATE MATERIALIZED VIEW test_mv_from_view AS SELECT id FROM mv_source_view

statement error
CREATE MATERIALIZED VIEW test_mv_from_mv AS SELECT id FROM test_mv

statement ok
CREATE TABLE mv_null_source (id INT) ENGINE = NULL

statement error
CREATE MATERIALIZED VIEW test_mv_from_null AS SELECT * FROM mv_null_source

statement ok
CREATE TEMPORARY TABLE mv_temp_source (id INT)

statement error
CREATE MATERIALIZED VIEW test_mv_from_temp AS SELECT * FROM mv_temp_source

statement ok
DROP TABLE mv_temp_source

# SHOW MATERIALIZED VIEWS column/format verification via system.tables
query TTTT
SELECT name, database, engine, table_type FROM system.tables WHERE database = 'default' AND table_type = 'MATERIALIZED VIEW' ORDER BY name
----
test_mv default MATERIALIZED_VIEW MATERIALIZED VIEW
test_mv2 default MATERIALIZED_VIEW MATERIALIZED VIEW

# DROP TABLE cannot drop materialized views.
statement error
DROP TABLE test_mv

# DROP MATERIALIZED VIEW
statement ok
DROP MATERIALIZED VIEW test_mv

statement error 1025
SELECT * FROM test_mv

# DROP removes the MV definition, so the backing table cannot be restored.
statement error 2309
UNDROP TABLE test_mv

# DROP MATERIALIZED VIEW IF EXISTS (no error)
statement ok
DROP MATERIALIZED VIEW IF EXISTS test_mv

# DROP MATERIALIZED VIEW on non-MV table should error.
statement error 1302
DROP MATERIALIZED VIEW mv_base_t

# Source schema changes invalidate the MV binding without blocking DDL.
statement ok
CREATE TABLE mv_guard_source (a INT, b INT)

statement ok
ALTER TABLE mv_guard_source SET OPTIONS (change_tracking = true)

statement ok
CREATE MATERIALIZED VIEW mv_guard AS SELECT a, b FROM mv_guard_source

# ADD COLUMN does not invalidate the bound columns and remains allowed.
statement ok
ALTER TABLE mv_guard_source ADD COLUMN c INT

# ADD COLUMN preserves the source generation, so refresh remains valid.
statement ok
REFRESH MATERIALIZED VIEW mv_guard

statement ok
ALTER TABLE mv_guard_source RENAME TO mv_guard_source_renamed

# Source table rename preserves the stable table-ID binding for reads and refresh.
query I
SELECT count(*) FROM mv_guard
----
0

statement ok
REFRESH MATERIALIZED VIEW mv_guard

statement ok
ALTER TABLE mv_guard_source_renamed RENAME COLUMN a TO renamed_a

statement error
REFRESH MATERIALIZED VIEW mv_guard

# Reads reject the same stale source binding instead of using MV storage.
statement error 2328
SELECT * FROM mv_guard

# CREATE observes the nonzero generation produced by RENAME and can publish a new binding.
statement ok
CREATE MATERIALIZED VIEW mv_guard_recreated AS SELECT renamed_a, b, c FROM mv_guard_source_renamed

statement ok
ALTER TABLE mv_guard_source_renamed MODIFY COLUMN renamed_a BIGINT

statement error
REFRESH MATERIALIZED VIEW mv_guard_recreated

statement error 2328
SELECT * FROM mv_guard_recreated

statement ok
ALTER TABLE mv_guard_source_renamed DROP COLUMN b

statement ok
DROP MATERIALIZED VIEW mv_guard

statement ok
DROP MATERIALIZED VIEW mv_guard_recreated

statement ok
DROP TABLE mv_guard_source_renamed

# Cleanup
statement ok
DROP MATERIALIZED VIEW IF EXISTS test_mv2

statement ok
DROP MATERIALIZED VIEW IF EXISTS test_mv_cte

statement ok
DROP MATERIALIZED VIEW IF EXISTS test_mv_nested_cte

statement ok
DROP MATERIALIZED VIEW IF EXISTS mv_dst_db.cross_mv

statement ok
DROP DATABASE IF EXISTS mv_src_db

statement ok
DROP DATABASE IF EXISTS mv_dst_db

statement ok
DROP TABLE IF EXISTS mv_base_t

statement ok
DROP TABLE IF EXISTS mv_base_t2

statement ok
DROP TABLE IF EXISTS mv_null_source

statement ok
DROP VIEW IF EXISTS mv_source_view
