statement ok
DROP TABLE IF EXISTS v0

statement ok
DROP TABLE IF EXISTS v3

statement ok
DROP TABLE IF EXISTS v_char

# enable query verification
statement ok
CREATE TABLE v0 (
    v3 INTEGER,
    v2 INTEGER,
    v4 INTEGER,
    v1 INTEGER,
    CHECK ( ( ( NOT (v2 = v1) = v3 - 0 ) > (18 = 10) ) ),
    CHECK ( v3 = v4 )
);

# Only v4 is provided; other columns are NULL

# This UPDATE used to trigger the internal assertion

statement ok
UPDATE v0 SET v4 = 44;

# Table shape is not important here; just ensure it executed

query II
SELECT COUNT(*), MIN(v4) FROM v0;
----
0 NULL

# Simple case: CHECK on non-updated column still enforced

# UPDATE touching only c but violating CHECK(b = c) must fail,
# and must not trigger internal errors

statement error
UPDATE v1 SET c = 2;

# UPDATE with WHERE filter: constraint violation on subset

# This violates CHECK(x + y = z) for the row x=2 and must fail

statement error
UPDATE v2 SET z = 7 WHERE x = 2;

# UPDATE non-checked column only; CHECK column untouched

statement ok
CREATE TABLE v3 (
    id INTEGER,
    payload INTEGER,
    flag BOOLEAN,
    CHECK (flag IS NOT NULL)
);

statement ok
INSERT INTO v3 VALUES (1, 42, TRUE);

# UPDATE only payload; CHECK(flag IS NOT NULL) should be re-evaluated

statement ok
UPDATE v3 SET payload = 99;

query IIB
SELECT id, payload, flag FROM v3;
----
1 99 1

# VARCHAR: CHECK on text content

statement ok
CREATE TABLE v_char (
    username VARCHAR,
    status   VARCHAR,
    CHECK (length(username) >= 3),
    CHECK (status IN ('active', 'inactive'))
);

# Valid row: username long enough, status allowed

statement ok
INSERT INTO v_char VALUES ('alice', 'active');

# Invalid: username too short

statement error
INSERT INTO v_char VALUES ('ab', 'active');

statement error
INSERT INTO v_char VALUES ('charlie', 'pending');

statement ok
UPDATE v_char SET status = 'inactive' WHERE username = 'alice';

query TT
SELECT username, status FROM v_char;
----
alice	inactive
