statement ok
DROP TABLE IF EXISTS interval

statement ok
CREATE TABLE interval (t INTERVAL);

statement ok
INSERT INTO interval VALUES (INTERVAL '20' DAY), (INTERVAL '1' YEAR), (INTERVAL '1' MONTH);

# update

statement ok
BEGIN TRANSACTION;

statement ok
UPDATE interval SET t=INTERVAL '1' MONTH WHERE t=INTERVAL '20' DAY;

# now we only have two distinct values in con

query T
SELECT * FROM interval ORDER BY 1
----
1 month
1 month
1 year

query I
SELECT COUNT(DISTINCT t) FROM interval
----
2

# in con2 we still have 3

query T
SELECT * FROM interval ORDER BY 1
----
1 month
1 month
1 year

query I
SELECT COUNT(DISTINCT t) FROM interval
----
2

# rollback

statement ok
ROLLBACK

# after the rollback we are back to 3

query I
SELECT COUNT(DISTINCT t) FROM interval
----
3

# now commit it

statement ok
UPDATE interval SET t=INTERVAL '1' MONTH WHERE t=INTERVAL '20' DAY;

query TI
SELECT t, COUNT(*) FROM interval GROUP BY t ORDER BY 2 DESC
----
1 month	2
1 year	1

query I
SELECT COUNT(DISTINCT t) FROM interval
----
2

query I
SELECT COUNT(DISTINCT t) FROM interval
----
2
