# Statement coverage corresponds to setup/04_statement_coverage.test.

query ITTTT
SELECT distance, source_object_database, source_object_name, target_object_database, target_object_name
FROM get_lineage('lineage_history_statements.self_insert_dst', 'TABLE', 'UPSTREAM', 1)
----
1 lineage_history_statements src lineage_history_statements self_insert_dst

query ISS
SELECT distance, source_column_name, target_column_name
FROM get_lineage('lineage_history_statements.self_insert_dst.a', 'COLUMN', 'UPSTREAM', 1)
----
1 a a

query I
SELECT count(*)
FROM system_history.lineage_history
WHERE target_database = 'lineage_history_statements'
  AND source_lineage_key = target_lineage_key
----
0

query ITTTT
SELECT distance, source_object_database, source_object_name, target_object_database, target_object_name
FROM get_lineage('lineage_history_statements.insert_dst', 'TABLE', 'UPSTREAM', 1)
----
1 lineage_history_statements src lineage_history_statements insert_dst

query ISS rowsort
SELECT distance, source_column_name, target_column_name
FROM get_lineage('lineage_history_statements.mcte_dst.x', 'COLUMN', 'UPSTREAM', 1)
----
1 a x
1 b x

query ISS
SELECT distance, source_column_name, target_column_name
FROM get_lineage('lineage_history_statements.mcte_tuple_dst.x', 'COLUMN', 'UPSTREAM', 1)
----
1 t x

query I
SELECT count(*)
FROM system_history.lineage_history
WHERE source_database = 'lineage_history_statements'
  AND source_name = 'src'
  AND target_database = 'lineage_history_statements'
  AND target_name = 'explain_pipeline_dst'
----
0

# Process metadata matches the selected history edge. Its updated timestamp is stable UTC RFC3339,
# independent of the session timezone used to query GET_LINEAGE.
query BBBBBBBBB
SETTINGS (timezone = 'UTC')
WITH result AS (
  SELECT parse_json(process) AS process
  FROM get_lineage('lineage_history_statements.insert_dst', 'TABLE', 'UPSTREAM', 1)
), history AS (
  SELECT updated_on, user_name, query_parameterized_hash, lineage_kind, query_info
  FROM system_history.lineage_history
  WHERE source_database = 'lineage_history_statements'
    AND source_name = 'src'
    AND target_database = 'lineage_history_statements'
    AND target_name = 'insert_dst'
  QUALIFY row_number() OVER (
    ORDER BY updated_on DESC, query_info['query_id']::STRING DESC
  ) = 1
)
SELECT result.process['query_id']::STRING = history.query_info['query_id']::STRING,
       result.process['updated_on']::STRING =
         concat(replace(to_string(history.updated_on), ' ', 'T'), 'Z'),
       result.process['user_name']::STRING = history.user_name,
       result.process['query_parameterized_hash']::STRING = history.query_parameterized_hash,
       result.process['lineage_kind']::STRING = history.lineage_kind,
       result.process['query_text']::STRING = history.query_info['query_text']::STRING,
       result.process['query_duration_ms']::Int64 =
         history.query_info['query_duration_ms']::Int64,
       result.process['written_rows']::UInt64 = history.query_info['written_rows']::UInt64,
       result.process['scan_rows']::UInt64 = history.query_info['scan_rows']::UInt64
FROM result CROSS JOIN history
----
1 1 1 1 1 1 1 1 1

query B
SETTINGS (timezone = 'Asia/Shanghai')
WITH result AS (
  SELECT parse_json(process)['updated_on']::STRING AS updated_on
  FROM get_lineage('lineage_history_statements.insert_dst', 'TABLE', 'UPSTREAM', 1)
), history AS (
  SELECT updated_on, query_info
  FROM system_history.lineage_history
  WHERE source_database = 'lineage_history_statements'
    AND source_name = 'src'
    AND target_database = 'lineage_history_statements'
    AND target_name = 'insert_dst'
  QUALIFY row_number() OVER (
    ORDER BY updated_on DESC, query_info['query_id']::STRING DESC
  ) = 1
)
SELECT result.updated_on = concat(
         replace(to_string(convert_timezone('UTC', history.updated_on)), ' ', 'T'),
         'Z'
       )
FROM result CROSS JOIN history
----
1

query ITTTT
SELECT distance, source_object_database, source_object_name, target_object_database, target_object_name
FROM get_lineage('lineage_history_statements.multi_a', 'TABLE', 'UPSTREAM', 1)
----
1 lineage_history_statements src lineage_history_statements multi_a

query ITTTT
SELECT distance, source_object_database, source_object_name, target_object_database, target_object_name
FROM get_lineage('lineage_history_statements.multi_b', 'TABLE', 'UPSTREAM', 1)
----
1 lineage_history_statements src lineage_history_statements multi_b

query ITTTT
SELECT distance, source_object_database, source_object_name, target_object_database, target_object_name
FROM get_lineage('lineage_history_statements.replace_dst', 'TABLE', 'UPSTREAM', 1)
----
1 lineage_history_statements src lineage_history_statements replace_dst

# MERGE INTO records a single DML edge for the src -> merge_dst pair.
query ITTTT
SELECT distance, source_object_database, source_object_name, target_object_database, target_object_name
FROM get_lineage('lineage_history_statements.merge_dst', 'TABLE', 'UPSTREAM', 1)
----
1 lineage_history_statements src lineage_history_statements merge_dst

query T
SELECT parse_json(process)['lineage_kind']::STRING
FROM get_lineage('lineage_history_statements.merge_dst', 'TABLE', 'UPSTREAM', 1)
----
DML

# Both MERGE clauses contribute column lineage: merge_dst.m comes from src.c (matched UPDATE) and
# src.b (unmatched INSERT), while merge_dst.k and merge_dst.n come only from the unmatched INSERT.
query ISS rowsort
SELECT distance, source_column_name, target_column_name
FROM get_lineage('lineage_history_statements.merge_dst.m', 'COLUMN', 'UPSTREAM', 1)
----
1 b m
1 c m

query ISS rowsort
SELECT distance, source_column_name, target_column_name
FROM get_lineage('lineage_history_statements.merge_dst.k', 'COLUMN', 'UPSTREAM', 1)
----
1 a k

query ISS rowsort
SELECT distance, source_column_name, target_column_name
FROM get_lineage('lineage_history_statements.merge_dst.n', 'COLUMN', 'UPSTREAM', 1)
----
1 c n

# Stream data lineage passes through to the backing table.
query ITTTT
SELECT distance, source_object_database, source_object_name, target_object_database, target_object_name
FROM get_lineage('lineage_history_statements.stream_dst', 'TABLE', 'UPSTREAM', 1)
----
1 lineage_history_statements stream_src lineage_history_statements stream_dst

query ISS
SELECT distance, source_column_name, target_column_name
FROM get_lineage('lineage_history_statements.stream_dst.x', 'COLUMN', 'UPSTREAM', 1)
----
1 a x

# The Stream wrapper itself must not be persisted as a lineage endpoint.
query I
SELECT count(*)
FROM system_history.lineage_history
WHERE source_database = 'lineage_history_statements'
  AND source_name = 'src_stream'
  AND target_database = 'lineage_history_statements'
  AND target_name = 'stream_dst'
----
0

query ITSTTT
SELECT distance, source_object_catalog, source_object_database, source_object_name,
       target_object_database, target_object_name
FROM get_lineage('lineage_history_statements.copy_dst', 'TABLE', 'UPSTREAM', 2)
ORDER BY distance, source_object_name, target_object_name
----
1 NULL NULL lineage_history_statements_stage lineage_history_statements copy_dst
2 default lineage_history_statements src NULL lineage_history_statements_stage

query ITTSTTT rowsort
SELECT distance, source_object_catalog, source_object_database, source_object_name,
       target_object_catalog, target_object_database, target_object_name
FROM get_lineage('lineage_history_statements_stage', 'STAGE', 'DOWNSTREAM', 1)
----
1 NULL NULL lineage_history_statements_stage default lineage_history_statements copy_dst
1 NULL NULL lineage_history_statements_stage default lineage_history_statements insert_select_stage_dst
1 NULL NULL lineage_history_statements_stage default lineage_history_statements insert_stage_dst

# Stage neighbors have no catalog/database or stable file-column mapping.
query TTTTTT rowsort
SELECT direction, object_domain, catalog, database, object_name, to_string(column_neighbors)
FROM get_lineage_neighbors('lineage_history_statements_stage', 'STAGE')
----
DOWNSTREAM TABLE default lineage_history_statements copy_dst {}
DOWNSTREAM TABLE default lineage_history_statements insert_select_stage_dst {}
DOWNSTREAM TABLE default lineage_history_statements insert_stage_dst {}
UPSTREAM TABLE default lineage_history_statements src {}

query TTTTTT
SELECT direction, object_domain, catalog, database, object_name, to_string(column_neighbors)
FROM get_lineage_neighbors('lineage_history_statements.copy_dst', 'TABLE')
----
UPSTREAM STAGE NULL NULL lineage_history_statements_stage {}

query ITSTTT
SELECT distance, source_object_catalog, source_object_database, source_object_name,
       target_object_database, target_object_name
FROM get_lineage('lineage_history_statements.insert_select_stage_dst', 'TABLE', 'UPSTREAM', 1)
----
1 NULL NULL lineage_history_statements_stage lineage_history_statements insert_select_stage_dst

query ITSTTT
SELECT distance, source_object_catalog, source_object_database, source_object_name,
       target_object_database, target_object_name
FROM get_lineage('lineage_history_statements.insert_stage_dst', 'TABLE', 'UPSTREAM', 1)
----
1 NULL NULL lineage_history_statements_stage lineage_history_statements insert_stage_dst

# Stage file fields are not stable columns, so Stage-to-table edges stay object-only.
query I
SELECT count(*)
FROM get_lineage('lineage_history_statements.copy_dst.a', 'COLUMN', 'UPSTREAM', 1)
----
0

query I
SELECT count(*)
FROM get_lineage('lineage_history_statements.insert_select_stage_dst.a', 'COLUMN', 'UPSTREAM', 1)
----
0

query I
SELECT count(*)
FROM get_lineage('lineage_history_statements.insert_stage_dst.a', 'COLUMN', 'UPSTREAM', 1)
----
0

# System and information_schema describe runtime metadata rather than business datasets, so INSERT,
# CTAS, CREATE VIEW, and View refresh do not persist them as source endpoints.
query I
SELECT count(*)
FROM system_history.lineage_history
WHERE source_database IN ('system', 'information_schema')
  AND target_database = 'lineage_history_statements'
  AND target_name IN (
    'system_source_dst',
    'information_schema_source_dst',
    'system_source_view'
  )
----
0

statement ok
DROP DATABASE lineage_history_statements

statement ok
DROP STAGE lineage_history_statements_stage
