## Copyright 2023 Databend Cloud
##
## Licensed under the Elastic License, Version 2.0 (the "License");
## you may not use this file except in compliance with the License.
## You may obtain a copy of the License at
##
##     https://www.elastic.co/licensing/elastic-license
##
## Unless required by applicable law or agreed to in writing, software
## distributed under the License is distributed on an "AS IS" BASIS,
## WITHOUT WARRANTIES OR CONDITIONS OF ANY KIND, either express or implied.
## See the License for the specific language governing permissions and
## limitations under the License.

statement ok
set enable_experimental_table_ref=1;

statement ok
DROP DATABASE IF EXISTS test_vacuum2_table_ref

statement ok
CREATE DATABASE test_vacuum2_table_ref

statement ok
USE test_vacuum2_table_ref

statement ok
set data_retention_time_in_days = 0;

statement ok
CREATE OR REPLACE TABLE t1(c INT)

statement ok
INSERT INTO t1 VALUES (1), (2)

statement ok
ALTER TABLE t1 CREATE BRANCH b1

statement ok
INSERT INTO t1 VALUES (3)

statement ok
ALTER TABLE t1/b1 CREATE BRANCH b2

statement error
ALTER TABLE t1/b1 CREATE TAG t1

statement error 1002
OPTIMIZE TABLE t1 PURGE

statement error 1002
VACUUM TABLE t1

statement ok
select * from fuse_vacuum2('test_vacuum2_table_ref', 't1') ignore_result;

query I
SELECT c FROM t1/b1 ORDER BY c
----
1
2

query I
SELECT c FROM t1/b2 ORDER BY c
----
1
2

## -------------------------------------------------------
## Case 1:
## b1 owns new branch-only data, b2 is created from b1.
## After dropping b1, vacuum2 must keep b1-owned files alive
## because b2 still references them.
## After dropping b2, the old branch-only files can be reclaimed.
## -------------------------------------------------------

statement ok
CREATE OR REPLACE STAGE stage_branch_chain url = 'fs:///tmp/test_vacuum2_table_ref/branch_chain/';

statement ok
remove @stage_branch_chain;

statement ok
CREATE TABLE t_branch_chain(c INT) 'fs:///tmp/test_vacuum2_table_ref/branch_chain/';

statement ok
INSERT INTO t_branch_chain VALUES (1)

statement ok
ALTER TABLE t_branch_chain CREATE BRANCH b1

statement ok
INSERT INTO t_branch_chain/b1 VALUES (10)

statement ok
ALTER TABLE t_branch_chain/b1 CREATE BRANCH b2

query I
select count() from list_stage(location=> '@stage_branch_chain') where name like '%\/_b\/%';
----
2

statement ok
ALTER TABLE t_branch_chain DROP BRANCH b1

statement ok
SELECT SLEEP(1)

statement ok
select * from fuse_vacuum2('test_vacuum2_table_ref', 't_branch_chain') ignore_result;

query I
SELECT COUNT(*) FROM t_branch_chain
----
1

query I
SELECT COUNT(*) FROM t_branch_chain/b2
----
2

statement ok
ALTER TABLE t_branch_chain DROP BRANCH b2

statement ok
SELECT SLEEP(1)

statement ok
select * from fuse_vacuum2('test_vacuum2_table_ref', 't_branch_chain') ignore_result;

query I
SELECT COUNT(*) FROM t_branch_chain
----
1

query I
select count() from list_stage(location=> '@stage_branch_chain') where name like '%\/_b\/%';
----
1

statement error
SELECT COUNT(*) FROM t_branch_chain/b2

statement ok
remove @stage_branch_chain;

statement ok
drop stage stage_branch_chain;

## -------------------------------------------------------
## Case 2:
## Active tag protects old base-table files even after the base
## table has moved to a newer snapshot.
## -------------------------------------------------------

statement ok
CREATE OR REPLACE STAGE stage_tag_keep url = 'fs:///tmp/test_vacuum2_table_ref/tag_keep/';

statement ok
remove @stage_tag_keep;

statement ok
CREATE TABLE t_tag_keep(c INT) 'fs:///tmp/test_vacuum2_table_ref/tag_keep/';

statement ok
INSERT INTO t_tag_keep VALUES (1)

statement ok
ALTER TABLE t_tag_keep CREATE TAG keep_v1

statement ok
DELETE FROM t_tag_keep WHERE c >= 1

statement ok
INSERT INTO t_tag_keep VALUES (2)

query I
select count() from list_stage(location=> '@stage_tag_keep') where name like '%\/_b\/%';
----
2

statement ok
select * from fuse_vacuum2('test_vacuum2_table_ref', 't_tag_keep') ignore_result;

query I
SELECT COUNT(*) FROM t_tag_keep
----
1

query I
SELECT COUNT(*) FROM t_tag_keep AT (TAG => "keep_v1")
----
1

query I
select count() from list_stage(location=> '@stage_tag_keep') where name like '%\/_b\/%';
----
2

statement ok
ALTER TABLE t_tag_keep DROP TAG keep_v1

statement ok
select * from fuse_vacuum2('test_vacuum2_table_ref', 't_tag_keep') ignore_result;

query I
select count() from list_stage(location=> '@stage_tag_keep') where name like '%\/_b\/%';
----
1

statement ok
remove @stage_tag_keep;

statement ok
drop stage stage_tag_keep;

## -------------------------------------------------------
## Case 3:
## Expired tag no longer protects its historical files after vacuum2.
## -------------------------------------------------------

statement ok
CREATE OR REPLACE STAGE stage_tag_expired url = 'fs:///tmp/test_vacuum2_table_ref/tag_expired/';

statement ok
remove @stage_tag_expired;

statement ok
CREATE TABLE t_tag_expired(c INT) 'fs:///tmp/test_vacuum2_table_ref/tag_expired/';

statement ok
INSERT INTO t_tag_expired VALUES (1)

statement ok
ALTER TABLE t_tag_expired CREATE TAG temp_v1 RETAIN 1 SECONDS

statement ok
DELETE FROM t_tag_expired WHERE c >= 1

statement ok
INSERT INTO t_tag_expired VALUES (2)

query I
select count() from list_stage(location=> '@stage_tag_expired') where name like '%\/_b\/%';
----
2

statement ok
SELECT SLEEP(2)

statement ok
select * from fuse_vacuum2('test_vacuum2_table_ref', 't_tag_expired') ignore_result;

query I
SELECT COUNT(*) FROM t_tag_expired
----
1

query I
select count() from list_stage(location=> '@stage_tag_expired') where name like '%\/_b\/%';
----
1

statement error
SELECT COUNT(*) FROM t_tag_expired AT (TAG => "temp_v1")

statement ok
remove @stage_tag_expired;

statement ok
drop stage stage_tag_expired;

statement ok
DROP DATABASE test_vacuum2_table_ref
